Calle;Género;Nombre;Religioso;Ficción;Descripción;Artículo;Imagen;Fecha Nacimiento;Fecha Muerte;Céntrica
Carrer del Doctor August Pi i Sunyer;Hombre;Doctor August Pi i Sunyer;;;;;;;;
Carrer de Lluís Pericot;Hombre;Lluís Pericot;;;;;;;;
Carrer de Francesc Carbonell;Hombre;Francesc Carbonell;;;;;;;;
Carrer de Manuel de Falla;Hombre;Manuel de Falla;;;;;;;;
Carrer d'Eduardo Conde;Hombre;Eduardo Conde;;;;;;;;
Carrer dels Lamote de Grignon;Hombre;Lamote de Grignon;;;;;;;;
Avinguda de Joan XIII;Hombre;Joan XIII;;;;;;;;
Carrer d'Alvarado;Hombre;Alvarado;;;;;;;;
Carrer de Rodrigo Caro;Hombre;Rodrigo Caro;;;;;;;;
Avinguda de J. V. Foix;Hombre;J. V. Foix;;;;;;;;
Carrer de Carles Riba;Hombre;Carles Riba;;;;;;;;
Carrer de Josep Canaleta;Hombre;Josep Canaleta;;;;;;;;
Carrer de Teodor Roviralta;Hombre;Teodor Roviralta;;;;;;;;
Camí del Cementiri de Sant Gervasi;Hombre;Cementiri de Sant Gervasi;;;;;;;;
Carrer de Lluís Marià Vidal;Hombre;Lluís Marià Vidal;;;;;;;;
Carrer de Calderón de la Barca;Hombre;Calderón de la Barca;;;;;;;;
Carrer del Puig Castellar;Hombre;Puig Castellar;;;;;;;;
Carrer del Mas Pujol;Hombre;Mas Pujol;;;;;;;;
Carrer del Doctor Coll;Hombre;Doctor Coll;;;;;;;;
Carrer de Dalmau de Creixell;Hombre;Dalmau de Creixell;;;;;;;;
Carrer d'Aguilar;Hombre;Aguilar;;;;;;;;
Carrer de Joan Manén;Hombre;Joan Manén;;;;;;;;
Avinguda de Frederic Rahola;Hombre;Frederic Rahola;;;;;;;;
Carrer de Feliu;Hombre;Feliu;;;;;;;;
Carrer de Camil Oliveras;Hombre;Camil Oliveras;;;;;;;;
Carrer de Pasteur;Hombre;Pasteur;;;;;;;;
Carrer de Marià Labèrnia;Hombre;Marià Labèrnia;;;;;;;;
Plaça d'Ildefons Cerdà;Hombre;Ildefons Cerdà;;;;;;;;
Carrer de John M. Keynes;Hombre;John M. Keynes;;;;;;;;
Carrer de Ferran Puig;Hombre;Ferran Puig;;;;;;;;
Carrer de Virgili;Hombre;Virgili;;;;;;;;
Carrer de Liuva;Hombre;Liuva;;;;;;;;
Carrer de Berenguer de Palou;Hombre;Berenguer de Palou;;;;;;;;
Plaça de Sant Josep;Hombre;Sant Josep;;;;;;;;1
Carrer de Sant Hermenegild;Hombre;Sant Hermenegild;;;;;;;;
Carrer de Balmes;Hombre;Balmes;;;;;;;;1
Carrer de Guillem Tell;Hombre;Guillem Tell;;;;;;;;
Carrer de Tavern;Hombre;Tavern;;;;;;;;
Carrer de Marc Aureli;Hombre;Marc Aureli;;;;;;;;
Carrer de Sant Guillem;Hombre;Sant Guillem;;;;;;;;
Carrer de Sant Elies;Hombre;Sant Elies;;;;;;;;
Carrer de Descartes;Hombre;Descartes;;;;;;;;
Carrer de Plató;Hombre;Plató;;;;;;;;
Carrer de Lincoln;Hombre;Lincoln;;;;;;;;
Passatge de Sant Felip;Hombre;Sant Felip;;;;;;;;
Carrer de Sant Magí;Hombre;Sant Magí;;;;;;;;
Carrer de Mossèn Xiró;Hombre;Mossèn Xiró;;;;;;;;
Carrer d'Arnold Schönberg;Hombre;Arnold Schönberg;;;;;;;;
Carrer de Sant Eloi;Hombre;Sant Eloi;;;;;;;;
Carrer del Pare Jacint Alegre;Hombre;Pare Jacint Alegre;;;;;;;;
Carrer de Pérez Galdós;Hombre;Pérez Galdós;;;;;;;;
Carrer de Lluís Bonifaç;Hombre;Lluís Bonifaç;;;;;;;;
Carrer de Sant Eudald;Hombre;Sant Eudald;;;;;;;;
Baixada de Sant Marià;Hombre;Sant Marià;;;;;;;;
Carrer de Tirso;Hombre;Tirso;;;;;;;;
Carrer de Ticià;Hombre;Ticià;;;;;;;;
Carrer de Josep Jover;Hombre;Josep Jover;;;;;;;;
Plaça d'Alfonso Comín;Hombre;Alfonso Comín;;;;;;;;
Carrer de Gustavo Bécquer;Hombre;Gustavo Bécquer;;;;;;;;
Carrer de Cesare Cantù;Hombre;Cesare Cantù;;;;;;;;
Carrer de Sant Camil;Hombre;Sant Camil;;;;;;;;
Carrer de Sant Marc;Hombre;Sant Marc;;;;;;;;
Carrer de Julià;Hombre;Julià;;;;;;;;
Carrer de Leopoldo Alas;Hombre;Leopoldo Alas;;;;;;;;
Carrer de Ramis;Hombre;Ramis;;;;;;;;
Carrer de Sant Eusebi;Hombre;Sant Eusebi;;;;;;;;
Carrer del Profeta;Hombre;Profeta;;;;;;;;
Carrer de Milton;Hombre;Milton;;;;;;;;
Carrer de Nil Fabra;Hombre;Nil Fabra;;;;;;;;
Carrer de Mossèn Masdexexart;Hombre;Mossèn Masdexexart;;;;;;;;
Carrer d'Arnau d'Oms;Hombre;Arnau d'Oms;;;;;;;;
Carrer de Pau Gargallo;Hombre;Pau Gargallo;;;;;;;;
Passeig de Sant Joan Bosco;Hombre;Sant Joan Bosco;;;;;;;;
Carrer de Jaume Piquet;Hombre;Jaume Piquet;;;;;;;;
Carrer de Mendel;Hombre;Mendel;;;;;;;;
Carrer del General Mendoza;Hombre;General Mendoza;;;;;;;;
Carrer de Salvador Mundí;Hombre;Salvador Mundí;;;;;;;;
carrer de Pere Tarrés;Hombre;Pere Tarrés;;;;;;;;
carrer del Pare Miquel de Sarrià;Hombre;Pare Miquel de Sarrià;;;;;;;;
Plaça de Sant Vicenç de Sarrià;Hombre;Sant Vicenç de Sarrià;;;;;;;;
Carrer de l'Abat Samsó;Hombre;l'Abat Samsó;;;;;;;;
Carrer d'Oriol Mestres;Hombre;Oriol Mestres;;;;;;;;
Carrer de Pascual i Vila;Hombre;Pascual i Vila;;;;;;;;
Carrer de Martí i Franquès;Hombre;Martí i Franquès;;;;;;;;
Carrer del Cardenal Tedeschini;Hombre;Cardenal Tedeschini;;;;;;;;
Carrer d'Antonio Ricardos;Hombre;Antonio Ricardos;;;;;;;;
Carrer Ponce de León;Hombre;Ponce de León;;;;;;;;
Carrer de Joan Riera;Hombre;Joan Riera;;;;;;;;
Carrer d'Alonso Cano;Hombre;Alonso Cano;;;;;;;;
Carrer d'Antoni Gilabert i Bonet;Hombre;Antoni Gilabert i Bonet;;;;;;;;
Carrer de Sant Onofre;Hombre;Sant Onofre;;;;;;;;
Carrer d'Esteve Terradas;Hombre;Esteve Terradas;;;;;;;;
Carrer de Sant Antoni Maria Claret;Hombre;Sant Antoni Maria Claret;;;;;;;;
Carrer del Doctor Font i Quer;Hombre;Doctor Font i Quer;;;;;;;;
Carrer de Bolívar;Hombre;Bolívar;;;;;;;;
Carrer de Josep Garí;Hombre;Josep Garí;;;;;;;;
Carrer del Baró de la Barre;Hombre;Baró de la Barre;;;;;;;;
Carrer de Ca l'Alegre;Hombre;Ca l'Alegre;;;;;;;;
Carrer de Carles Pirozzini;Hombre;Carles Pirozzini;;;;;;;;
Carrer d'Enric Clarassó;Hombre;Enric Clarassó;;;;;;;;
Carrer de Salvador Alarma;Hombre;Salvador Alarma;;;;;;;;
Carrer d'August Font;Hombre;August Font;;;;;;;;
Carrer de Josep Maria Pujol;Hombre;Josep Maria Pujol;;;;;;;;
Avinguda d'Adrià Gual;Hombre;Adrià Gual;;;;;;;;
Carrer de Josep Maria Sert;Hombre;Josep Maria Sert;;;;;;;;
Carrer de Lluís Muntadas;Hombre;Lluís Muntadas;;;;;;;;
Avinguda d'Elies Pagès;Hombre;Elies Pagès;;;;;;;;
Carrer de Baldomer Girona;Hombre;Baldomer Girona;;;;;;;;
Carrer de Ramon Mas;Hombre;Ramon Mas;;;;;;;;1
Carrer de Sant Gervasi de Cassoles;Hombre;Sant Gervasi de Cassoles;;;;;;;;
Carrer de Rubén Darío;Hombre;Rubén Darío;;;;;;;;
Carrer del Pare Secchi;Hombre;Pare Secchi;;;;;;;;
Carrer de Garcilaso;Hombre;Garcilaso;;;;;;;;
Carrer del Pont de Sant Martí;Hombre;Pont de Sant Martí;;;;;;;;
Carrer del Pare Manyanet;Hombre;Pare Manyanet;;;;;;;;
Carrer de Felip II;Hombre;Felip II;;;;;;;;
Carrer de la Font de Sant Miquel;Hombre;Font de Sant Miquel;;;;;;;;1
Carrer d'Apel·les Mestres;Hombre;Apel·les Mestres;;;;;;;;
Carrer de Juan de Garay;Hombre;Juan de Garay;;;;;;;;
Carrer de Lucà;Hombre;Lucà;;;;;;;;
Carrer d'Isaac Newton;Hombre;Isaac Newton;;;;;;;;
Carrer de l'Arc de Sant Ramon del Call;Hombre;l'Arc de Sant Ramon del Call;;;;;;;;1
Carrer d'Agustí Mauri;Hombre;Agustí Mauri;;;;;;;;
Carrer de Simón Ferrer;Hombre;Simón Ferrer;;;;;;;;
Carrer de Jaume Pinent;Hombre;Jaume Pinent;;;;;;;;
Carrer de Can Valero;Hombre;Can Valero;;;;;;;;
Passeig d'Andreu Nin;Hombre;Andreu Nin;;;;;;;;
Carrer de Lluc;Hombre;Lluc;;;;;;;;
Carrer de Badosa;Hombre;Badosa;;;;;;;;
Carrer de Baltasar Gracián;Hombre;Baltasar Gracián;;;;;;;;
Carrer de Dante Alighieri;Hombre;Dante Alighieri;;;;;;;;
Carrer de Ramon Albó;Hombre;Ramon Albó;;;;;;;;
Carrer del Doctor Pi i Molist;Hombre;Doctor Pi i Molist;;;;;;;;
Carrer d'Hernán Cortés;Hombre;Hernán Cortés;;;;;;;;
Carrer de Lope de Vega;Hombre;Lope de Vega;;;;;;;;
Carrer del Doctor Ibáñez;Hombre;Doctor Ibáñez;;;;;;;;
Carrer de Papin;Hombre;Papin;;;;;;;;
Carrer dels Germans Desvalls;Hombre;Germans Desvalls;;;;;;;;
Carrer de Sant Medir;Hombre;Sant Medir;;;;;;;;
Carrer de Wellington;Hombre;Wellington;;;;;;;;
Carrer Demostenes;Hombre;Demostenes;;;;;;;;
Plaça d'Antoni Pérez i Moya;Hombre;Antoni Pérez i Moya;;;;;;;;
Carrer de Miquel Bleach;Hombre;Miquel Bleach;;;;;;;;
Carrer de Gerard Piera;Hombre;Gerard Piera;;;;;;;;
Carrer d'en Bot;Hombre;en Bot;;;;;;;;1
Plaça del Doctor Letamendi;Hombre;Doctor Letamendi;;;;;;;;
Passatge de Domingo;Hombre;Domingo;;;;;;;;
Carrer de Sant Joan de la Salle;Hombre;Sant Joan de la Salle;;;;;;;;
Carrer del Doctor Santponç;Hombre;Doctor Santponç;;;;;;;;
Avinguda del Cardenal Vidal i Barraquer;Hombre;Cardenal Vidal i Barraquer;;;;;;;;
Carrer de Ciceró;Hombre;Ciceró;;;;;;;;
Carrer Major del Rectoret;Hombre;Major del Rectoret;;;;;;;;
Avinguda de Joan Carles I;Hombre;Joan Carles I;;;;;;;;
Carrer d'Horaci;Hombre;Horaci;;;;;;;;
Carrer de Josep Samitier;Hombre;Josep Samitier;;;;;;;;
Carrer de Baldiri Reixac;Hombre;Baldiri Reixac;;;;;;;;
Passatge de Jaume Roig;Hombre;Jaume Roig;;;;;;;;
Carrer d'En Blanco;Hombre;En Blanco;;;;;;;;
Carrer de Vidal i Guasch;Hombre;Vidal i Guasch;;;;;;;;
Passatge d'Antoni Gassol;Hombre;Antoni Gassol;;;;;;;;
Ronda Sant Martí;Hombre;Sant Martí;;;;;;;;
Carrer de Joan Torras;Hombre;Joan Torras;;;;;;;;
Carrer del Doctor Balari i Jovany;Hombre;Doctor Balari i Jovany;;;;;;;;
Carrer de l'Abat Odó;Hombre;l'Abat Odó;;;;;;;;
Carrer de Sòcrates;Hombre;Sòcrates;;;;;;;;
Carrer d'Arquímedes;Hombre;Arquímedes;;;;;;;;
Carrer de Sant Marià;Hombre;Sant Marià;;;;;;;;
Plaça de Mossèn Clapés;Hombre;Mossèn Clapés;;;;;;;;
Carrer del Beat Domènec Savio;Hombre;Beat Domènec Savio;;;;;;;;
Carrer de Jaume Fabra;Hombre;Jaume Fabra;;;;;;;;
Carrer de Samaniego;Hombre;Samaniego;;;;;;;;
Avinguda de Gaudí;Hombre;Gaudí;;;;;;;;
Camí de Sant Cugat;Hombre;Sant Cugat;;;;;;;;
Carrer del Pare Mariana;Hombre;Pare Mariana;;;;;;;;
Carrer de Juan de Mena;Hombre;Juan de Mena;;;;;;;;
Carrer de Jorge Manrique;Hombre;Jorge Manrique;;;;;;;;
Pas d'Isadora Duncan;Hombre;Pas d'Isadora Duncan;;;;;;;;
Carrer del Duc de Rivas;Hombre;Duc de Rivas;;;;;;;;
Carrer de Sant Crispí;Hombre;Sant Crispí;;;;;;;;
Carrer Salvador Cardenal;Hombre;Salvador Cardenal;;;;;;;;
Carrer de Juan Ramón Jiménez;Hombre;Juan Ramón Jiménez;;;;;;;;
Carrer d'Alfons XII;Hombre;Alfons XII;;;;;;;;
Camí Antic de Sant Llàtzer;Hombre;Antic de Sant Llàtzer;;;;;;;;
Carrer de Roman Macaya;Hombre;Roman Macaya;;;;;;;;
Carrer de Josep Bertrand;Hombre;Josep Bertrand;;;;;;;;
Carrer d'Ignasi Iglésias;Hombre;Ignasi Iglésias;;;;;;;;
Carrer de Lázaro Cárdenas;Hombre;Lázaro Cárdenas;;;;;;;;
Carrer dels Valero;Hombre;Valero;;;;;;;;
Carrer de Castelló;Hombre;Castelló;;;;;;;;
Camí de Sir Edmund Hillary;Hombre;Sir Edmund Hillary;;;;;;;;
Carrer de Pedro i Pons;Hombre;Pedro i Pons;;;;;;;;
Avinguda de Pompeu Fabra;Hombre;Pompeu Fabra;;;;;;;;
Carrer de Rafael Batlle;Hombre;Rafael Batlle;;;;;;;;
Carrer d'Àngel Guimerà;Hombre;Àngel Guimerà;;;;;;;;
Carrer de José de Agulló;Hombre;José de Agulló;;;;;;;;
Plaça de Joaquim Pena;Hombre;Joaquim Pena;;;;;;;;
Plaça del Doctor Ignasi Barraquer;Hombre;Doctor Ignasi Barraquer;;;;;;;;
Plaça de Jaume II;Hombre;Jaume II;;;;;;;;
Carrer d'en Fontrodona;Hombre;en Fontrodona;;;;;;;;
Carrer del Mestre Dalmau;Hombre;Mestre Dalmau;;;;;;;;
Carrer de Pierre de Coubertin;Hombre;Pierre de Coubertin;;;;;;;;
Carrer de Mir Geribert;Hombre;Mir Geribert;;;;;;;;
Carrer de Sant Rafael;Hombre;Sant Rafael;;;;;;;;1
Carrer de Sant Josep Oriol;Hombre;Sant Josep Oriol;;;;;;;;1
Carrer d'Eduard Toda;Hombre;Eduard Toda;;;;;;;;
Carrer del Doctor Letamendi;Hombre;Doctor Letamendi;;;;;;;;
Plaça de Sant Francesc Xavier;Hombre;Sant Francesc Xavier;;;;;;;;
Carrer de Miquel dels Sants Oliver;Hombre;Miquel dels Sants Oliver;;;;;;;;
Carrer de Francesc Alegre;Hombre;Francesc Alegre;;;;;;;;
Carrer d'Albert Llanas;Hombre;Albert Llanas;;;;;;;;
Carrer de Josep Ciurana;Hombre;Josep Ciurana;;;;;;;;
Carrer del Doctor Cadevall;Hombre;Doctor Cadevall;;;;;;;;
Plaça de Dante;Hombre;Dante;;;;;;;;
Carrer de Sant Ferriol;Hombre;Sant Ferriol;;;;;;;;
Avinguda de Can Baró;Hombre;Can Baró;;;;;;;;
Passatge d'en Xinxó;Hombre;en Xinxó;;;;;;;;
Carrer de Bernat Bransi;Hombre;Bernat Bransi;;;;;;;;
Passatge de Marí;Hombre;Marí;;;;;;;;
Passeig de Joan Salvat Papasseit;Hombre;Joan Salvat Papasseit;;;;;;;;
Carrer Miquel Boera;Hombre;Miquel Boera;;;;;;;;
Carrer de Trelawny;Hombre;Trelawny;;;;;;;;
carrer del Doctor Giné i Partagàs;Hombre;Doctor Giné i Partagàs;;;;;;;;
Carrer de García Mariño;Hombre;García Mariño;;;;;;;;
Avinguda de Francesc Ferrer i Guàrdia;Hombre;Francesc Ferrer i Guàrdia;;;;;;;;
Carrer de Sant Fructuós;Hombre;Sant Fructuós;;;;;;;;
Carrer de Juan Gris;Hombre;Juan Gris;;;;;;;;
Carrer de Sant Gaudenci;Hombre;Sant Gaudenci;;;;;;;;
Carrer de Carles Collet;Hombre;Carles Collet;;;;;;;;
Carrer de Rembrandt;Hombre;Rembrandt;;;;;;;;
Carrer del Pintor Josep Pinos;Hombre;Pintor Josep Pinos;;;;;;;;
Carrer de Sant Bernabe;Hombre;Sant Bernabe;;;;;;;;
Carrer de Sant Iscle;Hombre;Sant Iscle;;;;;;;;
Passatge de Porta;Hombre;Porta;;;;;;;;
Passatge del Doctor Pi i Molist;Hombre;Doctor Pi i Molist;;;;;;;;
Passatge Sant Ramon Nonat;Hombre;Sant Ramon Nonat;;;;;;;;
Passatge Vicent Martín;Hombre;Vicent Martín;;;;;;;;
Carrer del Pintor Gimeno;Hombre;Pintor Gimeno;;;;;;;;
Carrer de Josep Balari;Hombre;Josep Balari;;;;;;;;
Carrer del Comte de Sert;Hombre;Comte de Sert;;;;;;;;
Carrer d'Adrià Margarit;Hombre;Adrià Margarit;;;;;;;;
Carrer d'Evarist Arnús;Hombre;Evarist Arnús;;;;;;;;
Carrer de Rossend Nobas;Hombre;Rossend Nobas;;;;;;;;
Carrer d'Edison;Hombre;Edison;;;;;;;;
Carrer de Dalmau;Hombre;Dalmau;;;;;;;;
Carrer de Joan Sales;Hombre;Joan Sales;;;;;;;;
Plaça Mossèn Ferran Palau;Hombre;Mossèn Ferran Palau;;;;;;;;
Avinguda de Josep Tarradellas;Hombre;Josep Tarradellas;;;;;;;;
Carrer de Sant Baltasar;Hombre;Sant Baltasar;;;;;;;;
Carrer Llorens i Artigas;Hombre;Llorens i Artigas;;;;;;;;
Carrer de Porta;Hombre;Porta;;;;;;;;
Carrer de Felip Bertran i Güell;Hombre;Felip Bertran i Güell;;;;;;;;
Carrer d'Alexandre Galí;Hombre;Alexandre Galí;;;;;;;;
Carrer de Can Ros;Hombre;Can Ros;;;;;;;;
Carrer del Pare Roldós;Hombre;Pare Roldós;;;;;;;;
Carrer de Sant Pere;Hombre;Sant Pere;;;;;;;;
Carrer del Doctor Valls;Hombre;Doctor Valls;;;;;;;;
Carrer de Sant Alexandre;Hombre;Sant Alexandre;;;;;;;;
Baixada de Rivero;Hombre;Rivero;;;;;;;;
Baixada de Can Mateu;Hombre;Can Mateu;;;;;;;;
Carrer de Frederic Mompou;Hombre;Frederic Mompou;;;;;;;;
Carrer Bartomeu Pi;Hombre;Bartomeu Pi;;;;;;;;
Carrer de Joan I;Hombre;Joan I;;;;;;;;
Carrer de Goya;Hombre;Goya;;;;;;;;
Carrer de Ramon Batlle;Hombre;Ramon Batlle;;;;;;;;
Plaça del Doctor Cararach Mauri;Hombre;Doctor Cararach Mauri;;;;;;;;
Carrer de Sant Francesc;Hombre;Sant Francesc;;;;;;;;
Carrer d'Eduard Fontserè;Hombre;Eduard Fontserè;;;;;;;;
Plaça d'Emili Mira;Hombre;Emili Mira;;;;;;;;
Carrer de Mossèn Vives;Hombre;Mossèn Vives;;;;;;;;
Carrer de Jules Verne;Hombre;Jules Verne;;;;;;;;
Carrer de Sant Delfí;Hombre;Sant Delfí;;;;;;;;
Carrer de Bertrand i Serra;Hombre;Bertrand i Serra;;;;;;;;
Passatge Lluis Pellicer;Hombre;Lluis Pellicer;;;;;;;;
Passeig Marítim de Gabriel Roca;Hombre;Marítim de Gabriel Roca;;;;;;;;
Ronda de Sant Antoni;Hombre;Sant Antoni;;;;;;;;
Avinguda Arturo Mundet;Hombre;Arturo Mundet;;;;;;;;
Carrer de Josep Maria Lladó;Hombre;Josep Maria Lladó;;;;;;;;
Carrer de Ramon Llull;Hombre;Ramon Llull;;;;;;;;
Passatge de Feliu;Hombre;Feliu;;;;;;;;
Passatge de Sant Jaume;Hombre;Sant Jaume;;;;;;;;
Carrer de Gaspar Casadó;Hombre;Gaspar Casadó;;;;;;;;
Carrer de Valentí Iglésias;Hombre;Valentí Iglésias;;;;;;;;
Carrer de Grau;Hombre;Grau;;;;;;;;
Carrer de Pardo;Hombre;Pardo;;;;;;;;
Passatge de Salvador Riera;Hombre;Salvador Riera;;;;;;;;
Carrer de Campo Florido;Hombre;Campo Florido;;;;;;;;
Carrer de Rafael Capdevila;Hombre;Rafael Capdevila;;;;;;;;
Passatge de Joan Casas;Hombre;Joan Casas;;;;;;;;
Carrer d'en Grassot;Hombre;en Grassot;;;;;;;;
Passatge de Mariner;Hombre;Mariner;;;;;;;;
Carrer de Lluís Vives;Hombre;Lluís Vives;;;;;;;;
Passatge de Sant Joan de Malta;Hombre;Sant Joan de Malta;;;;;;;;
Carrer de Sant Mateu;Hombre;Sant Mateu;;;;;;;;
Carrer de Manel Ballbé;Hombre;Manel Ballbé;;;;;;;;
Carrer d'Enric Casanovas;Hombre;Enric Casanovas;;;;;;;;
Avinguda de Can Marcet;Hombre;Can Marcet;;;;;;;;
Carrer de Jordà;Hombre;Jordà;;;;;;;;
Carrer d'en Panxampla;Hombre;en Panxampla;;;;;;;;
camí de Can Balasch;Hombre;Can Balasch;;;;;;;;
Carrer de Damià Forment;Hombre;Damià Forment;;;;;;;;
Carrer de Jaume Cascalls;Hombre;Jaume Cascalls;;;;;;;;
Carrer de Fernán Caballero;Hombre;Fernán Caballero;;;;;;;;
Carrer de Juan de Ávila;Hombre;Juan de Ávila;;;;;;;;
Camí de Sant Genís a Horta;Hombre;Sant Genís a Horta;;;;;;;;
Passeig de Sant Francesc;Hombre;Sant Francesc;;;;;;;;
Passatge Pearson;Hombre;Pearson;;;;;;;;
Carrer de Lluís Nicolau i d'Olwer;Hombre;Lluís Nicolau i d'Olwer;;;;;;;;
Camí del Mas Guimbau;Hombre;Mas Guimbau;;;;;;;;
Carrer de l'Abat Teodor;Hombre;l'Abat Teodor;;;;;;;;
Passeig de Claudi Güell;Hombre;Claudi Güell;;;;;;;;
Carrer de Can Falgàs;Hombre;Can Falgàs;;;;;;;;
Carrer d'en Puig d'Óssa;Hombre;en Puig d'Óssa;;;;;;;;
Carrer d'Eduard Toldrà;Hombre;Eduard Toldrà;;;;;;;;
Carrer de Martí i Julià;Hombre;Martí i Julià;;;;;;;;
Carrer de Josep Irla i Bosch;Hombre;Josep Irla i Bosch;;;;;;;;
Plaça de Joan Llongueras;Hombre;Joan Llongueras;;;;;;;;
Plaça de Wagner;Hombre;Wagner;;;;;;;;
Carrer de Can Ràbia;Hombre;Can Ràbia;;;;;;;;
Carrer de Jacinto Benavente;Hombre;Jacinto Benavente;;;;;;;;
Carrer de Mozart;Hombre;Mozart;;;;;;;;
Carrer de Robert Gerhard;Hombre;Robert Gerhard;;;;;;;;
Carrer d'Antoni Alberdi;Hombre;Antoni Alberdi;;;;;;;;
Passatge de Ricard Zamora;Hombre;Ricard Zamora;;;;;;;;
Carrer de Fra Luis de Granada;Hombre;Fra Luis de Granada;;;;;;;;
Carrer de Benet Mateu;Hombre;Benet Mateu;;;;;;;;
Carrer d'en Boltres;Hombre;en Boltres;;;;;;;;1
Plaça del Duc de Medinaceli;Hombre;Duc de Medinaceli;;;;;;;;1
Passatge del Patriarca;Hombre;Patriarca;;;;;;;;
Pas de Ramon Cabau;Hombre;Pas de Ramon Cabau;;;;;;;;1
Carrer Sant Josep;Hombre;Sant Josep;;;;;;;;
Carrer de Jordi Rubió i Balaguer;Hombre;Jordi Rubió i Balaguer;;;;;;;;
Plaça d'Henry Dunant;Hombre;Henry Dunant;;;;;;;;
Carrer de l'Hostal de Sant Antoni;Hombre;l'Hostal de Sant Antoni;;;;;;;;1
Carrer de Nicolau de Sant Climent;Hombre;Nicolau de Sant Climent;;;;;;;;1
Carrer de la Volta d'en Bufanalla;Hombre;Volta d'en Bufanalla;;;;;;;;1
carrer de Marín;Hombre;Marín;;;;;;;;
Carrer de Carlos Soldevila;Hombre;Carlos Soldevila;;;;;;;;
Plaça de Narcís Oller;Hombre;Narcís Oller;;;;;;;;
Carrer Príncep de Viana;Hombre;Príncep de Viana;;;;;;;;
Carrer de Lohengrin;Hombre;Lohengrin;;;;;;;;
Carrer de Marco Polo;Hombre;Marco Polo;;;;;;;;
Passatge de Garcia Cambra;Hombre;Garcia Cambra;;;;;;;;
Carrer del Taquígraf Serra;Hombre;Taquígraf Serra;;;;;;;;
Carrer de Can Segalar;Hombre;Can Segalar;;;;;;;;
Plaça de Joan Fiveller;Hombre;Joan Fiveller;;;;;;;;1
Carrer de Bosch;Hombre;Bosch;;;;;;;;
Passatge d'Alió;Hombre;Alió;;;;;;;;
plaça de Castelló;Hombre;Castelló;;;;;;;;
Carrer de Sant Nicolau;Hombre;Sant Nicolau;;;;;;;;
Carrer de Jaume Puigvert;Hombre;Jaume Puigvert;;;;;;;;
Carrer de Pere Sala;Hombre;Pere Sala;;;;;;;;
Plaça de John F. Kennedy;Hombre;John F. Kennedy;;;;;;;;
Carrer de Can Bruixa;Hombre;Can Bruixa;;;;;;;;
Carrer de Tirso de Molina;Hombre;Tirso de Molina;;;;;;;;
Carrer del Doctor Bové;Hombre;Doctor Bové;;;;;;;;
Carrer de Sant Josep Cottolengo;Hombre;Sant Josep Cottolengo;;;;;;;;
Carrer de Joan Comorera;Hombre;Joan Comorera;;;;;;;;
Carrer d'Anníbal;Hombre;Anníbal;;;;;;;;
Carrer de Sancho Marraco;Hombre;Sancho Marraco;;;;;;;;
Carrer del Cardenal de Sentmenat;Hombre;Cardenal de Sentmenat;;;;;;;;
Carrer de Maurici Vilomara;Hombre;Maurici Vilomara;;;;;;;;
Carrer de Peris i Mencheta;Hombre;Peris i Mencheta;;;;;;;;
Carrer de Mossèn Josep Bundó;Hombre;Mossèn Josep Bundó;;;;;;;;
Carrer del Comte d'Urgell;Hombre;Comte d'Urgell;;;;;;;;
Carrer Rector Bruguera;Hombre;Rector Bruguera;;;;;;;;
Carrer de Martí Molins;Hombre;Martí Molins;;;;;;;;
Carrer de Sant Sebastià;Hombre;Sant Sebastià;;;;;;;;
Passatge d'en Sagristà;Hombre;en Sagristà;;;;;;;;
Carrer del Prat d'en Rull;Hombre;Prat d'en Rull;;;;;;;;
Carrer del Doctor Zamenhof;Hombre;Doctor Zamenhof;;;;;;;;
Carrer del Mestre Nicolau;Hombre;Mestre Nicolau;;;;;;;;
Passatge de Sant Pere;Hombre;Sant Pere;;;;;;;;
Carrer de Josep Sangenís;Hombre;Josep Sangenís;;;;;;;;
Carrer de Saturnino Calleja;Hombre;Saturnino Calleja;;;;;;;;
Carrer d'Arnau;Hombre;Arnau;;;;;;;;
Carrer de Francesc Bolòs;Hombre;Francesc Bolòs;;;;;;;;
Carrer de Miquel Ferrà;Hombre;Miquel Ferrà;;;;;;;;
Carrer de Santiago Rusiñol;Hombre;Santiago Rusiñol;;;;;;;;
Carrer de Sant Manuel;Hombre;Sant Manuel;;;;;;;;
Carrer de Sant Ferran;Hombre;Sant Ferran;;;;;;;;
Carrer d'Euclides;Hombre;Euclides;;;;;;;;
Carrer del Pintor Mir;Hombre;Pintor Mir;;;;;;;;
Passatge de Grau;Hombre;Grau;;;;;;;;
Carrer de Sant Salvador;Hombre;Sant Salvador;;;;;;;;
carrer de Pere d'Artés;Hombre;Pere d'Artés;;;;;;;;
Carrer de l'Avió Plus Ultra;Hombre;l'Avió Plus Ultra;;;;;;;;
Passeig de Manuel Girona;Hombre;Manuel Girona;;;;;;;;
Passatge de Julià;Hombre;Julià;;;;;;;;
Camí de Can Castellví;Hombre;Can Castellví;;;;;;;;
Camí de Plà Llorens;Hombre;Plà Llorens;;;;;;;;
Carrer de Ricardo Calvo;Hombre;Ricardo Calvo;;;;;;;;
plaça Major del Rectoret;Hombre;Major del Rectoret;;;;;;;;
Plaça Miguel de Unamuno;Hombre;Miguel de Unamuno;;;;;;;;
Avinguda de Pau Casals;Hombre;Pau Casals;;;;;;;;
Carrer de Francesc Pérez-Cabrero;Hombre;Francesc Pérez-Cabrero;;;;;;;;
Carrer del Pare Manjón;Hombre;Pare Manjón;;;;;;;;
Carrer del Pare Pérez del Pulgar;Hombre;Pare Pérez del Pulgar;;;;;;;;
Carrer de Llorens i Barba;Hombre;Llorens i Barba;;;;;;;;
Passatge de Pau Hernández;Hombre;Pau Hernández;;;;;;;;
Carrer de José Millán González;Hombre;José Millán González;;;;;;;;
Carrer de Camil Fabra;Hombre;Camil Fabra;;;;;;;;
Plaça de Joan Peiró;Hombre;Joan Peiró;;;;;;;;
Carrer de Lluís Solé i Sabarís;Hombre;Lluís Solé i Sabarís;;;;;;;;
Carrer d'Àngel Marquès;Hombre;Àngel Marquès;;;;;;;;
Passatge del Camí Mas Sauro;Hombre;Camí Mas Sauro;;;;;;;;
Camí de Mas Sauró;Hombre;Mas Sauró;;;;;;;;
Carrer de Juan Valera;Hombre;Juan Valera;;;;;;;;
Carrer de Chopin;Hombre;Chopin;;;;;;;;
Carrer de Josep Soldevila;Hombre;Josep Soldevila;;;;;;;;
Passatge d'Alfonso Lafuente;Hombre;Alfonso Lafuente;;;;;;;;
Carrer de Sant Germà;Hombre;Sant Germà;;;;;;;;
Passatge d'Albert Pinyol;Hombre;Albert Pinyol;;;;;;;;
Plaça de Miquel Casablancas i Joanico;Hombre;Miquel Casablancas i Joanico;;;;;;;;
Carrer Duran i Borell;Hombre;Duran i Borell;;;;;;;;
Carrer de Pau Ferran;Hombre;Pau Ferran;;;;;;;;
Carrer de Joan B. Cendrós;Hombre;Joan B. Cendrós;;;;;;;;
Carrer del Doctor Carulla;Hombre;Doctor Carulla;;;;;;;;
Carrer de Pau Sabater;Hombre;Pau Sabater;;;;;;;;
Sant Oleguer;Hombre;Sant Oleguer;;;;;;;;
Carrer Sant Quirze Safaja;Hombre;Sant Quirze Safaja;;;;;;;;
Carrer de Can Travi;Hombre;Can Travi;;;;;;;;
Carrer de Joan de Peguera;Hombre;Joan de Peguera;;;;;;;;
Carrer de Jaume Càncer;Hombre;Jaume Càncer;;;;;;;;
Carrer de Joan Miró;Hombre;Joan Miró;;;;;;;;
Sant Jordi;Hombre;Sant Jordi;;;;;;;;
Carrer de Josep Pijoan;Hombre;Josep Pijoan;;;;;;;;1
Carrer d'Agustí Duran i Sanpere;Hombre;Agustí Duran i Sanpere;;;;;;;;1
Plaça de Llorca;Hombre;Llorca;;;;;;;;
passeig de Sant Joan de Déu;Hombre;passeig de Sant Joan de Déu;;;;;;;;
Carrer de les Coves d'en Cimany;Hombre;les Coves d'en Cimany;;;;;;;;
Carrer de Sant Feliu de Guíxols;Hombre;Sant Feliu de Guíxols;;;;;;;;
Carrer de Teodor Llorente;Hombre;Teodor Llorente;;;;;;;;
Camí de Tenzing Norgay;Hombre;Tenzing Norgay;;;;;;;;
Sant Francesc;Hombre;Sant Francesc;;;;;;;;
Carrer de Torres i Amat;Hombre;Torres i Amat;;;;;;;;1
Passatge de Ricard Canals;Hombre;Ricard Canals;;;;;;;;
Carrer de Guerau de Liost;Hombre;Guerau de Liost;;;;;;;;
Carrer de Simó Oller;Hombre;Simó Oller;;;;;;;;1
Carrer del Doctor Ferran;Hombre;Doctor Ferran;;;;;;;;
Carrer de Roger de Llúria;Hombre;Roger de Llúria;;;;;;;;1
Passeig de Can Tunis;Hombre;Can Tunis;;;;;;;;
Carrer d'Eugeni d'Ors;Hombre;Eugeni d'Ors;;;;;;;;
Carrer de Sant Ignasi;Hombre;Sant Ignasi;;;;;;;;1
Carrer de Sant Simplici;Hombre;Sant Simplici;;;;;;;;1
Carrer del Taquígraf Martí;Hombre;Taquígraf Martí;;;;;;;;
Carrer de Rere Sant Just;Hombre;Rere Sant Just;;;;;;;;1
Carrer de l'Abat Safont;Hombre;l'Abat Safont;;;;;;;;
Carrer de Ramiro de Maeztu;Hombre;Ramiro de Maeztu;;;;;;;;
Plaça de Sant Pere;Hombre;Sant Pere;;;;;;;;1
Carrer de Lleó XIII;Hombre;Lleó XIII;;;;;;;;
Carrer de Vicent López;Hombre;Vicent López;;;;;;;;
Carrer d'En Botella;Hombre;En Botella;;;;;;;;
Carrer de Salvà;Hombre;Salvà;;;;;;;;
Carrer de Sant Isidre;Hombre;Sant Isidre;;;;;;;;
Placeta de Ramon Torres i Casanovas;Hombre;Ramon Torres i Casanovas;;;;;;;;
Plaça de l'Àngel;Hombre;l'Àngel;;;;;;;;1
Carrer del Sots-tinent Navarro;Hombre;Sots-tinent Navarro;;;;;;;;1
carrer dels Tres Reis;Hombre;Tres Reis;;;;;;;;
Plaça de Mossèn Jacint Verdaguer;Hombre;Mossèn Jacint Verdaguer;;;;;;;;
Carrer de la Palma de Sant Just;Hombre;Palma de Sant Just;;;;;;;;1
Plaça del Cardenal Cicognani;Hombre;Cardenal Cicognani;;;;;;;;
Carrer de Mateu Ferran;Hombre;Mateu Ferran;;;;;;;;
Carrer de Francisco Giner;Hombre;Francisco Giner;;;;;;;;
Carrer de Pau Romeva;Hombre;Pau Romeva;;;;;;;;
carrer de l'arquitecte Mas;Hombre;l'arquitecte Mas;;;;;;;;
Passatge Garcia i Robles;Hombre;Garcia i Robles;;;;;;;;
Plaça de Francesc Macià;Hombre;Francesc Macià;;;;;;;;
Riera de Marcel·lí;Hombre;Riera de Marcel·lí;;;;;;;;
Carrer de Pere Duran Farell;Hombre;Pere Duran Farell;;;;;;;;
Passatge de Peris i Mencheta;Hombre;Peris i Mencheta;;;;;;;;
Plaça de l'Escultor Ramir Rocamora;Hombre;l'Escultor Ramir Rocamora;;;;;;;;
Carrer de Vidal i Quadras;Hombre;Vidal i Quadras;;;;;;;;
Carrer de Robert Robert;Hombre;Robert Robert;;;;;;;;
Carrer de Sant Pere Claver;Hombre;Sant Pere Claver;;;;;;;;
Carrer del Greco;Hombre;Greco;;;;;;;;
Carrer de Segimon;Hombre;Segimon;;;;;;;;
Pas Fructuós Gelabert;Hombre;Pas Fructuós Gelabert;;;;;;;;
Plaça de Joaquim Folguera;Hombre;Joaquim Folguera;;;;;;;;
carrer de Joaquim Puig i Pidemunt;Hombre;Joaquim Puig i Pidemunt;;;;;;;;
carrer de Josep Sole i Barberà;Hombre;Josep Sole i Barberà;;;;;;;;
carrer del Doctor Rizal;Hombre;Doctor Rizal;;;;;;;;
Passatge de Chapí;Hombre;Chapí;;;;;;;;
