Calle;Género;Nombre;Religioso;Ficción;Descripción;Artículo;Imagen;Fecha Nacimiento;Fecha Muerte;Céntrica
Placeta de Abad;Hombre;Abad;0.0;;;;;;;
Calle Abderrahman;Hombre;Abderrahman;0.0;;;;;;;1
Calle Abén Humeya;Hombre;Abén Humeya;0.0;;;;;;;1
Calle Abu Isaac;Hombre;Abu Isaac;0.0;;;;;;;1
Calle Adriano;Hombre;Adriano;0.0;;;;;;;
Calle Agustín Lara;Hombre;Agustín Lara;0.0;;;;;;;
Calle Alamillos de San Cecilio;Hombre;Alamillos de San Cecilio;0.0;;;;;;;1
Plaza Albert Einstein;Hombre;Albert Einstein;0.0;;;;;;;1
Calle Alcalde Alonso Arias de Herrera;Hombre;Alcalde Alonso Arias de Herrera;0.0;;;;;;;
Calle Alcalde Alonso Enríquez;Hombre;Alcalde Alonso Enríquez;0.0;;;;;;;
Calle Alcalde Antonio de la Cueva;Hombre;Alcalde Antonio de la Cueva;0.0;;;;;;;
Plaza Alcalde Fernández Montesinos;Hombre;Alcalde Fernández Montesinos;0.0;;;;;;;
Calle Alcalde Fernando Carrillo de Mendoza;Hombre;Alcalde Fernando Carrillo de Mendoza;0.0;;;;;;;
Pasaje Alcalde Francisco Arevalo;Hombre;Alcalde Francisco Arevalo;0.0;;;;;;;
Pasaje Alcalde Francisco de Carvajal;Hombre;Alcalde Francisco de Carvajal;0.0;;;;;;;
Pasaje Alcalde García Suárez de Carvajal;Hombre;Alcalde García Suárez de Carvajal;0.0;;;;;;;
Calle Alcalde Gutierre Goméz de Fuensalida;Hombre;Alcalde Gutierre Goméz de Fuensalida;0.0;;;;;;;
Calle Alcalde Iñigo Manrique;Hombre;Alcalde Iñigo Manrique;0.0;;;;;;;
Calle Alcalde Juan Vázquez Coronado;Hombre;Alcalde Juan Vázquez Coronado;0.0;;;;;;;
Calle Alcalde Mosén Rubí de Bracamonte;Hombre;Alcalde Mosén Rubí de Bracamonte;0.0;;;;;;;
Calle Alcalde Rodrigo Pacheco;Hombre;Alcalde Rodrigo Pacheco;0.0;;;;;;;
Calle Alcalde Yoldi Bereau;Hombre;Alcalde Yoldi Bereau;0.0;;;;;;;
Calle Alejandro Dumas;Hombre;Alejandro Dumas;0.0;;;;;;;
Placeta Alfonso X El Sabio;Hombre;Alfonso X El Sabio;0.0;;;;;;;
Calle Alonso Cano;Hombre;Alonso Cano;0.0;;;;;;;1
Calle Alonso de Mena;Hombre;Alonso de Mena;0.0;;;;;;;
Calle Alonso Lobo;Hombre;Alonso Lobo;0.0;;;;;;;
Calle Alonso Quijano;Hombre;Alonso Quijano;0.0;;;;;;;
Calle Álvarez de Castro;Hombre;Álvarez de Castro;0.0;;;;;;;1
Calle Álvarez Pelayo;Hombre;Álvarez Pelayo;0.0;;;;;;;
Calle Alvaro Aparicio;Hombre;Alvaro Aparicio;0.0;;;;;;;
Calle Álvaro de Bazán;Hombre;Álvaro de Bazán;0.0;;;;;;;1
Calle Ambrosio de Vico;Hombre;Ambrosio de Vico;0.0;;;;;;;
Calle Ambrosio Martínez de Bustos;Hombre;Ambrosio Martínez de Bustos;0.0;;;;;;;
Calle Américo Castro;Hombre;Américo Castro;0.0;;;;;;;
Calle Andrea Navagiero;Hombre;Andrea Navagiero;0.0;;;;;;;
Calle Andrés Calderón;Hombre;Andrés Calderón;0.0;;;;;;;
Calle Andrés Narváez;Hombre;Andrés Narváez;0.0;;;;;;;
Calle Andrés Segovia;Hombre;Andrés Segovia;0.0;;;;;;;
Calle Ángel Barrios;Hombre;Ángel Barrios;0.0;;;;;;;1
Calle Ángel Ganivet;Hombre;Ángel Ganivet;0.0;;;;;;;1
Calle Antón Calabres;Hombre;Antón Calabres;0.0;;;;;;;
Callejón Antonino;Hombre;Antonino;0.0;;;;;;;1
Calle Antonio Dalmases;Hombre;Antonio Dalmases;0.0;;;;;;;1
Calle Antonio López Sancho;Hombre;Antonio López Sancho;0.0;;;;;;;
Calle Antonio Machado;Hombre;Antonio Machado;0.0;;;;;;;
Calle Apolo;Hombre;Apolo;0.0;1.0;;;;;;
Plaza del Arcángel San Miguel;Hombre;Arcángel San Miguel;1.0;;;;;;;
Placeta Arcipreste de Hita;Hombre;Arcipreste de Hita;0.0;;;;;;;
Calle Aristóteles;Hombre;Aristóteles;0.0;;;;;;;
Calle Arquímedes;Hombre;Arquímedes;0.0;;;;;;;
Placeta Arquitecto Ángel Casas;Hombre;Arquitecto Ángel Casas;0.0;;;;;;;
Calle Arquitecto Felipe Giménez Lacal;Hombre;Arquitecto Felipe Giménez Lacal;0.0;;;;;;;
Plaza Arquitecto García de Paredes;Hombre;Arquitecto García de Paredes;0.0;;;;;;;1
Calle Arquitecto José Contreras;Hombre;Arquitecto José Contreras;0.0;;;;;;;
Calle Arquitecto Modesto Cendoya;Hombre;Arquitecto Modesto Cendoya;0.0;;;;;;;
Calle Arquitecto Torres Balbás;Hombre;Arquitecto Torres Balbás;0.0;;;;;;;
Calle Artesano Molero;Hombre;Artesano Molero;0.0;;;;;;;
Calle Arzobispo Guerrero;Hombre;Arzobispo Guerrero;1.0;;;;;;;
Calle Arzobispo Pedro de Castro;Hombre;Arzobispo Pedro de Castro;1.0;;;;;;;
Calle Ataulfo Argenta;Hombre;Ataulfo Argenta;0.0;;;;;;;
Calle Aviador Dávila;Hombre;Aviador Dávila;0.0;;;;;;;
Calle Azorín;Hombre;Azorín;0.0;;;;;;;1
Calle Bachiller Sansón;Hombre;Bachiller Sansón;0.0;;;;;;;
Calle Baden Powell;Hombre;Baden Powell;0.0;;;;;;;
Calle Bailaor Mario Maya;Hombre;Bailaor Mario Maya;0.0;;;;;;;
Calle Baja de San Ildefonso;Hombre;Baja de San Ildefonso;1.0;;;;;;;
Calle Baltasar Ramírez;Hombre;Baltasar Ramírez;0.0;;;;;;;
Plaza Barón Pierre de Coubertin;Hombre;Barón Pierre de Coubertin;0.0;;;;;;;
Calle Bartolomé García;Hombre;Bartolomé García;0.0;;;;;;;
Calle Bartolomé Roldán;Hombre;Bartolomé Roldán;0.0;;;;;;;
Calle Beaterío del Santísimo;Hombre;Beaterío del Santísimo;0.0;;;;;;;1
Calle Beethoven;Hombre;Beethoven;0.0;;;;;;;
Calle Bermúdez de Pedraza;Hombre;Bermúdez de Pedraza;0.0;;;;;;;
Calle Blanqueo Viejo de San Cecilio;Hombre;Blanqueo Viejo de San Cecilio;1.0;;;;;;;1
Calle Blas de Ledesma;Hombre;Blas de Ledesma;0.0;;;;;;;
Calle Blas de Otero;Hombre;Blas de Otero;0.0;;;;;;;
Calle Blas Infante;Hombre;Blas Infante;0.0;;;;;;;
Calle Blas Moreno;Hombre;Blas Moreno;0.0;;;;;;;
Calle Calderón de la Barca;Hombre;Calderón de la Barca;0.0;;;;;;;1
Callejuela de San Bartolomé;Hombre;Callejuela de San Bartolomé;1.0;;;;;;;
Calle Cándido García Ortiz Villajos;Hombre;Cándido García Ortiz Villajos;0.0;;;;;;;
Calle Capataz Antonio Sánchez Osuna;Hombre;Capataz Antonio Sánchez Osuna;0.0;;;;;;;1
Avenida Capitán Moreno;Hombre;Capitán Moreno;0.0;;;;;;;
Plaza del Cardenal Cisneros;Hombre;Cardenal Cisneros;0.0;;;;;;;
Calle Cardenal Mendoza;Hombre;Cardenal Mendoza;0.0;;;;;;;1
Calle Cardenal Parrado;Hombre;Cardenal Parrado;0.0;;;;;;;
Placeta Carlos Arniches;Hombre;Carlos Arniches;0.0;;;;;;;
Calle Carlos Arruza;Hombre;Carlos Arruza;0.0;;;;;;;
Calle Carlos Cano;Hombre;Carlos Cano;0.0;;;;;;;
Plaza de Carlos Cano;Hombre;Carlos Cano;0.0;;;;;;;1
Calle Carlos Pareja;Hombre;Carlos Pareja;0.0;;;;;;;1
Calle Carlos Tómas Romero;Hombre;Carlos Tómas Romero;0.0;;;;;;;
Calle Cármenes de Gadeo;Hombre;Cármenes de Gadeo;0.0;;;;;;;
Urbanización Cármenes de Rolando;Hombre;Cármenes de Rolando;0.0;;;;;;;
Calle Carril de Santo Domingo;Hombre;Carril de Santo Domingo;1.0;;;;;;;
Calle Castro Cortés;Hombre;Castro Cortés;0.0;;;;;;;
Avenida de Cervantes;Hombre;Cervantes;0.0;;;;;;;
Rotonda de Cervantes;Hombre;Cervantes;0.0;;;;;;;
Calle Cetti Meriem;Hombre;Cetti Meriem;0.0;;;;;;;1
Calle Christian Andersen;Hombre;Christian Andersen;0.0;;;;;;;
Calle Cirujano Abul Qasim;Hombre;Cirujano Abul Qasim;0.0;;;;;;;
Calle Clavel de San José;Hombre;Clavel de San José;1.0;;;;;;;1
Calle Clavel de San Pedro;Hombre;Clavel de San Pedro;1.0;;;;;;;1
Calle Coca de San Andrés;Hombre;Coca de San Andrés;1.0;;;;;;;1
Colonia de Cervantes;Hombre;Colonia de Cervantes;0.0;;;;;;;
Colonia de San Conrado;Hombre;Colonia de San Conrado;1.0;;;;;;;
Colonia de San Sebastián;Hombre;Colonia de San Sebastián;1.0;;;;;;;
Calle Compas de San Jerónimo;Hombre;Compas de San Jerónimo;1.0;;;;;;;1
Avenida Compositor Luis de Narváez;Hombre;Compositor Luis de Narváez;0.0;;;;;;;
Calle Compositor Luis Megías;Hombre;Compositor Luis Megías;0.0;;;;;;;
Calle Compositor Ruiz Aznar;Hombre;Compositor Ruiz Aznar;0.0;;;;;;;1
Callejón del Conde;Hombre;Conde;0.0;;;;;;;
Calle Conde;Hombre;Conde;0.0;;;;;;;
Placeta del Conde;Hombre;Conde;0.0;;;;;;;
Pasaje Conde Alcalá;Hombre;Conde Alcalá;0.0;;;;;;;1
Calle Conde Cifuentes;Hombre;Conde Cifuentes;0.0;;;;;;;1
Calle Conde de las Infantas;Hombre;Conde de las Infantas;0.0;;;;;;;1
Calle Conde de San Cecilio;Hombre;Conde de San Cecilio;0.0;;;;;;;1
Calle Conde de Tendillas;Hombre;Conde de Tendillas;0.0;;;;;;;1
Calle Conde de Torrepalma;Hombre;Conde de Torrepalma;0.0;;;;;;;
Calle Contador;NA;Contador;0.0;;;;;;;
Placeta Cristo Azucenas;Hombre;Cristo Azucenas;1.0;;;;;;;1
Calle Cristo de la Yedra;Hombre;Cristo de la Yedra;1.0;;;;;;;
Calle Cristo de Medinaceli;Hombre;Cristo de Medinaceli;1.0;;;;;;;1
Calle Cristo de San Agustín;Hombre;Cristo de San Agustín;1.0;;;;;;;1
Calle Cristobal Caro;Hombre;Cristobal Caro;0.0;;;;;;;
Calle Cristóbal Colón;Hombre;Cristóbal Colón;0.0;;;;;;;
Calle Cristóbal de Morales;Hombre;Cristóbal de Morales;0.0;;;;;;;
Calle Cristóbal Quintero;Hombre;Cristóbal Quintero;0.0;;;;;;;
Calle Curro Cúchares;Hombre;Curro Cúchares;0.0;;;;;;;
Calle Dante;Hombre;Dante;0.0;;;;;;;1
Calle Darío de Regollos;Hombre;Darío de Regollos;0.0;;;;;;;
Calle Demetrio Spínola;Hombre;Demetrio Spínola;0.0;;;;;;;
Calle Diamantino García;Hombre;Diamantino García;0.0;;;;;;;
Calle Diego de Arana;Hombre;Diego de Arana;0.0;;;;;;;
Calle Diego de Mora;Hombre;Diego de Mora;0.0;;;;;;;
Calle Diego de Rivera;Hombre;Diego de Rivera;0.0;;;;;;;
Plaza de Diego de Siloé;Hombre;Diego de Siloé;0.0;;;;;;;
Placeta Diego de Siloé;Hombre;Diego de Siloé;0.0;;;;;;;1
Pasaje Diego de Siloé;Hombre;Diego de Siloé;0.0;;;;;;;1
Calle Diego Lorenzo;Hombre;Diego Lorenzo;0.0;;;;;;;
Calle Doctor Adelardo Mora;Hombre;Doctor Adelardo Mora;0.0;;;;;;;
Plaza Doctor Agustín Laborde;Hombre;Doctor Agustín Laborde;0.0;;;;;;;
Calle Doctor Alejandro Otero;Hombre;Doctor Alejandro Otero;0.0;;;;;;;1
Calle Doctor Azpitarte;Hombre;Doctor Azpitarte;0.0;;;;;;;
Calle Doctor Barraquer;Hombre;Doctor Barraquer;0.0;;;;;;;
Calle Doctor Blasco Reta;Hombre;Doctor Blasco Reta;0.0;;;;;;;
Calle Doctor Buenaventura Carreras;Hombre;Doctor Buenaventura Carreras;0.0;;;;;;;1
Calle Doctor Castroviejo;Hombre;Doctor Castroviejo;0.0;;;;;;;
Calle Doctor Creus;Hombre;Doctor Creus;0.0;;;;;;;
Calle Doctor Eduardo de Teresa;Hombre;Doctor Eduardo de Teresa;0.0;;;;;;;
Calle Doctor Enrique Hernández;Hombre;Doctor Enrique Hernández;0.0;;;;;;;
Calle Doctor Faria;Hombre;Doctor Faria;0.0;;;;;;;
Calle Doctor Felipe Villalobos;Hombre;Doctor Felipe Villalobos;0.0;;;;;;;
Calle Doctor Fermín Garrido;Hombre;Doctor Fermín Garrido;0.0;;;;;;;
Calle Doctor Fernando Escobar;Hombre;Doctor Fernando Escobar;0.0;;;;;;;
Calle Doctor Fidel Fernández;Hombre;Doctor Fidel Fernández;0.0;;;;;;;
Calle Doctor Fleming;Hombre;Doctor Fleming;0.0;;;;;;;
Calle Doctor García y García de Castro;Hombre;Doctor García y García de Castro;0.0;;;;;;;
Calle Doctor Gómez Román;Hombre;Doctor Gómez Román;0.0;;;;;;;
Calle Doctor González de Vega;Hombre;Doctor González de Vega;0.0;;;;;;;
Calle Doctor Guirao Gea;Hombre;Doctor Guirao Gea;0.0;;;;;;;
Calle Doctor Jaime García Royo;Hombre;Doctor Jaime García Royo;0.0;;;;;;;
Calle Doctor Jiménez Díaz;Hombre;Doctor Jiménez Díaz;0.0;;;;;;;
Calle Doctor Jiménez Garrido;Hombre;Doctor Jiménez Garrido;0.0;;;;;;;
Calle Doctor Juan Sánchez Cózar;Hombre;Doctor Juan Sánchez Cózar;0.0;;;;;;;
Calle Doctor López Font;Hombre;Doctor López Font;0.0;;;;;;;1
Plaza del Doctor López Neyra;Hombre;Doctor López Neyra;0.0;;;;;;;
Calle Doctor Marañón;Hombre;Doctor Marañón;0.0;;;;;;;
Calle Doctor Martín Lagos;Hombre;Doctor Martín Lagos;0.0;;;;;;;1
Placeta Doctor Martínez Castro;Hombre;Doctor Martínez Castro;0.0;;;;;;;
Calle Doctor Medina Olmos;Hombre;Doctor Medina Olmos;0.0;;;;;;;
Calle Doctor Mesa Moles;Hombre;Doctor Mesa Moles;0.0;;;;;;;
Calle Doctor Moreno López;Hombre;Doctor Moreno López;0.0;;;;;;;
Calle Doctor Muñoz Fernández;Hombre;Doctor Muñoz Fernández;0.0;;;;;;;
Avenida Doctor Olóriz;Hombre;Doctor Olóriz;0.0;;;;;;;
Calle Doctor Pareja Yébenes;Hombre;Doctor Pareja Yébenes;0.0;;;;;;;
Calle Doctor Rojas Ballesteros;Hombre;Doctor Rojas Ballesteros;0.0;;;;;;;
Calle Doctor Salvatierra;Hombre;Doctor Salvatierra;0.0;;;;;;;
Calle Doctor Sánchez Mariscal;Hombre;Doctor Sánchez Mariscal;0.0;;;;;;;
Calle Doctor Santos Oliveras;Hombre;Doctor Santos Oliveras;0.0;;;;;;;
Calle Doctor Severo Ochoa;Hombre;Doctor Severo Ochoa;0.0;;;;;;;
Calle Doctor Vaca Castro;Hombre;Doctor Vaca Castro;0.0;;;;;;;
Calle Doctor Víctor Escribano;Hombre;Doctor Víctor Escribano;0.0;;;;;;;
Calle Domingo Lozano;Hombre;Domingo Lozano;0.0;;;;;;;
Calle Domingo Puente Marín;Hombre;Domingo Puente Marín;0.0;;;;;;;
Avenida Don Bosco;Hombre;Don Bosco;0.0;;;;;;;
Calle Don Emilio Durán Durán;Hombre;Don Emilio Durán Durán;0.0;;;;;;;
Plaza de Don Pedro Manjón;Hombre;Don Pedro Manjón;0.0;;;;;;;
Calle Don Quijote;Hombre;Don Quijote;0.0;1.0;;;;;;
Calle Don Simeón;Hombre;Don Simeón;0.0;;;;;;;1
Placeta Dramaturgo Alfonso Paso;Hombre;Dramaturgo Alfonso Paso;0.0;;;;;;;1
Placeta Duque de Rivas;Hombre;Duque de Rivas;0.0;;;;;;;
Plaza del Duque de San Pedro de Galatino;Hombre;Duque de San Pedro de Galatino;0.0;;;;;;;
Avenida del Duque de San Pedro Galatino;Hombre;Duque de San Pedro Galatino;0.0;;;;;;;
Calle Echegaray;Hombre;Echegaray;0.0;;;;;;;
Paseo del Emperador Carlos V;Hombre;Emperador Carlos V;0.0;;;;;;;
Calle Enrique Bernedo Bojilla;Hombre;Enrique Bernedo Bojilla;0.0;;;;;;;
Calle Enrique Gómez Arboleya;Hombre;Enrique Gómez Arboleya;0.0;;;;;;;1
Plaza Enrique Iniesta;Hombre;Enrique Iniesta;0.0;;;;;;;1
Calle Epifanio Lupión;Hombre;Epifanio Lupión;0.0;;;;;;;
Calle Escritor Alberto Álvarez de Cienfuegos;Hombre;Escritor Alberto Álvarez de Cienfuegos;0.0;;;;;;;
Calle Escritor Antonio Almagro;Hombre;Escritor Antonio Almagro;0.0;;;;;;;
Calle Escritor Antonio Porcel;Hombre;Escritor Antonio Porcel;0.0;;;;;;;
Calle Escritor Antonio Seris;Hombre;Escritor Antonio Seris;0.0;;;;;;;
Calle Escritor Baltasar Martínez;Hombre;Escritor Baltasar Martínez;0.0;;;;;;;
Calle Escritor Felipe Romero;Hombre;Escritor Felipe Romero;0.0;;;;;;;
Plaza Escritor Fernández Castro;Hombre;Escritor Fernández Castro;0.0;;;;;;;
Placeta Escritor Francisco Izquierdo;Hombre;Escritor Francisco Izquierdo;0.0;;;;;;;1
Calle Escritor Francisco Villarreal;Hombre;Escritor Francisco Villarreal;0.0;;;;;;;
Calle Escritor Gabriel Ruiz;Hombre;Escritor Gabriel Ruiz;0.0;;;;;;;
Calle Escritor José España;Hombre;Escritor José España;0.0;;;;;;;
Calle Escritor Manuel Rodríguez;Hombre;Escritor Manuel Rodríguez;0.0;;;;;;;
Calle Escritor Miguel Garrido;Hombre;Escritor Miguel Garrido;0.0;;;;;;;
Calle Escritor Miguel Gutiérrez;Hombre;Escritor Miguel Gutiérrez;0.0;;;;;;;
Calle Escritor Miguel Toro;Hombre;Escritor Miguel Toro;0.0;;;;;;;
Calle Escritor Nicolás del Paso;Hombre;Escritor Nicolás del Paso;0.0;;;;;;;
Calle Escritor Perrault;Hombre;Escritor Perrault;0.0;;;;;;;
Calle Escultor Antonio Cano Correa;Hombre;Escultor Antonio Cano Correa;0.0;;;;;;;
Calle Escultor Antonio Martínez Olalla;Hombre;Escultor Antonio Martínez Olalla;0.0;;;;;;;1
Calle Escultor Eduardo Espinosa Cuadros;Hombre;Escultor Eduardo Espinosa Cuadros;0.0;;;;;;;
Plaza Escultor Francisco López Burgos;Hombre;Escultor Francisco López Burgos;0.0;;;;;;;1
Calle Escultor Jiménez Mesa;Hombre;Escultor Jiménez Mesa;0.0;;;;;;;
Calle Escultor López Azaustre;Hombre;Escultor López Azaustre;0.0;;;;;;;
Calle Escultor Navas Parejo;Hombre;Escultor Navas Parejo;0.0;;;;;;;
Calle Escultor Pablo Loyzaga;Hombre;Escultor Pablo Loyzaga;0.0;;;;;;;
Calle Esteban de Rueda;Hombre;Esteban de Rueda;0.0;;;;;;;
Avenida Federico García Lorca;Hombre;Federico García Lorca;0.0;;;;;;;
Plaza de Federico Mayo;Hombre;Federico Mayo;0.0;;;;;;;
Calle Felipe Gómez de Valencia;Hombre;Felipe Gómez de Valencia;0.0;;;;;;;
Calle Félix Rodríguez de la Fuente;Hombre;Félix Rodríguez de la Fuente;0.0;;;;;;;
Calle Fernán Caballero;Hombre;Fernán Caballero;0.0;;;;;;;
Placeta Fernández de Moratín;Hombre;Fernández de Moratín;0.0;;;;;;;
Avenida Fernando de los Ríos;Hombre;Fernando de los Ríos;0.0;;;;;;;
Placeta Fernando de Rojas;Hombre;Fernando de Rojas;0.0;;;;;;;
Calle Filólogo Julio Casares;Hombre;Filólogo Julio Casares;0.0;;;;;;;
Avenida de Francisco Ayala;Hombre;Francisco Ayala;0.0;;;;;;;
Calle Francisco de Paula Valladar Serrano;Hombre;Francisco de Paula Valladar Serrano;0.0;;;;;;;
Calle Francisco de Quevedo;Hombre;Francisco de Quevedo;0.0;;;;;;;1
Calle Francisco Guerrero;Hombre;Francisco Guerrero;0.0;;;;;;;
Calle Francisco Hurtado Izquierdo;Hombre;Francisco Hurtado Izquierdo;0.0;;;;;;;
Plaza Francisco Javier Simonet;Hombre;Francisco Javier Simonet;0.0;;;;;;;
Calle Francisco Lendinez;Hombre;Francisco Lendinez;0.0;;;;;;;
Calle Francisco López Jurado;Hombre;Francisco López Jurado;0.0;;;;;;;
Calle Fray Francisco Morales;Hombre;Fray Francisco Morales;1.0;;;;;;;
Calle Fray Hernando de Talavera;Hombre;Fray Hernando de Talavera;1.0;;;;;;;
Calle Fray Juan Sánchez Cotán;Hombre;Fray Juan Sánchez Cotán;1.0;;;;;;;
Calle Fray Leopoldo de Alpandeire;Hombre;Fray Leopoldo de Alpandeire;1.0;;;;;;;
Calle Fray Luis de Granada;Hombre;Fray Luis de Granada;1.0;;;;;;;1
Calle Fray Luis de León;Hombre;Fray Luis de León;1.0;;;;;;;
Calle Gabriel Aragón;Hombre;Gabriel Aragón;0.0;;;;;;;
Calle Gabriel Miró;Hombre;Gabriel Miró;0.0;;;;;;;
Calle Gabriel y Galán;Hombre;Gabriel y Galán;0.0;;;;;;;
Calle Galileo;Hombre;Galileo;0.0;;;;;;;1
Plaza de Gamboa;Hombre;Gamboa;0.0;;;;;;;1
Calle Garcia Morato;Hombre;Garcia Morato;0.0;;;;;;;
Calle García Villatoro;Hombre;García Villatoro;0.0;;;;;;;
Calle Garrido;Hombre;Garrido;0.0;;;;;;;
Calle Garrido del Castillo;Hombre;Garrido del Castillo;0.0;;;;;;;
Plaza General Emilio Herrera;Hombre;General Emilio Herrera;0.0;;;;;;;1
Calle General Narváez;Hombre;General Narváez;0.0;;;;;;;1
Calle Gerald Brenan;Hombre;Gerald Brenan;0.0;;;;;;;
Plaza Gerardo Cuerva;Hombre;Gerardo Cuerva;0.0;;;;;;;1
Calle Gobernador Pedro Temboury;Hombre;Gobernador Pedro Temboury;0.0;;;;;;;
Calle Gómez Rascón;Hombre;Gómez Rascón;0.0;;;;;;;
Calle Gonzalo Gallas;Hombre;Gonzalo Gallas;0.0;;;;;;;
Glorieta Gonzalo Gallas;Hombre;Gonzalo Gallas;0.0;;;;;;;
Calle Gonzalo Jiménez de Quesada;Hombre;Gonzalo Jiménez de Quesada;0.0;;;;;;;
Calle Goya;Hombre;Goya;0.0;;;;;;;1
Calle Grabador David Roberts;Hombre;Grabador David Roberts;0.0;;;;;;;
Calle Gran Capitán;Hombre;Gran Capitán;0.0;;;;;;;1
Plaza de Gran Capitán;Hombre;Gran Capitán;0.0;;;;;;;1
Gran Vía de Colón;Hombre;Gran Vía de Colón;0.0;;;;;;;
Calle Gras y Granollers;Hombre;Gras y Granollers;0.0;;;;;;;
Calle Gregorio Espín;Hombre;Gregorio Espín;0.0;;;;;;;1
Calle Gregorio Morillo;Hombre;Gregorio Morillo;0.0;;;;;;;
Calle Gregorio Silvestre;Hombre;Gregorio Silvestre;0.0;;;;;;;
Calle Guevara Pozo;Hombre;Guevara Pozo;0.0;;;;;;;1
Calle Guillén de Castro;Hombre;Guillén de Castro;0.0;;;;;;;1
Calle Guillermo de Peregrina (Ciclista);Hombre;Guillermo de Peregrina (Ciclista);0.0;;;;;;;
Plaza Guitarrista Manuel Cano;Hombre;Guitarrista Manuel Cano;0.0;;;;;;;
Calle Gumiel de San José;Hombre;Gumiel de San José;1.0;;;;;;;1
Calle Gumiel de San Pedro;Hombre;Gumiel de San Pedro;1.0;;;;;;;
Calle Gustavo Adolfo Bécquer;Hombre;Gustavo Adolfo Bécquer;0.0;;;;;;;
Calle Gustavo Doré;Hombre;Gustavo Doré;0.0;;;;;;;
Placeta Gutiérre de Cetina;Hombre;Gutiérre de Cetina;0.0;;;;;;;
Calle Gutierre Tibón;Hombre;Gutierre Tibón;0.0;;;;;;;
Calle Henríquez de Jorquera;Hombre;Henríquez de Jorquera;0.0;;;;;;;
Calle Hércules;Hombre;Hércules;0.0;1.0;;;;;;
Plaza Hermano Carlos;Hombre;Hermano Carlos;0.0;;;;;;;
Calle Hermanos Aragón;Hombre;Hermanos Aragón;0.0;;;;;;;
Calle Hermanos Carazo;Hombre;Hermanos Carazo;0.0;;;;;;;
Paseo Hermanos Costaleros;Hombre;Hermanos Costaleros;0.0;;;;;;;
Calle Hermanos García;Hombre;Hermanos García;0.0;;;;;;;
Calle Hermanos Grimm;Hombre;Hermanos Grimm;0.0;;;;;;;
Calle Homero;Hombre;Homero;0.0;;;;;;;
Calle Honda San Andrés;Hombre;Honda San Andrés;0.0;;;;;;;1
Calle Horacio;Hombre;Horacio;0.0;;;;;;;
Calle Isaac Albéniz;Hombre;Isaac Albéniz;0.0;;;;;;;
Calle Isaac Peral;Hombre;Isaac Peral;0.0;;;;;;;
Plaza Isidro de las Cagigas;Hombre;Isidro de las Cagigas;0.0;;;;;;;
Calle Ismail;Hombre;Ismail;0.0;;;;;;;
Calle Jacinto Benavente;Hombre;Jacinto Benavente;0.0;;;;;;;
Calle Jacinto Molina Mendoza;Hombre;Jacinto Molina Mendoza;0.0;;;;;;;
Placeta Jaime Balmés;Hombre;Jaime Balmés;0.0;;;;;;;
Calle Javier de Burgos;Hombre;Javier de Burgos;0.0;;;;;;;
Calle Javier Tortosa;Hombre;Javier Tortosa;0.0;;;;;;;
Calle Jazmín de San Matías;Hombre;Jazmín de San Matías;1.0;;;;;;;1
Calle Jerónimo de Aliseda;Hombre;Jerónimo de Aliseda;0.0;;;;;;;
Calle Jerónimo de Cárcel;Hombre;Jerónimo de Cárcel;0.0;;;;;;;
Calle Jerónimo de Rueda;Hombre;Jerónimo de Rueda;0.0;;;;;;;
Calle Jerónimo Silvestre;Hombre;Jerónimo Silvestre;0.0;;;;;;;
Calle Jesse Owens;Hombre;Jesse Owens;0.0;;;;;;;
Plaza Jesús Escudero García;Hombre;Jesús Escudero García;0.0;;;;;;;
Calle Jesús Fandila;Hombre;Jesús Fandila;0.0;;;;;;;
Calle Jiménez Quiles;Hombre;Jiménez Quiles;0.0;;;;;;;
Calle Joaquín Álvarez Quintero;Hombre;Joaquín Álvarez Quintero;0.0;;;;;;;
Calle Joaquín Blume;Hombre;Joaquín Blume;0.0;;;;;;;1
Calle Joaquín Corral Almagro;Hombre;Joaquín Corral Almagro;0.0;;;;;;;
Calle Joaquín Costa;Hombre;Joaquín Costa;0.0;;;;;;;1
Calle Joaquín Galera;Hombre;Joaquín Galera;0.0;;;;;;;
Calle Joaquín García;Hombre;Joaquín García;0.0;;;;;;;
Calle Joaquín Sorolla;Hombre;Joaquín Sorolla;0.0;;;;;;;1
Placeta Joe Strummer;Hombre;Joe Strummer;0.0;;;;;;;
Calle Jorge de Torres;Hombre;Jorge de Torres;0.0;;;;;;;
Placeta Jorge Manrique;Hombre;Jorge Manrique;0.0;;;;;;;
Calle José Acosta Medina;Hombre;José Acosta Medina;0.0;;;;;;;
Calle José de Bada;Hombre;José de Bada;0.0;;;;;;;
Calle José de Cieza;Hombre;José de Cieza;0.0;;;;;;;
Calle José de Mora;Hombre;José de Mora;0.0;;;;;;;
Calle José Luis Pérez Pujadas;Hombre;José Luis Pérez Pujadas;0.0;;;;;;;
Calle José Luis Sáenz de Heredia;Hombre;José Luis Sáenz de Heredia;0.0;;;;;;;
Calle José Manuel Baena Martín;Hombre;José Manuel Baena Martín;0.0;;;;;;;
Calle José Manuel Jiménez Díez (Lolo El Payaso);Hombre;José Manuel Jiménez Díez (Lolo El Payaso);0.0;;;;;;;
Calle José María Bugella de Toro;Hombre;José María Bugella de Toro;0.0;;;;;;;
Calle José María Buguella de Toro;Hombre;José María Buguella de Toro;0.0;;;;;;;
Calle José María Garrido Lopera;Hombre;José María Garrido Lopera;0.0;;;;;;;
Calle José María Miranda Serrano;Hombre;José María Miranda Serrano;0.0;;;;;;;
Calle José María Pereda;Hombre;José María Pereda;0.0;;;;;;;
Calle José Millán;Hombre;José Millán;0.0;;;;;;;
Calle José Morell;Hombre;José Morell;0.0;;;;;;;
Calle José Recuerda;Hombre;José Recuerda;0.0;;;;;;;1
Calle José Risueño;Hombre;José Risueño;0.0;;;;;;;
Calle José Rodríguez Liñán;Hombre;José Rodríguez Liñán;0.0;;;;;;;
Calle José Tamayo;Hombre;José Tamayo;0.0;;;;;;;
Calle Joseíto de Granada;Hombre;Joseíto de Granada;0.0;;;;;;;
Calle Joven Marcelo;Hombre;Joven Marcelo;0.0;;;;;;;
Calle Juan Cristóbal;Hombre;Juan Cristóbal;0.0;;;;;;;
Calle Juan de Aragón;Hombre;Juan de Aragón;0.0;;;;;;;
Calle Juan de Arjona;Hombre;Juan de Arjona;0.0;;;;;;;
Calle Juan de Austria;Hombre;Juan de Austria;0.0;;;;;;;
Calle Juan de Bustamante;Hombre;Juan de Bustamante;0.0;;;;;;;
Calle Juan de Echevarría;Hombre;Juan de Echevarría;0.0;;;;;;;
Calle Juan de la Cierva;Hombre;Juan de la Cierva;0.0;;;;;;;
Calle Juan de la Cosa;Hombre;Juan de la Cosa;0.0;;;;;;;
Calle Juan de Maeda;Hombre;Juan de Maeda;0.0;;;;;;;
Calle Juan de Medina;Hombre;Juan de Medina;0.0;;;;;;;
Placeta Juan de Mena;Hombre;Juan de Mena;0.0;;;;;;;
Calle Juan de Palenque;Hombre;Juan de Palenque;0.0;;;;;;;
Calle Juan de Salcedo;Hombre;Juan de Salcedo;0.0;;;;;;;
Calle Juan de Sevilla;Hombre;Juan de Sevilla;0.0;;;;;;;
Calle Juan Gálvez Juanillo;Hombre;Juan Gálvez Juanillo;0.0;;;;;;;
Calle Juan Latino;Hombre;Juan Latino;0.0;;;;;;;
Calle Juan Montero;Hombre;Juan Montero;0.0;;;;;;;
Calle Juan Niño;Hombre;Juan Niño;0.0;;;;;;;
Avenida Juan Pablo II;Hombre;Juan Pablo II;0.0;;;;;;;
Calle Juan Pedro Mesa de León;Hombre;Juan Pedro Mesa de León;0.0;;;;;;;
Calle Juan Ramón Jiménez;Hombre;Juan Ramón Jiménez;0.0;;;;;;;
Calle Juan Vázquez;Hombre;Juan Vázquez;0.0;;;;;;;
Prolongación Juan XXII;Hombre;Juan XXII;0.0;;;;;;;
Calle Julio César;Hombre;Julio César;0.0;;;;;;;
Calle Julio Moreno Dávila;Hombre;Julio Moreno Dávila;0.0;;;;;;;
Calle Julio Verne;Hombre;Julio Verne;0.0;;;;;;;
Calle Labella Dávalos;Hombre;Labella Dávalos;0.0;;;;;;;
Calle Laureado López Muñoz;Hombre;Laureado López Muñoz;0.0;;;;;;;
Calle León Felipe;Hombre;León Felipe;0.0;;;;;;;
Calle Licenciado Vidriera;Hombre;Licenciado Vidriera;0.0;;;;;;;
Calle Lope de Vega;Hombre;Lope de Vega;0.0;;;;;;;1
Calle López de Haro;Hombre;López de Haro;0.0;;;;;;;
Calle Lopéz Rubio;Hombre;Lopéz Rubio;0.0;;;;;;;1
Calle López Sancho;Hombre;López Sancho;0.0;;;;;;;
Calle Luis Amador;Hombre;Luis Amador;0.0;;;;;;;
Calle Luis Braille;Hombre;Luis Braille;0.0;;;;;;;1
Calle Luis de Guzmán;Hombre;Luis de Guzmán;0.0;;;;;;;
Calle Luis del Mármol Carvajal;Hombre;Luis del Mármol Carvajal;0.0;;;;;;;1
Calle Luis Heredia Maya;Hombre;Luis Heredia Maya;0.0;;;;;;;
Avenida Luis Miranda Dávalos;Hombre;Luis Miranda Dávalos;0.0;;;;;;;
Plaza Luis Portero García;Hombre;Luis Portero García;0.0;;;;;;;1
Calle Luis Sanz Jiménez;Hombre;Luis Sanz Jiménez;0.0;;;;;;;
Calle Maese Nicolás;Hombre;Maese Nicolás;0.0;;;;;;;
Calle Maestre Diego;Hombre;Maestre Diego;0.0;;;;;;;
Calle Maestro Alonso;Hombre;Maestro Alonso;0.0;;;;;;;1
Calle Maestro Antonio Salazar Capilla;Hombre;Maestro Antonio Salazar Capilla;0.0;;;;;;;
Calle Maestro Bretón;Hombre;Maestro Bretón;0.0;;;;;;;1
Calle Maestro Cebrián;Hombre;Maestro Cebrián;0.0;;;;;;;1
Calle Maestro Faus;Hombre;Maestro Faus;0.0;;;;;;;
Calle Maestro José Rodríguez;Hombre;Maestro José Rodríguez;0.0;;;;;;;
Calle Maestro Lecuona;Hombre;Maestro Lecuona;0.0;;;;;;;1
Calle Maestro Montero;Hombre;Maestro Montero;0.0;;;;;;;
Calle Maestro Moreno Torroba;Hombre;Maestro Moreno Torroba;0.0;;;;;;;
Calle Maestro Pedro Fernández;Hombre;Maestro Pedro Fernández;0.0;;;;;;;
Calle Maestro Pedro Fernández Estévez;Hombre;Maestro Pedro Fernández Estévez;0.0;;;;;;;
Calle Maestro Vives;Hombre;Maestro Vives;0.0;;;;;;;1
Calle Magallanes;Hombre;Magallanes;0.0;;;;;;;
Calle Manolete;Hombre;Manolete;0.0;;;;;;;
Calle Manuel Cabrera;Hombre;Manuel Cabrera;0.0;;;;;;;
Calle Manuel de Falla;Hombre;Manuel de Falla;0.0;;;;;;;1
Calle Manuel del Paso;Hombre;Manuel del Paso;0.0;;;;;;;1
