Calle;Género;Nombre;Religioso;Ficción;Descripción;Artículo;Imagen;Fecha Nacimiento;Fecha Muerte;Céntrica
Carrer Major;NA;Major;0;;;;;;;1
Carrer del Mestre;Hombre;Mestre;0;;;;;;;
Travessia de Sant Jordi;Hombre;Travessia de Sant Jordi;1;;;;;;;
Carrer de Sant Jordi;Hombre;Sant Jordi;1;;;;;;;
Carrer del Chardonnay;Hombre;Chardonnay;0;;;;;;;
Carrer de Sant Antoni;Hombre;Sant Antoni;1;;;;;;;1
Carrer de Sant Francesc;Hombre;Sant Francesc;1;;;;;;;
Carrer de Sant Isidre Llaurador;Hombre;Sant Isidre Llaurador;1;;;;;;;
Pas del Gabriel;Hombre;Pas del Gabriel;0;;;;;;;
Carrer de José Luis González Mínguez;Hombre;José Luis González Mínguez;0;;;;;;;
Passeig de Manuel Raventós;Hombre;Manuel Raventós;0;;;;;;;
Plaça de Francesc Viadiu;Hombre;Francesc Viadiu;0;;;;;;;
Plaça de Sant Pere;Hombre;Sant Pere;1;;;;;;;
Plaça de Josep Piñol;Hombre;Josep Piñol;0;;;;;;;
Plaça d'Orvepard;Hombre;Orvepard;0;;;;;;;
Plaça de Joan Santamaria;Hombre;Joan Santamaria;0;;;;;;;
Plaça de Miguel Servet;Hombre;Miguel Servet;0;;;;;;;
Plaça de Miquel Costa Ortega;Hombre;Miquel Costa Ortega;0;;;;;;;
Plaça de Miquel Roig;Hombre;Miquel Roig;0;;;;;;;
Plaça de Manuel Giró;Hombre;Manuel Giró;0;;;;;;;
Plaça d'Emili Subías;Hombre;Emili Subías;0;;;;;;;
Avinguda Alcalde Porqueres;Hombre;Alcalde Porqueres;0;;;;;;;
Carrer de Xavier Puig i Andreu;Hombre;Xavier Puig i Andreu;0;;;;;;;
Carrer de Josep Pallach;Hombre;Josep Pallach;0;;;;;;;
Carrer del Baró de Maials;Hombre;Baró de Maials;0;;;;;;;
Carrer de Vidal i Codina;Hombre;Vidal i Codina;0;;;;;;;
Carrer de Prudenci Murillo;Hombre;Prudenci Murillo;0;;;;;;;
Carrer dels Comtes d'Urgell;Hombre;Comtes d'Urgell;0;;;;;;;1
Carrer del Corregidor Escofet;Hombre;Corregidor Escofet;0;;;;;;;
Avinguda de l'Alcalde Porqueres;Hombre;l'Alcalde Porqueres;0;;;;;;;1
Carrer del Beat Francesc Castelló Aleu;Hombre;Beat Francesc Castelló Aleu;0;;;;;;;
Avinguda de l'Alcalde Rovira Roure;Hombre;l'Alcalde Rovira Roure;0;;;;;;;1
Glorieta de Font i Quer;Hombre;Font i Quer;0;;;;;;;
Carrer d'en Ramon Argilés;Hombre;en Ramon Argilés;0;;;;;;;
Carrer de Sant Pere Claver;Hombre;Sant Pere Claver;1;;;;;;;
Carrer de Pere de Sant Climent;Hombre;Pere de Sant Climent;0;;;;;;;
Carrer de Miquel de Cortiada;Hombre;Miquel de Cortiada;0;;;;;;;
Carrer d'Anastasi Pinós;Hombre;Anastasi Pinós;0;;;;;;;
Avinguda de Pearson;Hombre;Pearson;0;;;;;;;
Carrer de Vicenç Ximenis;Hombre;Vicenç Ximenis;0;;;;;;;
Avinguda Alcalde Rovira Roure;Hombre;Alcalde Rovira Roure;0;;;;;;;
Carrer de l'Enginyer Mas;Hombre;l'Enginyer Mas;0;;;;;;;
Carrer d'Euskadi;NA;Euskadi;0;;;;;;;
Carrer de l'Arquitecte Gomà;Hombre;l'Arquitecte Gomà;0;;;;;;;
Carrer d'Eugeni d'Ors;Hombre;Eugeni d'Ors;0;;;;;;;
Carrer del Paer Casanovas;Hombre;Paer Casanovas;0;;;;;;;1
Carrer de l'Apòstol Sant Jaume;Hombre;l'Apòstol Sant Jaume;1;;;;;;;
"""Carrer de l'Enric Pubill """"lo Parrano""""""";Hombre;"""l'Enric Pubill """"lo Parrano""""""";0;;;;;;;
Avinguda de Sant Pere;Hombre;Sant Pere;1;;;;;;;
Carrer de l'Ambaixador Espens;Hombre;l'Ambaixador Espens;0;;;;;;;
Carrer d'Enric Alderiu;Hombre;Enric Alderiu;0;;;;;;;
Carrer del Metge Abiatar;Hombre;Metge Abiatar;0;;;;;;;
"""Carrer d'Antoni Creus """"lo Pacheco""""""";Hombre;"""Antoni Creus """"lo Pacheco""""""";0;;;;;;;
Carrer de Martí Gralla;Hombre;Martí Gralla;0;;;;;;;
Carrer del Pintor Albert Vives;Hombre;Pintor Albert Vives;0;;;;;;;
Carrer del Mossèn Pelegrí;Hombre;Mossèn Pelegrí;0;;;;;;;
Carrer de Francesc Molí;Hombre;Francesc Molí;0;;;;;;;
Carrer dels Hospitalers de Sant Joan;Hombre;Hospitalers de Sant Joan;0;;;;;;;
Carrer de Balaguer;Hombre;Balaguer;0;;;;;;;
Carrer de Francesc Solana i Fortuño;Hombre;Francesc Solana i Fortuño;0;;;;;;;
Carrer dels Germans Queralt;Hombre;Germans Queralt;0;;;;;;;
Carrer de Sant Lleïr;Hombre;Sant Lleïr;1;;;;;;;
Carrer d'Enric Farreny;Hombre;Enric Farreny;0;;;;;;;
Carrer de Baldomer Gili i Roig;Hombre;Baldomer Gili i Roig;0;;;;;;;
Carrer de Josep Segura Farré;Hombre;Josep Segura Farré;0;;;;;;;
Carrer del Doctor Biosca;Hombre;Doctor Biosca;0;;;;;;;
Carrer de José Olondriz Ostiz;Hombre;José Olondriz Ostiz;0;;;;;;;
Carrer de Bonifaci VIII;Hombre;Bonifaci VIII;0;;;;;;;
Travessera de Francesc Molí;Hombre;Travessera de Francesc Molí;0;;;;;;;
Carrer del Cartoixà Telm;Hombre;Cartoixà Telm;0;;;;;;;
Carrer de Violant de Hungria;Hombre;Violant de Hungria;0;;;;;;;
Carrer de l'Escultor Corsellés;Hombre;l'Escultor Corsellés;0;;;;;;;
Carrer de Ferrara;Hombre;Ferrara;0;;;;;;;
Carrer de Sant Hilari;Hombre;Sant Hilari;1;;;;;;;
Carrer de Roca i Lletjós;Hombre;Roca i Lletjós;0;;;;;;;
Carrer de Sant Lluís Gonzaga;Hombre;Sant Lluís Gonzaga;1;;;;;;;
Carrer del Pare Palau;Hombre;Pare Palau;0;;;;;;;
Carrer de Laureà Figuerola;Hombre;Laureà Figuerola;0;;;;;;;
Carrer del Mossen Solé;Hombre;Mossen Solé;0;;;;;;;
Carrer de Sant Pasqual Bailón;Hombre;Sant Pasqual Bailón;1;;;;;;;
Carrer de Josep Fontseré;Hombre;Josep Fontseré;0;;;;;;;
Carrer de Daunois;Hombre;Daunois;0;;;;;;;
Carrer de Jordi Solé Tura;Hombre;Jordi Solé Tura;0;;;;;;;
Carrer de Joan del Rei;Hombre;Joan del Rei;0;;;;;;;
Carrer d'Antoni Agustí;Hombre;Antoni Agustí;0;;;;;;;
Carrer de Guillem de Botet;Hombre;Guillem de Botet;0;;;;;;;
Carrer de Frederic Riu i Farré;Hombre;Frederic Riu i Farré;0;;;;;;;
Carrer de Joan Culleré;Hombre;Joan Culleré;0;;;;;;;
Carrer d'en Justo Torres;Hombre;en Justo Torres;0;;;;;;;
Carrer de Carles Fontseré;Hombre;Carles Fontseré;0;;;;;;;
Carrer del Periodista Trapa;Hombre;Periodista Trapa;0;;;;;;;
Carrer del Monsteri Gerri;Hombre;Monsteri Gerri;0;;;;;;;
Carrer de l'Arquitecte Campmany;Hombre;l'Arquitecte Campmany;0;;;;;;;
Carrer de l'Arquitecte Villalonga;Hombre;l'Arquitecte Villalonga;0;;;;;;;
Carrer de l'Arquitecte Celles;Hombre;l'Arquitecte Celles;0;;;;;;;
Carrer de l'Enric Crous;Hombre;l'Enric Crous;0;;;;;;;
Carrer de l'Arquitecte Lamarca;Hombre;l'Arquitecte Lamarca;0;;;;;;;
Carrer del Doctor Jaume Melcior;Hombre;Doctor Jaume Melcior;0;;;;;;;
Carrer de l'Arquitecte Porqueras;Hombre;l'Arquitecte Porqueras;0;;;;;;;
Carrer de l'Arquitecte Florensa;Hombre;l'Arquitecte Florensa;0;;;;;;;
Carrer de l'Arquitecte Domènech Torres;Hombre;l'Arquitecte Domènech Torres;0;;;;;;;
Carrer de l'Arquitecte Bergós;Hombre;l'Arquitecte Bergós;0;;;;;;;
Carrer de l'Arquitecte Cases;Hombre;l'Arquitecte Cases;0;;;;;;;
Carrer de l'Arquitecte Morera i Gatell;Hombre;l'Arquitecte Morera i Gatell;0;;;;;;;
Carrer de Felip de Silva;Hombre;Felip de Silva;0;;;;;;;
Carrer de Pascual Madoz;Hombre;Pascual Madoz;0;;;;;;;
"""Carrer de Salvador Segui """"el noi de sucre""""""";Hombre;"""Salvador Segui """"el noi de sucre""""""";0;;;;;;;
Carrer d'Alfarràs;NA;Alfarràs;0;;;;;;;1
Carrer d'Albert Coma i Estadella;Hombre;Albert Coma i Estadella;0;;;;;;;
Carrer d'Antoni Vilaplana;Hombre;Antoni Vilaplana;0;;;;;;;
Carrer de Josep Maria Alba;Hombre;Josep Maria Alba;0;;;;;;;
Carrer de Francesc Porta Vilalta;Hombre;Francesc Porta Vilalta;0;;;;;;;
Carrer de l'Almirall Folch;Hombre;l'Almirall Folch;0;;;;;;;
Carrer de Gandhi;Hombre;Gandhi;0;;;;;;;
Carrer d'Oriol Martorell;Hombre;Oriol Martorell;0;;;;;;;
Carrer de Jaume d'Agramunt;Hombre;Jaume d'Agramunt;0;;;;;;;
Carrer del Pare Gabernet;Hombre;Pare Gabernet;0;;;;;;;
Carrer de Joan Baptista Xuriguera;Hombre;Joan Baptista Xuriguera;0;;;;;;;
Carrer d'Anselm Charles;Hombre;Anselm Charles;0;;;;;;;
Carrer de l'Oriol Martorell;Hombre;l'Oriol Martorell;0;;;;;;;
Carrer de Yehudi Menuhin;Hombre;Yehudi Menuhin;0;;;;;;;
Carrer del Doctor Ramon Pigem;Hombre;Doctor Ramon Pigem;0;;;;;;;
Doctor Estopà;Hombre;Doctor Estopà;0;;;;;;;
Carrer d'Algerri;Hombre;Algerri;0;;;;;;;
Carrer del Doctor Estopà;Hombre;Doctor Estopà;0;;;;;;;
Carrer del Doctor Cambrodí;Hombre;Doctor Cambrodí;0;;;;;;;
Carrer de Jordi Dauder;Hombre;Jordi Dauder;0;;;;;;;
Carrer de Jeroni Pujades;Hombre;Jeroni Pujades;0;;;;;;;1
Carrer del Princep de Viana;Hombre;Princep de Viana;0;;;;;;;1
Camí del Julià;Hombre;Julià;0;;;;;;;
Plaça de Josep Estadella;Hombre;Josep Estadella;0;;;;;;;
Plaça de Ricard Vinyes;Hombre;Ricard Vinyes;0;;;;;;;1
Plaça de Màrius Carretero;Hombre;Màrius Carretero;0;;;;;;;1
Rambla de Ferran;Hombre;Ferran;0;;;;;;;1
Plaça de Sant Joan;Hombre;Sant Joan;1;;;;;;;1
Plaça de Pau Casals;Hombre;Pau Casals;0;;;;;;;1
Plaça de Jesús Moncada;Hombre;Jesús Moncada;0;;;;;;;1
Plaça de Víctor Siurana;Hombre;Víctor Siurana;0;;;;;;;1
Plaça de Sant Josep;Hombre;Sant Josep;1;;;;;;;1
Plaça de Joan XXIII;Hombre;Joan XXIII;0;;;;;;;
Plaça de Josep Wehrle;Hombre;Josep Wehrle;0;;;;;;;
Plaça de Josep Solans;Hombre;Josep Solans;0;;;;;;;1
Plaça de Wifred I;Hombre;Wifred I;0;;;;;;;1
Plaça de Sant Llorenç;Hombre;Sant Llorenç;1;;;;;;;1
Plaça de Joan Vilagrasa;Hombre;Joan Vilagrasa;0;;;;;;;
Plaça de Jaume Gort;Hombre;Jaume Gort;0;;;;;;;
Plaça de Sant Francesc;Hombre;Sant Francesc;1;;;;;;;1
Plaça del Mossèn Cinto Verdaguer;Hombre;Mossèn Cinto Verdaguer;0;;;;;;;1
Plaça de Josep Boneu;Hombre;Josep Boneu;0;;;;;;;1
Plaça del Pare Nadal;Hombre;Pare Nadal;0;;;;;;;
Plaça de Francisco Sanjuán;Hombre;Francisco Sanjuán;0;;;;;;;
Plaça de Pablo Iglesias;Hombre;Pablo Iglesias;0;;;;;;;1
Plaça de Sant Antoni Maria Claret;Hombre;Sant Antoni Maria Claret;1;;;;;;;1
Plaça del Molí de Sant Anastasí;Hombre;Molí de Sant Anastasí;0;;;;;;;
Plaça de Josep Prenafeta;Hombre;Josep Prenafeta;0;;;;;;;1
Plaça de Cappont;Hombre;Cappont;0;;;;;;;1
Plaça Victor Mateu i Moles;Hombre;Victor Mateu i Moles;0;;;;;;;
Plaça de Berenguer IV;Hombre;Berenguer IV;0;;;;;;;1
Plaça d'Esteve Cuito;Hombre;Esteve Cuito;0;;;;;;;1
Carrer de Cos Gayón;Hombre;Cos Gayón;0;;;;;;;
Plaça de Ramon Berenguer IV;Hombre;Ramon Berenguer IV;0;;;;;;;1
Carrer dels Agustins;Hombre;Agustins;0;;;;;;;1
Avinguda de Miquel Batllori;Hombre;Miquel Batllori;0;;;;;;;
Carrer de l'Anselm Clavé;Hombre;l'Anselm Clavé;0;;;;;;;1
Avinguda del Doctor Fleming;Hombre;Doctor Fleming;0;;;;;;;1
Carrer de Saracíbar;Hombre;Saracíbar;0;;;;;;;1
Carrer del Governador de Montcada;Hombre;Governador de Montcada;0;;;;;;;1
Carrer de Lluís Besa;Hombre;Lluís Besa;0;;;;;;;1
Carrer del Bisbe;Hombre;Bisbe;0;;;;;;;1
Carrer de Sant Martí;Hombre;Sant Martí;1;;;;;;;1
Carrer de l'Alcalde Sol;Hombre;l'Alcalde Sol;0;;;;;;;1
Carrer del Mestre Tonet;Hombre;Mestre Tonet;0;;;;;;;
Carrer d'Isaac Albéniz;Hombre;Isaac Albéniz;0;;;;;;;1
Carrer de Bonaire;Hombre;Bonaire;0;;;;;;;1
Avinguda de Sant Ruf;Hombre;Sant Ruf;1;;;;;;;1
Carrer de Pere de Cabrera;Hombre;Pere de Cabrera;0;;;;;;;1
Carrer de Jaume II;Hombre;Jaume II;0;;;;;;;1
Carrer de Manuel del Palacio;Hombre;Manuel del Palacio;0;;;;;;;1
Carrer de l'Artur Mor Roig;Hombre;l'Artur Mor Roig;0;;;;;;;
Carrer del Canonge Brugulat;Hombre;Canonge Brugulat;0;;;;;;;1
Avinguda de Francesc Macià;Hombre;Francesc Macià;0;;;;;;;1
Carrer d'Alfred Perenya;Hombre;Alfred Perenya;0;;;;;;;1
Carrer del Pintor Xavier Gose;Hombre;Pintor Xavier Gose;0;;;;;;;
Carrer del Doctor Combelles;Hombre;Doctor Combelles;0;;;;;;;1
Carrer de Joan Miró;Hombre;Joan Miró;0;;;;;;;1
Carrer de Roca Llabrador;Hombre;Roca Llabrador;0;;;;;;;1
Carrer de l'Alcalde Costa;Hombre;l'Alcalde Costa;0;;;;;;;1
Carrer de Ramon Soldevila;Hombre;Ramon Soldevila;0;;;;;;;1
Carrer de Ferran el Catòlic;Hombre;Ferran el Catòlic;0;;;;;;;
Rotonda Ferran el Catòlic - Rossinyol;Hombre;Ferran el Catòlic - Rossinyol;0;;;;;;;
Carrer de Ton Sirera;Hombre;Ton Sirera;0;;;;;;;
Carrer de l'Historiador Josep Lladonosa;Hombre;l'Historiador Josep Lladonosa;0;;;;;;;
Carrer de Narcís Monturiol;Hombre;Narcís Monturiol;0;;;;;;;
Carrer de Sant Joan de Mata;Hombre;Sant Joan de Mata;1;;;;;;;1
Avinguda de Pius XII;Hombre;Pius XII;0;;;;;;;1
Carrer de Lluís Companys;Hombre;Lluís Companys;0;;;;;;;1
Avinguda de Galileo Galilei;Hombre;Galileo Galilei;0;;;;;;;
Carrer d'Henri Dunant;Hombre;Henri Dunant;0;;;;;;;
Carrer del Doctor Trueta;Hombre;Doctor Trueta;0;;;;;;;1
Carrer de Josep Carner;Hombre;Josep Carner;0;;;;;;;1
Carrer del Cronista Muntaner;Hombre;Cronista Muntaner;0;;;;;;;1
Carrer de Pere Cavasèquia;Hombre;Pere Cavasèquia;0;;;;;;;1
Carrer del Pintor García Lamolla;Hombre;Pintor García Lamolla;0;;;;;;;
Carrer de Llorens Agustí Claveria;Hombre;Llorens Agustí Claveria;0;;;;;;;
Rotonda Llorens Agustí - Josep Baró;Hombre;Llorens Agustí - Josep Baró;0;;;;;;;
Carrer del Cardenal Remolins;Hombre;Cardenal Remolins;0;;;;;;;1
Carrer de l'Enginyer Pau Agustí;Hombre;l'Enginyer Pau Agustí;0;;;;;;;
Carrer d'Antoni Guix i Ribelles;Hombre;Antoni Guix i Ribelles;0;;;;;;;
Carrer de Sant Jaume;Hombre;Sant Jaume;1;;;;;;;
Carrer de Riquer;Hombre;Riquer;0;;;;;;;1
Carrer de Roger de Llúria;Hombre;Roger de Llúria;0;;;;;;;1
Carrer dels Germans Izquierdo;Hombre;Germans Izquierdo;0;;;;;;;
Carrer de l'Indíbil i Mandoni;Hombre;l'Indíbil i Mandoni;0;;;;;;;
Carrer de Sans i Ribes;Hombre;Sans i Ribes;0;;;;;;;1
Carrer de Pau Claris;Hombre;Pau Claris;0;;;;;;;1
Carrer del Taquígraf Martí;Hombre;Taquígraf Martí;0;;;;;;;1
Carrer de Nadal Meroles;Hombre;Nadal Meroles;0;;;;;;;
Carrer del Mossèn Reig;Hombre;Mossèn Reig;0;;;;;;;
Carrer d'Humbert Torres;Hombre;Humbert Torres;0;;;;;;;1
Carrer de Josep Pla;Hombre;Josep Pla;0;;;;;;;
Carrer de Pi i Maragall;Hombre;Pi i Maragall;0;;;;;;;1
Carrer d'Onofre Cerveró;Hombre;Onofre Cerveró;0;;;;;;;1
Carrer de Cristòfol de Boleda;Hombre;Cristòfol de Boleda;0;;;;;;;
Carrer de Ramón i Cajal;Hombre;Ramón i Cajal;0;;;;;;;
Carrer de Magí Morera;Hombre;Magí Morera;0;;;;;;;1
Carrer de Maragall;Hombre;Maragall;0;;;;;;;1
Carrer del Bisbe Messeguer;Hombre;Bisbe Messeguer;0;;;;;;;1
Carrer de Pleyan de Porta;Hombre;Pleyan de Porta;0;;;;;;;1
Carrer de l'Alcalde Pujol;Hombre;l'Alcalde Pujol;0;;;;;;;
Rotonda Alcalde Pujol - Segrià;Hombre;Alcalde Pujol - Segrià;0;;;;;;;
Carrer del Pintor Morera Galicia;Hombre;Pintor Morera Galicia;0;;;;;;;
Carrer de Guillem de Bessiers;Hombre;Guillem de Bessiers;0;;;;;;;
Carrer del Bisbe Irurita;Hombre;Bisbe Irurita;0;;;;;;;1
Carrer de Duke Ellington;Hombre;Duke Ellington;0;;;;;;;
Carrer d'Andreu d'Espens;Hombre;Andreu d'Espens;0;;;;;;;
Carrer d'Agustí Font;Hombre;Agustí Font;0;;;;;;;
Pont del Príncep de Viana;Hombre;Príncep de Viana;0;;;;;;;1
Avinguda de Victoriano Muñoz;Hombre;Victoriano Muñoz;0;;;;;;;1
Carrer de l'Eduard Velasco;Hombre;l'Eduard Velasco;0;;;;;;;1
Carrer de Valentí Almirall;Hombre;Valentí Almirall;0;;;;;;;1
Carrer d'Enric Granados;Hombre;Enric Granados;0;;;;;;;1
Carrer de Miquel Batllori;Hombre;Miquel Batllori;0;;;;;;;1
Carrer del Baró d'Eroles;Hombre;Baró d'Eroles;0;;;;;;;
Avinguda del President Josep Irla;Hombre;President Josep Irla;0;;;;;;;1
Carrer de Goya;Hombre;Goya;0;;;;;;;
Passatge de Miquel Aragonès;Hombre;Miquel Aragonès;0;;;;;;;
Carrer de Manuel Carrasco i Formiguera;Hombre;Manuel Carrasco i Formiguera;0;;;;;;;
Carrer de Sant Paulí de Nola;Hombre;Sant Paulí de Nola;1;;;;;;;
Rotonda Pre. Josep Irla - Enginyer Antoni Llobet;Hombre;Pre. Josep Irla - Enginyer Antoni Llobet;0;;;;;;;
Carrer de l'Enginyer Antoni Llobet;Hombre;l'Enginyer Antoni Llobet;0;;;;;;;
Avinguda de Miquel Batllorí;Hombre;Miquel Batllorí;0;;;;;;;
Avinguda de Charles Darwin;Hombre;Charles Darwin;0;;;;;;;
Carrer de Mart;NA;Mart;0;;;;;;;
Carrer de Leandre Cristòfol;Hombre;Leandre Cristòfol;0;;;;;;;
Passatge de Pompeu;Hombre;Pompeu;0;;;;;;;1
Carrer de Ramon Rubial;Hombre;Ramon Rubial;0;;;;;;;
Carrer de Josep Baró i Travé;Hombre;Josep Baró i Travé;0;;;;;;;
Carrer Pol. Ind. Camí dels Frares;Hombre;Pol. Ind. Camí dels Frares;0;;;;;;;
Carrer de l'Arquitecte Ignasi Miquel;Hombre;l'Arquitecte Ignasi Miquel;0;;;;;;;
Carrer d'Antoni Bergós i Massó;Hombre;Antoni Bergós i Massó;0;;;;;;;1
Carrer del Canonge González;Hombre;Canonge González;0;;;;;;;1
Carrer de Pius XII;Hombre;Pius XII;0;;;;;;;
Carrer de l'Abat Escarré;Hombre;l'Abat Escarré;0;;;;;;;1
Carrer del Comte de Vinatesa;Hombre;Comte de Vinatesa;0;;;;;;;1
Carrer d'Agustí Duran i Sanpere;Hombre;Agustí Duran i Sanpere;0;;;;;;;1
Carrer del Marqués de Leganés;Hombre;Marqués de Leganés;0;;;;;;;1
Carrer del Pare Soler;Hombre;Pare Soler;0;;;;;;;1
Carrer del Mestre Emili Pujol;Hombre;Mestre Emili Pujol;0;;;;;;;1
Carrer de Ramón y Cajal;Hombre;Ramón y Cajal;0;;;;;;;1
Carrer d'en Joan Baget;Hombre;en Joan Baget;0;;;;;;;1
Carrer de Juli Cèsar;Hombre;Juli Cèsar;0;;;;;;;1
Passatge del Príncep de Viana;Hombre;Príncep de Viana;0;;;;;;;
Carrer del Doctor Zamenhof;Hombre;Doctor Zamenhof;0;;;;;;;1
Carrer del General Brito;Hombre;General Brito;0;;;;;;;1
Carrer de Ramon Castejón;Hombre;Ramon Castejón;0;;;;;;;1
Carrer de l'Alcalde Fuster;Hombre;l'Alcalde Fuster;0;;;;;;;1
Carrer de Lluís Roca;Hombre;Lluís Roca;0;;;;;;;1
Passatge de Miquel Fargas;Hombre;Miquel Fargas;0;;;;;;;1
Carrer del Cardenal Cisneros;Hombre;Cardenal Cisneros;0;;;;;;;
Carrer d'Àngel Moncusí;Hombre;Àngel Moncusí;0;;;;;;;
Carrer de Ramon Llull;Hombre;Ramon Llull;0;;;;;;;1
Carrer d'Ermengol VI;Hombre;Ermengol VI;0;;;;;;;
Carrer d'Aribau;Hombre;Aribau;0;;;;;;;1
Carrer del Pintor Bensey;Hombre;Pintor Bensey;0;;;;;;;1
Carrer del Músic Vivaldi;Hombre;Músic Vivaldi;0;;;;;;;
Carrer de Joan Fuster;Hombre;Joan Fuster;0;;;;;;;1
Carrer de Manuel de Pedrolo;Hombre;Manuel de Pedrolo;0;;;;;;;1
Carrer de Salvador Espriu;Hombre;Salvador Espriu;0;;;;;;;1
Carrer de Vilanova de la Barca;Hombre;Vilanova de la Barca;0;;;;;;;
Carrer dels Germans Pignatelli;Hombre;Germans Pignatelli;0;;;;;;;
Carrer de Josep Sarraté i Forga;Hombre;Josep Sarraté i Forga;0;;;;;;;
Carrer de Joan Gavarra;Hombre;Joan Gavarra;0;;;;;;;
Carrer de Francesc Bordalda i Montardit;Hombre;Francesc Bordalda i Montardit;0;;;;;;;
Carrer de Ricard Calvet i Serra;Hombre;Ricard Calvet i Serra;0;;;;;;;
Carrer de Sant Pere Nolasc;Hombre;Sant Pere Nolasc;1;;;;;;;
Carrer de Berenguer Prenafet;Hombre;Berenguer Prenafet;0;;;;;;;
Carrer de l'Esculptor Gualter;Hombre;l'Esculptor Gualter;0;;;;;;;
Carrer de Sant Francesc Xavier;Hombre;Sant Francesc Xavier;1;;;;;;;
Carrer de García Lorca;Hombre;García Lorca;0;;;;;;;
Carrer d'Odon Fonoll;Hombre;Odon Fonoll;0;;;;;;;
Carrer de Sant Roc;Hombre;Sant Roc;1;;;;;;;
Carrer de Manuel Carbelo;Hombre;Manuel Carbelo;0;;;;;;;
Carrer del Transformador;Hombre;Transformador;0;;;;;;;
Carrer de Miguel Hernández;Hombre;Miguel Hernández;0;;;;;;;
Carrer del Comte de Rueda;Hombre;Comte de Rueda;0;;;;;;;
Carrer de Francesc Argilés i Bifet;Hombre;Francesc Argilés i Bifet;0;;;;;;;
Carrer de Sant Josep Obrer;Hombre;Sant Josep Obrer;1;;;;;;;
Carrer de Sant Joan Baptista;Hombre;Sant Joan Baptista;1;;;;;;;
Carrer de Sant Agustí;Hombre;Sant Agustí;1;;;;;;;
Carrer d'Antoni Solé;Hombre;Antoni Solé;0;;;;;;;
Carrer de Ludovicus Pius;Hombre;Ludovicus Pius;0;;;;;;;
Avinguda de Victor Torres;Hombre;Victor Torres;0;;;;;;;
Carrer de Sant Ramon;Hombre;Sant Ramon;1;;;;;;;
Carrer de Binèfar;Hombre;Binèfar;0;;;;;;;
Carrer del Metge Mercè;Hombre;Metge Mercè;0;;;;;;;
Carrer de Miquel Serra;Hombre;Miquel Serra;0;;;;;;;
Carrer d'Àger;Hombre;Àger;0;;;;;;;
Carrer de Josep Betriu;Hombre;Josep Betriu;0;;;;;;;
Carrer de l'Arquitecte Gaudí;Hombre;l'Arquitecte Gaudí;0;;;;;;;
Carrer de Casimir Vila;Hombre;Casimir Vila;0;;;;;;;
Carrer de Sant Vicenç de Paül;Hombre;Sant Vicenç de Paül;1;;;;;;;
Carrer de Sant Isidre - Bordeta;Hombre;Sant Isidre - Bordeta;1;;;;;;;
Carrer de Samuel Gili i Gaya;Hombre;Samuel Gili i Gaya;0;;;;;;;
Carrer de Joan Carles;Hombre;Joan Carles;0;;;;;;;
Carrer de l'Alcalde Vives;Hombre;l'Alcalde Vives;0;;;;;;;
Carrer de Màrius Torres;Hombre;Màrius Torres;0;;;;;;;
Carrer de Sant Andreu;Hombre;Sant Andreu;1;;;;;;;1
Carrer de la Ronda de Sant Martí;Hombre;Ronda de Sant Martí;1;;;;;;;1
Carrer d'en Peralta;Hombre;en Peralta;0;;;;;;;1
Carrer de Jaume I el Conqueridor;Hombre;Jaume I el Conqueridor;0;;;;;;;1
Carrer de Ballester;Hombre;Ballester;0;;;;;;;1
Travessia del Cardenal Remolins;Hombre;Travessia del Cardenal Remolins;0;;;;;;;1
Carrer del Baró de Casa Fleix;Hombre;Baró de Casa Fleix;0;;;;;;;1
Camí Fons de Magraners;Hombre;Fons de Magraners;0;;;;;;;
Carrer del Bisbe Ruano;Hombre;Bisbe Ruano;0;;;;;;;1
Carrer Bisbe Ruano;Hombre;Bisbe Ruano;0;;;;;;;1
Carrer de l'Albert Porqueres;Hombre;l'Albert Porqueres;0;;;;;;;
Carrer del Bisbe Galindo;Hombre;Bisbe Galindo;0;;;;;;;1
Carrer del Mossèn Amic;Hombre;Mossèn Amic;0;;;;;;;1
Carrer Narcís Monturiol;Hombre;Narcís Monturiol;0;;;;;;;
Plaça de Víctor Mateu i Moles;Hombre;Víctor Mateu i Moles;0;;;;;;;
Rotonda Alcalde Pujol - Cristòfol de Boleda;Hombre;Alcalde Pujol - Cristòfol de Boleda;0;;;;;;;
Carrer d'Alfons II;Hombre;Alfons II;0;;;;;;;1
Carrer de Cappont;Hombre;Cappont;0;;;;;;;1
Avinguda Victoriano Muñoz;Hombre;Victoriano Muñoz;0;;;;;;;
Avinguda del President Tarradellas;Hombre;President Tarradellas;0;;;;;;;1
Carrer d'Ivars d'Urgell;Hombre;Ivars d'Urgell;0;;;;;;;
Carrer d'Antoni Blavia;Hombre;Antoni Blavia;0;;;;;;;
Carrer de Sant Salvador;Hombre;Sant Salvador;1;;;;;;;
Carrer de Sant Cristòfol;Hombre;Sant Cristòfol;1;;;;;;;1
Plaça de Cervantes;Hombre;Cervantes;0;;;;;;;1
Passatge d'Agustí Duran;Hombre;Agustí Duran;0;;;;;;;1
Plaça de Blas Infante;Hombre;Blas Infante;0;;;;;;;1
Carrer de Manuel Gaya i Tomàs;Hombre;Manuel Gaya i Tomàs;0;;;;;;;1
Carrer de Picasso;Hombre;Picasso;0;;;;;;;1
Carrer de Daniel;Hombre;Daniel;0;;;;;;;1
Carrer del General;Hombre;General;0;;;;;;;1
Carrer de Sant Joan;Hombre;Sant Joan;1;;;;;;;1
Carrer de Sant Ignasi de Loiola;Hombre;Sant Ignasi de Loiola;1;;;;;;;
Carrer de l'Alcalde Mestre;Hombre;l'Alcalde Mestre;0;;;;;;;1
Carrer de Sant Anastasi;Hombre;Sant Anastasi;1;;;;;;;1
Carrer del Sant Crist;Hombre;Sant Crist;1;;;;;;;1
Carrer de l'Artur Vives;Hombre;l'Artur Vives;0;;;;;;;
Carrer d'August Font;Hombre;August Font;0;;;;;;;
Carrer de Jordi Cortada;Hombre;Jordi Cortada;0;;;;;;;1
Carrer del Bon Pastor;Hombre;Bon Pastor;0;;;;;;;
Passeig de Joan XXIII;Hombre;Joan XXIII;0;;;;;;;
Carrer de Mossen Salvador;Hombre;Mossen Salvador;0;;;;;;;
Blocs de Landelino Lavilla;Hombre;Blocs de Landelino Lavilla;0;;;;;;;
Carrer del Joglar Segalà;Hombre;Joglar Segalà;0;;;;;;;1
Carrer de Sant Carles;Hombre;Sant Carles;1;;;;;;;1
Jardins de Pompeu Fabra;Hombre;Jardins de Pompeu Fabra;0;;;;;;;1
Carrer del Vescompte Arnau;Hombre;Vescompte Arnau;0;;;;;;;
Plaça de Sant Jordi;Hombre;Sant Jordi;1;;;;;;;
Carrer de l'Ignasi Bastus;Hombre;l'Ignasi Bastus;0;;;;;;;
Carrer de Sant Francesc de Sales;Hombre;Sant Francesc de Sales;1;;;;;;;
Carrer d'Agramunt;Hombre;Agramunt;0;;;;;;;
Passatge de Sant Jeroni;Hombre;Sant Jeroni;1;;;;;;;
Carrer de l'Arnald de Solsona;Hombre;l'Arnald de Solsona;0;;;;;;;1
Carrer de Rafael Gras i d'Esteva;Hombre;Rafael Gras i d'Esteva;0;;;;;;;
Carrer de Josep Viola i Gamon;Hombre;Josep Viola i Gamon;0;;;;;;;
Carrer de Manuel Florensa;Hombre;Manuel Florensa;0;;;;;;;
Carrer de l'Enginyer Santi Companys;Hombre;l'Enginyer Santi Companys;0;;;;;;;
Carrer de l'Impressor Botel;Hombre;l'Impressor Botel;0;;;;;;;
Blocs Príncep Joan Carles;Hombre;Blocs Príncep Joan Carles;0;;;;;;;
Passatge de Sant Roc;Hombre;Sant Roc;1;;;;;;;
Carrer de Sant Isidre - Magraners;Hombre;Sant Isidre - Magraners;1;;;;;;;
Carrer de Domènec de Miguel;Hombre;Domènec de Miguel;0;;;;;;;
Carrer de Pere de Coma;Hombre;Pere de Coma;0;;;;;;;1
Carrer del Bisbe Torres;NA;Bisbe Torres;0;;;;;;;1
Travessia d'Alfred Perenya;Hombre;Travessia d'Alfred Perenya;0;;;;;;;1
Passatge de Ramon i Cajal;Hombre;Ramon i Cajal;0;;;;;;;
Passatge del Capità Farré;Hombre;Capità Farré;0;;;;;;;
Carrer del Rei;Hombre;Rei;0;;;;;;;1
Carrer d'Enric Roca Peralta;Hombre;Enric Roca Peralta;0;;;;;;;
Carrer de Sant Domènec;Hombre;Sant Domènec;1;;;;;;;1
Carrer de Calixto III;Hombre;Calixto III;0;;;;;;;
Carrer d'Agues Tortes;Hombre;Agues Tortes;0;;;;;;;
Departament de Sant Cristòfor;Hombre;Departament de Sant Cristòfor;1;;;;;;;
Departament de Sant Anastasi;Hombre;Departament de Sant Anastasi;1;;;;;;;
Departament de Sant Miquel;Hombre;Departament de Sant Miquel;1;;;;;;;
Departament del Sant Crist;Hombre;Departament del Sant Crist;1;;;;;;;
Departament de Sant Josep;Hombre;Departament de Sant Josep;1;;;;;;;
Departament de Josep;Hombre;Departament de Josep;0;;;;;;;
Departament de Sant Pere;Hombre;Departament de Sant Pere;1;;;;;;;
Departament de Sant Lleir;Hombre;Departament de Sant Lleir;1;;;;;;;
Carrer de Folch i Tores;Hombre;Folch i Tores;0;;;;;;;
Carrer de Josep M. Minguella;Hombre;Josep M. Minguella;0;;;;;;;
Carrer de Sunyer;Hombre;Sunyer;0;;;;;;;
Carrer de Rafael Alberti;Hombre;Rafael Alberti;0;;;;;;;
Carrer Manuel de Falla;Hombre;Manuel de Falla;0;;;;;;;
Carrer Lluís Millet;Hombre;Lluís Millet;0;;;;;;;
Carrer Princep de Viana;Hombre;Princep de Viana;0;;;;;;;1
Carrer de Segarra;Hombre;Segarra;0;;;;;;;1
Carretera de la Carrerada de Sant Esperit a Grealó;Hombre;Carrerada de Sant Esperit a Grealó;0;;;;;;;
Carrer de Simeó Miquel;Hombre;Simeó Miquel;0;;;;;;;
Plaça del Pare Sanaüja;Hombre;Pare Sanaüja;0;;;;;;;
Carrer de Sant Pau;Hombre;Sant Pau;1;;;;;;;1
Travessia del Carme;Mujer;Travessia del Carme;0;;;;;;;1
Carrer del Carme;Mujer;Carme;0;;;;;;;1
Carrer de la Verge de Montserrat de Raimat;Mujer;Verge de Montserrat de Raimat;1;;;;;;;
Carrer de Maria Tersa;Mujer;Maria Tersa;0;;;;;;;
Plaça de Maria Rosell;Mujer;Maria Rosell;0;;;;;;;
Plaça d'Elisenda de Montcada;Mujer;Elisenda de Moncada;0;;Reina consorte de Aragón (1322-1327);https://es.wikipedia.org/wiki/Elisenda_de_Moncada;http://commons.wikimedia.org/wiki/Special:FilePath/Tomba%20d%27Elisenda%20de%20Montcada%20%28detall%29.jpg;1292-01-01T00:00:00Z;1364-07-17T00:00:00Z;
Plaça de Clara Campoamor;Mujer;Clara Campoamor;0;;política española, feminista;https://es.wikipedia.org/wiki/Clara_Campoamor;http://commons.wikimedia.org/wiki/Special:FilePath/Clara%20Campoamor.png;1888-02-12T00:00:00Z;1972-04-30T00:00:00Z;
Plaça de Federica Montseny;Mujer;Federica Montseny;0;;política, sindicalista anarquista y escritora española;https://es.wikipedia.org/wiki/Federica_Montseny;http://commons.wikimedia.org/wiki/Special:FilePath/Federica%20Montseny.jpg;1905-02-12T00:00:00Z;1994-01-14T00:00:00Z;
