Calle;Género;Nombre;Religioso;Ficción;Descripción;Artículo;Imagen;Fecha Nacimiento;Fecha Muerte;Céntrica
Plaza de Manuel Llano;Hombre;Manuel Llano;;;;;;;;
Avenida del Cardenal Herrera Oria;Hombre;Cardenal Herrera Oria;;;;;;;;
Calle de José María de Cossío;Hombre;José María de Cossío;;;;;;;;
Calle de Ricardo León;Hombre;Ricardo León;;;;;;;;
Calle del Lirio;Hombre;Lirio;;;;;;;;
Plaza de Alberto Corral;Hombre;Alberto Corral;;;;;;;;
Calle de José Estrañi;Hombre;José Estrañi;;;;;;;;
Calle de Leopoldo Alas Clarín;Hombre;Leopoldo Alas Clarín;;;;;;;;
Calle de Alberico Pardo;Hombre;Alberico Pardo;;;;;;;;
Calle del Doctor González Torre;Hombre;Doctor González Torre;;;;;;;;
Calle de Santiago Ontañón;Hombre;Santiago Ontañón;;;;;;;;
Calle de José Antonio Maza;Hombre;José Antonio Maza;;;;;;;;
Calle de Faustino Cavadas;Hombre;Faustino Cavadas;;;;;;;;
Calle de Santiago García Cuadrado;Hombre;Santiago García Cuadrado;;;;;;;;
Calle de Ángel Medina;Hombre;Ángel Medina;;;;;;;;
Avenida de José Ortega y Gasset;Hombre;José Ortega y Gasset;;;;;;;;
Calle del Padre Carballo;Hombre;Padre Carballo;;;;;;;;
Calle de Ricardo López Aranda;Hombre;Ricardo López Aranda;;;;;;;;
Calle de Juan Guerrero Urreisti;Hombre;Juan Guerrero Urreisti;;;;;;;;
Calle de Manuel Rioz Pedraja;Hombre;Manuel Rioz Pedraja;;;;;;;;
Glorieta de Emilio Díaz Caneja;Hombre;Emilio Díaz Caneja;;;;;;;;
Avenida de Julio Jaurena;Hombre;Julio Jaurena;;;;;;;;
Avenida de Julio Jaurena;Hombre;Julio Jaurena;;;;;;;;
Avenida de Julio Jaurena;Hombre;Julio Jaurena;;;;;;;;
Avenida de Vicente Trueba;Hombre;Vicente Trueba;;;;;;;;
Calle de Alfredo Kraus;Hombre;Alfredo Kraus;;;;;;;;
Calle de Francisco de Iturrino;Hombre;Francisco de Iturrino;;;;;;;;
Calle de Rafael Alsua;Hombre;Rafael Alsua;;;;;;;;
Calle de Roy García de Santander;Hombre;Roy García de Santander;;;;;;;;
Calle de Joaquín Rodrigo;Hombre;Joaquín Rodrigo;;;;;;;;
Avenida de Albert Einstein;Hombre;Albert Einstein;;;;;;;;
Calle de Joaquín Salas;Hombre;Joaquín Salas;;;;;;;;
Calle de Marcos Ruiloba Palazuelos;Hombre;Marcos Ruiloba Palazuelos;;;;;;;;
Calle de Federico Rivas Moreno;Hombre;Federico Rivas Moreno;;;;;;;;
Calle de Francisco Ribero Gil;Hombre;Francisco Ribero Gil;;;;;;;;
Calle de José Luis Hidalgo;Hombre;José Luis Hidalgo;;;;;;;;
Calle de Guillermo Dierssen;Hombre;Guillermo Dierssen;;;;;;;;
Avenida de Severo Ochoa;Hombre;Severo Ochoa;;;;;;;;
Calle de Miguel Servet;Hombre;Miguel Servet;;;;;;;;
Calle de Rafael Alberti;Hombre;Rafael Alberti;;;;;;;;
Plaza de Amador Toca;Hombre;Amador Toca;;;;;;;;
Calle de Eusebio Santamaría;Hombre;Eusebio Santamaría;;;;;;;;
Calle de Manuel Ruiz Quevedo;Hombre;Manuel Ruiz Quevedo;;;;;;;;
Avenida de Pedro San Martín;Hombre;Pedro San Martín;;;;;;;;
Calle de Luis Buñuel;Hombre;Luis Buñuel;;;;;;;;
Calle de Alfredo Pérez Guillén;Hombre;Alfredo Pérez Guillén;;;;;;;;
Calle de Isaac Albeniz;Hombre;Isaac Albeniz;;;;;;;;
Calle Jesús Cancio;Hombre;Jesús Cancio;;;;;;;;
Avenida de San Martín del Pino;Hombre;San Martín del Pino;;;;;;;;
Avenida de San Martín del Pino;Hombre;San Martín del Pino;;;;;;;;
Calle de Eduardo Torralda Beci;Hombre;Eduardo Torralda Beci;;;;;;;;
Calle de Alfredo Pérez Guillés;Hombre;Alfredo Pérez Guillés;;;;;;;;
Glorieta de Eduardo García;Hombre;Eduardo García;;;;;;;;
Calle de Eusebio Santamarina;Hombre;Eusebio Santamarina;;;;;;;;
Calle de Emilio Diaz Caneja;Hombre;Emilio Diaz Caneja;;;;;;;;
Calle de Miguel Hernández;Hombre;Miguel Hernández;;;;;;;;
Calle de Federico García Lorca;Hombre;Federico García Lorca;;;;;;;;
Calle de Vicente Alexandre;Hombre;Vicente Alexandre;;;;;;;;
Plaza Cardenal de la Lastra;Hombre;Cardenal de la Lastra;;;;;;;;
Calle de Stefan Banic;Hombre;Stefan Banic;;;;;;;;
Calle de Gregorio Cuesta;Hombre;Gregorio Cuesta;;;;;;;;
Calle de Emeterio Velarde;Hombre;Emeterio Velarde;;;;;;;;
Plaza de Pedro Velarde;Hombre;Pedro Velarde;;;;;;;;1
Alameda de Jesús de Monasterio;Hombre;Alameda de Jesús de Monasterio;;;;;;;;1
Plaza del Príncipe;Hombre;Príncipe;;;;;;;;1
Calle del Rubio;Hombre;Rubio;;;;;;;;1
Calle de Amós de Escalante;Hombre;Amós de Escalante;;;;;;;;1
Calle de Miguel Artigas;Hombre;Miguel Artigas;;;;;;;;1
Calle de Juan de Herrera;Hombre;Juan de Herrera;;;;;;;;1
Calle de Emilio Pino;Hombre;Emilio Pino;;;;;;;;1
Grupo San Francisco;Hombre;San Francisco;;;;;;;;
Calle de Francisco Cubría;Hombre;Francisco Cubría;;;;;;;;1
Calle del Marqués de la Hermida;Hombre;Marqués de la Hermida;;;;;;;;1
Calle del General Moscardó;Hombre;General Moscardó;;;;;;;;
Calle de Carlos Haya;Hombre;Carlos Haya;;;;;;;;1
Calle de García de Morato;Hombre;García de Morato;;;;;;;;1
Calle de Ruiz de Alda;Hombre;Ruiz de Alda;;;;;;;;1
Calle de Federico Vidal;Hombre;Federico Vidal;;;;;;;;1
Calle de Anibal García Riancho;Hombre;Anibal García Riancho;;;;;;;;1
Calle del Marqués de La Ensenada;Hombre;Marqués de La Ensenada;;;;;;;;
Calle de Fernando de Montalvo;Hombre;Fernando de Montalvo;;;;;;;;
Calle de Fernando VI;Hombre;Fernando VI;;;;;;;;1
Calle de Félix Rodriguez;Hombre;Félix Rodriguez;;;;;;;;
Calle de San Fernando;Hombre;San Fernando;;;;;;;;1
Alameda de Jesús de Monasterio;Hombre;Alameda de Jesús de Monasterio;;;;;;;;1
Calle de Leopoldo Pardo;Hombre;Leopoldo Pardo;;;;;;;;1
Calle de Carlos III;Hombre;Carlos III;;;;;;;;1
Calle de Atilano Rodríguez;Hombre;Atilano Rodríguez;;;;;;;;1
Calle de Antonio López;Hombre;Antonio López;;;;;;;;1
Avenida de José María de Pereda;Hombre;José María de Pereda;;;;;;;;
Calle del Duque de Ahumada;Hombre;Duque de Ahumada;;;;;;;;1
Calle del Capitán Cortés;Hombre;Capitán Cortés;;;;;;;;1
Calle de Isaac Peral;Hombre;Isaac Peral;;;;;;;;1
Calle de Eulalio Ferrer;Hombre;Eulalio Ferrer;;;;;;;;1
Calle de Juan José Ruano;Hombre;Juan José Ruano;;;;;;;;1
Calle de Juan José Ruano;Hombre;Juan José Ruano;;;;;;;;1
Calle del Marqués del Arco;Hombre;Marqués del Arco;;;;;;;;1
Avenida de Pedro San Martín;Hombre;Pedro San Martín;;;;;;;;
Calle de Hernán Cortés;Hombre;Hernán Cortés;;;;;;;;1
Calle de Eduardo Benot;Hombre;Eduardo Benot;;;;;;;;1
Calle de Pizarro;Hombre;Pizarro;;;;;;;;1
Avenida de Severiano Ballesteros;Hombre;Severiano Ballesteros;;;;;;;;
Calle de Luis Hoyos Sainz;Hombre;Luis Hoyos Sainz;;;;;;;;1
Calle de Cervantes;Hombre;Cervantes;;;;;;;;1
Calle del Cardenal Cisneros;Hombre;Cardenal Cisneros;;;;;;;;1
Calle del Marqués de Santillana;Hombre;Marqués de Santillana;;;;;;;;
Calle de Pancho Cossío;Hombre;Pancho Cossío;;;;;;;;1
Calle de Ataúlfo Argenta;Hombre;Ataúlfo Argenta;;;;;;;;1
Calle de Narciso Cuevas;Hombre;Narciso Cuevas;;;;;;;;1
Calle del Beato de Liébana;Hombre;Beato de Liébana;;;;;;;;1
Calle de Antonio de Mendoza;Hombre;Antonio de Mendoza;;;;;;;;1
Calle de Juan de Garay;Hombre;Juan de Garay;;;;;;;;1
Calle de San José de Calasanz;Hombre;San José de Calasanz;;;;;;;;1
Calle del Obispo Juan Plaza García;Hombre;Obispo Juan Plaza García;;;;;;;;1
Calle de Antonio Puerto;Hombre;Antonio Puerto;;;;;;;;
Calle del Obispo Sánchez de Castro;Hombre;Obispo Sánchez de Castro;;;;;;;;1
Calle Magallanes;Hombre;Magallanes;;;;;;;;1
Calle de Antonio Machado;Hombre;Antonio Machado;;;;;;;;1
Calle de Marcelino Sanz de Sautuola;Hombre;Marcelino Sanz de Sautuola;;;;;;;;1
Paseo de Alberto Pico;Hombre;Alberto Pico;;;;;;;;
Calle de Anibal García de Riancho;Hombre;Anibal García de Riancho;;;;;;;;
Travesía de San Matías;Hombre;San Matías;;;;;;;;1
Muelle del Almirante;Hombre;Almirante;;;;;;;;1
Plaza del Obispo José Eguino y Trecu;Hombre;Obispo José Eguino y Trecu;;;;;;;;1
Calle de San Vicente de la Barquera;Hombre;San Vicente de la Barquera;;;;;;;;
Calle de Jesús Revaque Garea;Hombre;Jesús Revaque Garea;;;;;;;;1
Plaza de San Martín del Mar;Hombre;San Martín del Mar;;;;;;;;
Avenida de Pedro San Martín;Hombre;Pedro San Martín;;;;;;;;
Calle de San Juan Bautista de la Salle;Hombre;San Juan Bautista de la Salle;;;;;;;;1
Calle de Juan de la Cosa;Hombre;Juan de la Cosa;;;;;;;;
Calle de los Hermanos Calderón;Hombre;Hermanos Calderón;;;;;;;;
Calle de Emeterio Velarda;Hombre;Emeterio Velarda;;;;;;;;
Plaza de Alfonso XIII;Hombre;Alfonso XIII;;;;;;;;1
Espigón José del Río;Hombre;Espigón José del Río;;;;;;;;
Plaza de José Francisco Alonso;Hombre;José Francisco Alonso;;;;;;;;
Calle de Fernando Segura;Hombre;Fernando Segura;;;;;;;;
Calle de San Andrés;Hombre;San Andrés;;;;;;;;
Grupo San Miramar;Hombre;San Miramar;;;;;;;;
Avenida de Antonio Maura;Hombre;Antonio Maura;;;;;;;;
Calle de Alfonso Pérez;Hombre;Alfonso Pérez;;;;;;;;
Calle de San Rafael;Hombre;San Rafael;;;;;;;;1
Plaza de Matías Montero;Hombre;Matías Montero;;;;;;;;
Plaza de José Francisco Alonso;Hombre;José Francisco Alonso;;;;;;;;
Calle de San Juan Bautista de la Salle;Hombre;San Juan Bautista de la Salle;;;;;;;;1
Plaza de Juan Carlos I;Hombre;Juan Carlos I;;;;;;;;
Calle de Cervantes;Hombre;Cervantes;;;;;;;;1
Calle de Amadeo I;Hombre;Amadeo I;;;;;;;;1
Calle de Alfonso VIII;Hombre;Alfonso VIII;;;;;;;;1
Plaza de Dionisio Ridruejo;Hombre;Dionisio Ridruejo;;;;;;;;
Calle de Sojo y Lomba;Hombre;Sojo y Lomba;;;;;;;;
Avenida de Pellegrino Zuyer;Hombre;Pellegrino Zuyer;;;;;;;;
Calle de Camús;Hombre;Camús;;;;;;;;
Calle de los Hermanos Tonetti;Hombre;Hermanos Tonetti;;;;;;;;
Calle de Joaquín Reguera Sevilla;Hombre;Joaquín Reguera Sevilla;;;;;;;;1
Paseo del General Dávila;Hombre;General Dávila;;;;;;;;1
Calle de Andrés del Río;Hombre;Andrés del Río;;;;;;;;
Calle de los Padres Escolapios;Hombre;Padres Escolapios;;;;;;;;
Avenida de Fernández Castañeda;Hombre;Fernández Castañeda;;;;;;;;
Calle de Ramón Sáez de Adana;Hombre;Ramón Sáez de Adana;;;;;;;;1
Calle de Pachín González;Hombre;Pachín González;;;;;;;;
Calle de Modesto Martinez;Hombre;Modesto Martinez;;;;;;;;
Avenida de Fernández de Castañeda;Hombre;Fernández de Castañeda;;;;;;;;
Avenida del Marqués de Valdecilla;Hombre;Marqués de Valdecilla;;;;;;;;
Calle del Pintor Gutiérrez Solana;Hombre;Pintor Gutiérrez Solana;;;;;;;;
Calle de los Hermanos Calderón;Hombre;Hermanos Calderón;;;;;;;;
Calle de Agustín de Colosía;Hombre;Agustín de Colosía;;;;;;;;
Calle del Bombero Mijares;Hombre;Bombero Mijares;;;;;;;;
Calle del Aviador Ignacio Pombo;Hombre;Aviador Ignacio Pombo;;;;;;;;
Calle de Luis Riera Vega;Hombre;Luis Riera Vega;;;;;;;;
Grupo Ruiz García Este;Hombre;Ruiz García Este;;;;;;;;
Grupo Ruiz García Oeste;Hombre;Ruiz García Oeste;;;;;;;;
Avenida del Marqués de Valdecilla;Hombre;Marqués de Valdecilla;;;;;;;;
Calle de Rodríguez Guerra;Hombre;Rodríguez Guerra;;;;;;;;
Plaza del Teniente Seyus;Hombre;Teniente Seyus;;;;;;;;
Avenida de Bartolomé Darnís;Hombre;Bartolomé Darnís;;;;;;;;
Barrio Obrero del Rey;Hombre;Barrio Obrero del Rey;;;;;;;;
Calle de Vázquez de Mella;Hombre;Vázquez de Mella;;;;;;;;
Calle de López Campillo;Hombre;López Campillo;;;;;;;;
Alejandro Gago;Hombre;Alejandro Gago;;;;;;;;
Calle de Victoriano Fernández;Hombre;Victoriano Fernández;;;;;;;;
Calle del Capitán Palacios;Hombre;Capitán Palacios;;;;;;;;
Calle de los Alféreces Provisionales;Hombre;Alféreces Provisionales;;;;;;;;
Calle de Zancajo Osorio;Hombre;Zancajo Osorio;;;;;;;;
Calle del General Díaz Villegas;Hombre;General Díaz Villegas;;;;;;;;
Calle Sargentos Provisionales;Hombre;Sargentos Provisionales;;;;;;;;
Calle de Ruiz Zorrilla;Hombre;Ruiz Zorrilla;;;;;;;;1
Glorieta de Emérito Velarde;Hombre;Emérito Velarde;;;;;;;;1
Calle de Nicolás Salmerón;Hombre;Nicolás Salmerón;;;;;;;;1
Calle de Calderón de la Barca;Hombre;Calderón de la Barca;;;;;;;;1
Calle de Méndez Núñez;Hombre;Méndez Núñez;;;;;;;;1
Calle de Calvo Sotelo;Hombre;Calvo Sotelo;;;;;;;;1
Calle de Fernández de Isla;Hombre;Fernández de Isla;;;;;;;;1
Calle de Gregorio Cuesta;Hombre;Gregorio Cuesta;;;;;;;;
Calle de Gómez Oreña;Hombre;Gómez Oreña;;;;;;;;1
Calle de Daoíz y Velarde;Hombre;Daoíz y Velarde;;;;;;;;1
Calle de López Dóriga;Hombre;López Dóriga;;;;;;;;1
Calle de Germán Gamazo;Hombre;Germán Gamazo;;;;;;;;
Calle de Emeterio Velarde;Hombre;Emeterio Velarde;;;;;;;;
Calle de Bonifaz;Hombre;Bonifaz;;;;;;;;1
Calle de Elcano;Hombre;Elcano;;;;;;;;1
Calle de Guevara;Hombre;Guevara;;;;;;;;1
Calle del Beato de Liébana;Hombre;Beato de Liébana;;;;;;;;1
Calle de los Héroes de la Armada;Hombre;Héroes de la Armada;;;;;;;;
Calle del Profesor Jiménez Díaz;Hombre;Profesor Jiménez Díaz;;;;;;;;1
Calle de García Morato;Hombre;García Morato;;;;;;;;1
Calle de Alsedo Bustamante;Hombre;Alsedo Bustamante;;;;;;;;1
Calle de los Santos Mártires;NA;Santos Mártires;;;;;;;;1
Plaza de México;NA;México;;;;;;;;
Calle del Jazmín;NA;Jazmín;;;;;;;;
Plaza La Bahía;NA;Bahía;;;;;;;;
Calle de los Santos Mártires;NA;Santos Mártires;;;;;;;;1
Calle Alcázar de Toledo;NA;Alcázar de Toledo;;;;;;;;1
Calle del Río Danubio;NA;Río Danubio;;;;;;;;
Calleja del Castro;NA;Castro;;;;;;;;
Calle de Perú;NA;Perú;;;;;;;;
Calle del Río Ebro;NA;Río Ebro;;;;;;;;
Calle de la Roca;NA;Roca;;;;;;;;1
Glorieta de Corbán;NA;Corbán;;;;;;;;
Calle El Somo;NA;Somo;;;;;;;;
Calle de la Gloria;NA;Gloria;;;;;;;;
Glorieta de Corbán;NA;Corbán;;;;;;;;
Calle de los Foramontanos;NA;Foramontanos;;;;;;;;
Avenida de la Constitución;NA;Constitución;;;;;;;;
Calle Repuente;NA;Repuente;;;;;;;;
Calle de los Canteros de Trasmiera;NA;Canteros de Trasmiera;;;;;;;;
Calle de Bolado;NA;Bolado;;;;;;;;
Calle de Torremar;NA;Torremar;;;;;;;;
Calle de la Tesilla;NA;Tesilla;;;;;;;;
Calle de la Regaña;NA;Regaña;;;;;;;;
Bajada del Caleruco;NA;Caleruco;;;;;;;;
Calle de Resconorio;NA;Resconorio;;;;;;;;
Avenida de los Castros;NA;Castros;;;;;;;;1
Calle de La Llanilla;NA;Llanilla;;;;;;;;
Calle de Corceño;NA;Corceño;;;;;;;;
Barrio Corbanera;NA;Barrio Corbanera;;;;;;;;
Barrio Corbanera;NA;Barrio Corbanera;;;;;;;;
Carretera del Barrio de la Torre a Barrio Bolado;NA;Barrio de la Torre a Barrio Bolado;;;;;;;;
Calle de Somonte;NA;Somonte;;;;;;;;
Calle del Mazo de Abajo;NA;Mazo de Abajo;;;;;;;;
Calle del Mazo de Arriba;NA;Mazo de Arriba;;;;;;;;
Calle dell Mazo de Abajo;NA;dell Mazo de Abajo;;;;;;;;
Calle de Las Portillas;NA;Portillas;;;;;;;;
Calle El Piquel;NA;Piquel;;;;;;;;
Calle Rostrío;NA;Rostrío;;;;;;;;
Calle La Puebla;NA;Puebla;;;;;;;;
Calle Tristana;NA;Tristana;;;;;;;;
Calle de la Cuevona;NA;Cuevona;;;;;;;;
Calle Costa Quebrada;NA;Costa Quebrada;;;;;;;;
Calle de las Arenas;NA;Arenas;;;;;;;;
Paseo marítimo;NA;marítimo;;;;;;;;
Calle Los Barbajos;NA;Barbajos;;;;;;;;
Calle de la Mies de Millajo;NA;Mies de Millajo;;;;;;;;
Calle El Hondal;NA;Hondal;;;;;;;;
Calle El Robejo;NA;Robejo;;;;;;;;
Calle El Campizo;NA;Campizo;;;;;;;;
Calle de Aviche;NA;Aviche;;;;;;;;
Calle Sotavesilla;NA;Sotavesilla;;;;;;;;
Calle Canto Cercado;NA;Canto Cercado;;;;;;;;
Calle de La Canal;NA;Canal;;;;;;;;
Urbanización Piedras Blancas;NA;Piedras Blancas;;;;;;;;
Urbanización La Castellana;NA;Castellana;;;;;;;;
Carretera a La Arnía;NA;Arnía;;;;;;;;
Calle de la Cooperativa del Campo;NA;Cooperativa del Campo;;;;;;;;
Calle La Huertona;NA;Huertona;;;;;;;;
Plaza de la Ciencia;NA;Ciencia;;;;;;;;
Plaza de Italia;NA;Italia;;;;;;;;
Pasadizo Aguirre;NA;Aguirre;;;;;;;;1
Plaza del Colojón;NA;Colojón;;;;;;;;
Calle de Honduras;NA;Honduras;;;;;;;;1
Glorieta de la Universidad;NA;Universidad;;;;;;;;
Barrio del Camino;NA;Barrio del Camino;;;;;;;;
Calle de Tetuán;NA;Tetuán;;;;;;;;
Calle de Panamá;NA;Panamá;;;;;;;;
Calle de las Cruces;NA;Cruces;;;;;;;;
Calle de la Iglesia;NA;Iglesia;;;;;;;;
Avenida de los Hoteles;NA;Hoteles;;;;;;;;
Calleja Norte;NA;Norte;;;;;;;;
Bajada de la Cañía;NA;Cañía;;;;;;;;
Avenida de los Infantes;NA;Infantes;;;;;;;;
Calle de Fresnedo de la Calzada;NA;Fresnedo de la Calzada;;;;;;;;
Plaza del Alto de Miranda;NA;Alto de Miranda;;;;;;;;
Calle Junco;NA;Junco;;;;;;;;
Calle de los Canteros de Trasmiera;NA;Canteros de Trasmiera;;;;;;;;
Glorieta de la Universidad;NA;Universidad;;;;;;;;
Rotonda de la Sardinera;NA;Sardinera;;;;;;;;
Calle de Barcelona;NA;Barcelona;;;;;;;;
Calle de Marianela;NA;Marianela;;;;;;;;
Calle del Rocío;NA;Rocío;;;;;;;;
Calle de la Horadada;NA;Horadada;;;;;;;;
Avenida del Stadium;NA;Stadium;;;;;;;;
Avenida de Pontejos;NA;Pontejos;;;;;;;;
Avenida del Faro Pintor Eduardo Sanz;NA;Faro Pintor Eduardo Sanz;;;;;;;;
Avenida de Cantabria;NA;Cantabria;;;;;;;;
Avenida de la Constitución;NA;Constitución;;;;;;;;
Calle de Calatayud;NA;Calatayud;;;;;;;;
Calle del Río de la Pila;NA;Río de la Pila;;;;;;;;1
Calle del Río de la Pila;NA;Río de la Pila;;;;;;;;1
Calle de Vista Alegre;NA;Vista Alegre;;;;;;;;1
Cuesta de la Atalaya;NA;Atalaya;;;;;;;;1
Calle de Los Aguayos;NA;Aguayos;;;;;;;;1
Calle de Miralmar;NA;Miralmar;;;;;;;;1
Calle del Sol;NA;Sol;;;;;;;;1
Calle de Laredo;NA;Laredo;;;;;;;;1
Calle de Valliciergo;NA;Valliciergo;;;;;;;;1
Calle de Valdenoja;NA;Valdenoja;;;;;;;;
Calle de la Autonomía;NA;Autonomía;;;;;;;;
Calle de la Familia Real;NA;Familia Real;;;;;;;;
Senda de Mataleñas;NA;Mataleñas;;;;;;;;
Calle del Real Racing Club;NA;Real Racing Club;;;;;;;;
Calle de Brañaflor;NA;Brañaflor;;;;;;;;
Calle del Monte;NA;Monte;;;;;;;;1
Glorieta de Galicia;NA;Galicia;;;;;;;;
Calle de Bellavista;NA;Bellavista;;;;;;;;
Calle Acebedos;NA;Acebedos;;;;;;;;
Calle del Club Atlético España de Cueto;NA;Club Atlético España de Cueto;;;;;;;;
Calle de El Recial;NA;Recial;;;;;;;;
Calle del Mansín;NA;Mansín;;;;;;;;
Calle del Hipódromo;NA;Hipódromo;;;;;;;;
Calle de Vallemier;NA;Vallemier;;;;;;;;
Calle de Corconeras;NA;Corconeras;;;;;;;;
Calle del Club Atlético España de Cueto;NA;Club Atlético España de Cueto;;;;;;;;
Calle Madreselva;NA;Madreselva;;;;;;;;
Calle Fumoril;NA;Fumoril;;;;;;;;
Calle del Calvario;NA;Calvario;;;;;;;;
Calle del Proel;NA;Proel;;;;;;;;
Túnel de Puertochico;NA;Puertochico;;;;;;;;
Bajada de la Encina;NA;Encina;;;;;;;;
Colonia Los Pinares;NA;Colonia Los Pinares;;;;;;;;
Calle de Benidorm;NA;Benidorm;;;;;;;;
Calle de los Estudiantes;NA;Estudiantes;;;;;;;;
Bajada de La Teja;NA;Teja;;;;;;;;
Barrio La Torre;NA;Barrio La Torre;;;;;;;;
Calle Udial;NA;Udial;;;;;;;;
Barrio La Torre;NA;Barrio La Torre;;;;;;;;
Calle de Castor Agra García;NA;Castor Agra García;;;;;;;;
Bajada de la Media Luna;NA;Media Luna;;;;;;;;1
Calle de Fresnedo de la Calzada;NA;Fresnedo de la Calzada;;;;;;;;
Barrio Monte La Torre;NA;Barrio Monte La Torre;;;;;;;;
Calle la Montañesa;NA;Montañesa;;;;;;;;
Travesía Los Caños;NA;Caños;;;;;;;;1
Calle de Vía Cornelia Interior;NA;Vía Cornelia Interior;;;;;;;;1
Subida al Gurugú;NA;Gurugú;;;;;;;;
Calle de Gerona;NA;Gerona;;;;;;;;
Calle de Palencia;NA;Palencia;;;;;;;;
Plaza de las Brisas;NA;Brisas;;;;;;;;
Bajada de Rumayor;NA;Rumayor;;;;;;;;1
Calle Nubes de Estío;NA;Nubes de Estío;;;;;;;;
Calle de la Leva;NA;Leva;;;;;;;;
Calle de la Puchera;NA;Puchera;;;;;;;;
Calle de Peñas Arriba;NA;Peñas Arriba;;;;;;;;
Calle del Asilo;NA;Asilo;;;;;;;;1
Calle de la Libertad;NA;Libertad;;;;;;;;1
Calle de Aviche;NA;Aviche;;;;;;;;
Calle del Prado de San Roque;NA;Prado de San Roque;;;;;;;;1
Calle La Barraca;NA;Barraca;;;;;;;;
Travesía África;NA;África;;;;;;;;
Calle Nazarín;NA;Nazarín;;;;;;;;
Calle del Ingenio;NA;Ingenio;;;;;;;;
Calle del Teniente Fuentes Pila;NA;Teniente Fuentes Pila;;;;;;;;
Camino de la Peña del Uro;NA;Peña del Uro;;;;;;;;
Calle del Mazo de Arriba;NA;Mazo de Arriba;;;;;;;;
Acceso a la playa de Mataleñas;NA;playa de Mataleñas;;;;;;;;
Carretera de la cantera;NA;cantera;;;;;;;;
Avenida del Faro;NA;Faro;;;;;;;;
Grupo Las Canteras;NA;Canteras;;;;;;;;
Calle de Miralmar;NA;Miralmar;;;;;;;;1
Calle del Club Atlético España de Cueto;NA;Club Atlético España de Cueto;;;;;;;;
Calle de las Arenas;NA;Arenas;;;;;;;;
Calle de la Salud;NA;Salud;;;;;;;;
Glorieta de la Universidad;NA;Universidad;;;;;;;;
Calle de la Braña;NA;Braña;;;;;;;;
Calle de la Enseñanza;NA;Enseñanza;;;;;;;;1
Calle de Vista Alegre;NA;Vista Alegre;;;;;;;;1
Calle de Corbera;NA;Corbera;;;;;;;;
Calle Convento;NA;Convento;;;;;;;;
Calle Barrio Camino;NA;Barrio Camino;;;;;;;;
Calle La Nuncia;NA;Nuncia;;;;;;;;
Calle de Amaliach;NA;Amaliach;;;;;;;;
Rampa mecánica;NA;Rampa mecánica;;;;;;;;
Subida al Gurugú;NA;Gurugú;;;;;;;;
Plaza de Alhucemas;NA;Alhucemas;;;;;;;;
Grupo Las Canteras;NA;Canteras;;;;;;;;
Travesía África;NA;África;;;;;;;;
Vial peatonal;NA;Vial peatonal;;;;;;;;
Residencial Los Molinucos;NA;Residencial Los Molinucos;;;;;;;;
Villa Olímpica;NA;Villa Olímpica;;;;;;;;
Urbanización Mar Abierto;NA;Mar Abierto;;;;;;;;
Urbanización Bella Vista;NA;Bella Vista;;;;;;;;
Plaza del Dos de Mayo;NA;Dos de Mayo;;;;;;;;
Plaza de los Arces;NA;Arces;;;;;;;;
Calle de Peñas Rocías;NA;Peñas Rocías;;;;;;;;
Avenida de Parayas;NA;Parayas;;;;;;;;
Calle de Peña Labra;NA;Peña Labra;;;;;;;;
Avenida de Candina;NA;Candina;;;;;;;;
Calle del Real Consulado;NA;Real Consulado;;;;;;;;
Calle de Nueve Valles;NA;Nueve Valles;;;;;;;;
Calle de Peña Prieta;NA;Peña Prieta;;;;;;;;
Calle de Peña Bejo;NA;Peña Bejo;;;;;;;;
Calle de Peña Vieja;NA;Peña Vieja;;;;;;;;
Calle de la Peseta;NA;Peseta;;;;;;;;
Calle Independencia;NA;Independencia;;;;;;;;
Calle de Montevideo;NA;Montevideo;;;;;;;;
Calle de los Montes Cántabros;NA;Montes Cántabros;;;;;;;;
Avenida de Nueva Montaña;NA;Nueva Montaña;;;;;;;;
Calle de Cajo;NA;Cajo;;;;;;;;
Calle de la Fuente de la Salud;NA;Fuente de la Salud;;;;;;;;
Enlace de La Marga;NA;Marga;;;;;;;;
Calle de la Rosa;NA;Rosa;;;;;;;;
Calle de la Violeta;NA;Violeta;;;;;;;;
Calle de la Isla del Óleo;NA;Isla del Óleo;;;;;;;;
Calle del Concejo;NA;Concejo;;;;;;;;
Calle de Campogiro;NA;Campogiro;;;;;;;;
Calle de la Albericia;NA;Albericia;;;;;;;;
Calle del Girasol;NA;Girasol;;;;;;;;
Calle del Pensamiento;NA;Pensamiento;;;;;;;;
Calle del Alhelí;NA;Alhelí;;;;;;;;
Calle Ojaiz;NA;Ojaiz;;;;;;;;
Barrio Las Tejeras;NA;Barrio Las Tejeras;;;;;;;;
Calle de Adarzo;NA;Adarzo;;;;;;;;
Barrio de la Peña;NA;Barrio de la Peña;;;;;;;;
Avenida Primero de Mayo;NA;Primero de Mayo;;;;;;;;
Calle de Adarzo;NA;Adarzo;;;;;;;;
Túnel de Cuatro Caminos;NA;Cuatro Caminos;;;;;;;;
Calle de Floranes;NA;Floranes;;;;;;;;1
Accesos al IES Augusto González Linares;NA;Accesos al IES Augusto González Linares;;;;;;;;
El Empalme;NA;Empalme;;;;;;;;
Glorieta de los Osos;NA;Osos;;;;;;;;
Calle de la Albericia;NA;Albericia;;;;;;;;
Calle de los Ciruelos;NA;Ciruelos;;;;;;;;
Calle de los Acebos;NA;Acebos;;;;;;;;
Calle Acebedos;NA;Acebedos;;;;;;;;
Calle de la República Checa;NA;República Checa;;;;;;;;
Calle de la Sierra;NA;Sierra;;;;;;;;
Calle del Refugio;NA;Refugio;;;;;;;;
Calle del Regatón;NA;Regatón;;;;;;;;
Avenida del Deporte;NA;Deporte;;;;;;;;
Calle de los Encinares;NA;Encinares;;;;;;;;
Glorieta de los Tilos;NA;Tilos;;;;;;;;
Glorieta del Liquidámbar;NA;Liquidámbar;;;;;;;;
Calle de los Alcornoques;NA;Alcornoques;;;;;;;;
Calle de los Abedules;NA;Abedules;;;;;;;;
Calle de los Serbales;NA;Serbales;;;;;;;;
Calle de los Álamos;NA;Álamos;;;;;;;;
Calle de la Fuente del Fresno;NA;Fuente del Fresno;;;;;;;;
Calle de los Portuarios;NA;Portuarios;;;;;;;;
Calle de la Prensa;NA;Prensa;;;;;;;;
Calle de Lavapiés;NA;Lavapiés;;;;;;;;
Calle de la Tejera;NA;Tejera;;;;;;;;
Calle de los Montes Cárpatos;NA;Montes Cárpatos;;;;;;;;
Calle de Bratislava;NA;Bratislava;;;;;;;;
Calle de Eslovaquia;NA;Eslovaquia;;;;;;;;
Calle de Adarzo;NA;Adarzo;;;;;;;;
Calle de las Islas Canarias;NA;Islas Canarias;;;;;;;;
Calle de Logroño;NA;Logroño;;;;;;;;
Calle de las Islas Baleares;NA;Islas Baleares;;;;;;;;
Calle de Montejurra;NA;Montejurra;;;;;;;;
Calle de la Secada;NA;Secada;;;;;;;;
Calle de las Cagigas;NA;Cagigas;;;;;;;;
Calle Cañas;NA;Cañas;;;;;;;;
Calle de la Isla del Óleo;NA;Isla del Óleo;;;;;;;;
El Empalme;NA;Empalme;;;;;;;;
Travesía de Peñacastillo;NA;Peñacastillo;;;;;;;;
Avenida del Voluntariado;NA;Voluntariado;;;;;;;;
Avenida de Camarreal;NA;Camarreal;;;;;;;;
Glorieta de Rucandial;NA;Rucandial;;;;;;;;
Calle Lluja;NA;Lluja;;;;;;;;
Polígono Industrial El Campón;NA;Polígono Industrial El Campón;;;;;;;;
Calle de Adarzo;NA;Adarzo;;;;;;;;
Calle Alta;NA;Alta;;;;;;;;1
Calle de la Isla de Cuba;NA;Isla de Cuba;;;;;;;;
Calle de los Donantes de Sangre;NA;Donantes de Sangre;;;;;;;;
Calle de la Molina;NA;Molina;;;;;;;;
Barrio Pronillo;NA;Barrio Pronillo;;;;;;;;
Urbanización Los Llanos;NA;Llanos;;;;;;;;
Acceso al Centro Empresarial Zoco Gran Santander;NA;Centro Empresarial Zoco Gran Santander;;;;;;;;
Residencial Los Robles;NA;Residencial Los Robles;;;;;;;;
Residencial Las Acacias;NA;Residencial Las Acacias;;;;;;;;
Plaza de los Castaños;NA;Castaños;;;;;;;;
Plaza de los Pinos;NA;Pinos;;;;;;;;
Calle del Juego de los Bolos;NA;Juego de los Bolos;;;;;;;;
Calle de los Plátanos;NA;Plátanos;;;;;;;;
Plaza de Monteleón;NA;Monteleón;;;;;;;;
Calle los Labradores;NA;Labradores;;;;;;;;
Calle Aviadores Cántabros;NA;Aviadores Cántabros;;;;;;;;
Enlace de La Marga;NA;Marga;;;;;;;;
Glorieta de Rucandial;NA;Rucandial;;;;;;;;
Glorieta de Rucandial;NA;Rucandial;;;;;;;;
Acceso a Urgencias;NA;Urgencias;;;;;;;;
Calle de Cajo;NA;Cajo;;;;;;;;
Calle del Santuco;NA;Santuco;;;;;;;;
Barrio La Candía;NA;Barrio La Candía;;;;;;;;
Calle de Málaga;NA;Málaga;;;;;;;;
Espigón Central de Raos;NA;Espigón Central de Raos;;;;;;;;
Muelle de Raos 8;NA;Raos 8;;;;;;;;
Calle de las Islas Canarias;NA;Islas Canarias;;;;;;;;
Urbanización Peña Verde;NA;Peña Verde;;;;;;;;
Calle La Llosa;NA;Llosa;;;;;;;;
Calle de la Albericia;NA;Albericia;;;;;;;;
Túnel de Cuatro Caminos;NA;Cuatro Caminos;;;;;;;;
Muelle de Raos 7;NA;Raos 7;;;;;;;;
Muelle de Raos 1;NA;Raos 1;;;;;;;;
Calle del Tejo;NA;Tejo;;;;;;;;
Polígono industrial de Elegarcu;NA;Polígono industrial de Elegarcu;;;;;;;;
Plaza del Alzamiento de 1808;NA;Alzamiento de 1808;;;;;;;;
Barrio de la Peña;NA;Barrio de la Peña;;;;;;;;
Polígono Industrial de Otero;NA;Polígono Industrial de Otero;;;;;;;;
Avenida de Candina;NA;Candina;;;;;;;;
Calle de Segovia;NA;Segovia;;;;;;;;
Glorieta de Galicia;NA;Galicia;;;;;;;;
Calle de Navarra;NA;Navarra;;;;;;;;
Calle de Portugal;NA;Portugal;;;;;;;;
Calle del Archivo de Simancas;NA;Archivo de Simancas;;;;;;;;
Calle de Valencia;NA;Valencia;;;;;;;;
