Calle;Género;Nombre;Religioso;Ficción;Descripción;Artículo;Imagen;Fecha Nacimiento;Fecha Muerte;Céntrica
Carrer d'Andreu Alfaro (Escultor);Hombre;Andreu Alfaro (Escultor);;;;;;;;
Avinguda de Joan XXIII;Hombre;Joan XXIII;;;;;;;;
Carrer de Salvador Tusset;Hombre;Salvador Tusset;;;;;;;;
Carrer del Mestre Miguel Galán;Hombre;Mestre Miguel Galán;;;;;;;;
Carrer del Pare Carbonell;Hombre;Pare Carbonell;;;;;;;;
Carrer d'Andrés Piles Ibars;Hombre;Andrés Piles Ibars;;;;;;;;
Carrer del Bisbe Puchol Montis;Hombre;Bisbe Puchol Montis;;;;;;;;
Carrer de Lorenzo Rovira;Hombre;Lorenzo Rovira;;;;;;;;
Carrer d'Emili Marí;Hombre;Emili Marí;;;;;;;;
Carrer del General Llorens;Hombre;General Llorens;;;;;;;;
Carrer del Periodista Gil Sumbiela;Hombre;Periodista Gil Sumbiela;;;;;;;;
Carrer de Juan del Encina;Hombre;Juan del Encina;;;;;;;;
Carrer del Poeta Serrano Clavero;Hombre;Poeta Serrano Clavero;;;;;;;;
Carrer de José Grollo;Hombre;José Grollo;;;;;;;;
Carrer d'Emili Roig;Hombre;Emili Roig;;;;;;;;
Carrer de Félix del Río (activista veïnal);Hombre;Félix del Río (activista veïnal);;;;;;;;
Carrer de Sant Josep de Pignatelli;Hombre;Sant Josep de Pignatelli;;;;;;;;
Carrer del Ceramista Bayarri;Hombre;Ceramista Bayarri;;;;;;;;
Carrer de Pere Delmonte i Hurtado;Hombre;Pere Delmonte i Hurtado;;;;;;;;
Plaça de Vicent Añón Marco;Hombre;Vicent Añón Marco;;;;;;;;
Carrer de l'Alcalde Gurrea;Hombre;l'Alcalde Gurrea;;;;;;;;
Carrer de Salvador Rodríguez Bronchú (Pintor);Hombre;Salvador Rodríguez Bronchú (Pintor);;;;;;;;
Carrer de Juan José Barcia Goyanes (Professor);Hombre;Juan José Barcia Goyanes (Professor);;;;;;;;
Carrer de Gayano Lluch;Hombre;Gayano Lluch;;;;;;;;
Carrer del Comte de Lumiares;Hombre;Comte de Lumiares;;;;;;;;
Carrer de Josep Esteve;Hombre;Josep Esteve;;;;;;;;
Carrer de Cecili Pla;Hombre;Cecili Pla;;;;;;;;
Carrer del Marqués de Montortal;Hombre;Marqués de Montortal;;;;;;;;
Plaça del Músic Espí;Hombre;Músic Espí;;;;;;;;
Plaça de Salvador Allende;Hombre;Salvador Allende;;;;;;;;
Plaça de Sant Jeroni;Hombre;Sant Jeroni;;;;;;;;
Carrer de l'Arquitecte Juan Pérez;Hombre;l'Arquitecte Juan Pérez;;;;;;;;
Carrer de Santiago Rusiñol;Hombre;Santiago Rusiñol;;;;;;;;
Carrer de Sant Vicent de Paül;Hombre;Sant Vicent de Paül;;;;;;;;
Carrer del Duc de Mandas;Hombre;Duc de Mandas;;;;;;;;
Carrer de l'Arquitecte Rodríguez;Hombre;l'Arquitecte Rodríguez;;;;;;;;
Plaça de Mustaçaf;Hombre;Mustaçaf;;;;;;;;
Plaça de l'Actor Luis Ramírez;Hombre;l'Actor Luis Ramírez;;;;;;;;
Carrer de l'Arquitecte Tolsà;Hombre;l'Arquitecte Tolsà;;;;;;;;
Carrer de l'Historiador Chabret;Hombre;l'Historiador Chabret;;;;;;;;
Carrer d'Agustín Lara;Hombre;Agustín Lara;;;;;;;;
Plaça dels Germans Bécquer;Hombre;Germans Bécquer;;;;;;;;
Carrer de Sant Joan de la Penya;Hombre;Sant Joan de la Penya;;;;;;;;
Carrer d'Esteban Dolz del Castellar;Hombre;Esteban Dolz del Castellar;;;;;;;;
Carrer de José Chabás Bordehore;Hombre;José Chabás Bordehore;;;;;;;;
Carrer d'Emili Baró;Hombre;Emili Baró;;;;;;;;
Carrer de Ramón Asensio;Hombre;Ramón Asensio;;;;;;;;
Carrer del Músic Magenti;Hombre;Músic Magenti;;;;;;;;
Carrer de Jaume Esteve Cubells;Hombre;Jaume Esteve Cubells;;;;;;;;
Carrer del Baró de San Petrillo;Hombre;Baró de San Petrillo;;;;;;;;
Carrer del Pare Alegre;Hombre;Pare Alegre;;;;;;;;
Carrer del Reverend Rafael Tramoyeres;Hombre;Reverend Rafael Tramoyeres;;;;;;;;
Carrer de l'Arquitecte Arnau;Hombre;l'Arquitecte Arnau;;;;;;;;
Carrer del Músic Hipòlit Martínez;Hombre;Músic Hipòlit Martínez;;;;;;;;
Carrer de Diógenes López Mechó;Hombre;Diógenes López Mechó;;;;;;;;
Carrer de Diógenes López Mechoo;Hombre;Diógenes López Mechoo;;;;;;;;
Carrer de Prudenci Alcon i Mateu;Hombre;Prudenci Alcon i Mateu;;;;;;;;
Carrer de Marcel·lí Giner;Hombre;Marcel·lí Giner;;;;;;;;
Carrer del Mestre Buenaventura Pascual;Hombre;Mestre Buenaventura Pascual;;;;;;;;
Carrer del Lliri Blau Devesa;Hombre;Lliri Blau Devesa;;;;;;;;
Carrer de Sant Francesc d'Assís;Hombre;Sant Francesc d'Assís;;;;;;;;
Carrer de Vicent Barrera Cambra;Hombre;Vicent Barrera Cambra;;;;;;;;
Plaça de l'Alcalde Domingo Torres;Hombre;l'Alcalde Domingo Torres;;;;;;;;
Carrer del Reverend José Martí;Hombre;Reverend José Martí;;;;;;;;
Carrer del Poeta Carles Salvador;Hombre;Poeta Carles Salvador;;;;;;;;
Carrer de Juan Giner;Hombre;Juan Giner;;;;;;;;
Carrer de Sant Mateu;Hombre;Sant Mateu;;;;;;;;
Carrer de Francesc Martínez;Hombre;Francesc Martínez;;;;;;;;
Carrer de Salvador Almenar;Hombre;Salvador Almenar;;;;;;;;
Carrer de Sant Columbà;Hombre;Sant Columbà;;;;;;;;
Carrer del Pintor Manolo Gil;Hombre;Pintor Manolo Gil;;;;;;;;
Plaça de Lázaro Cárdenas;Hombre;Lázaro Cárdenas;;;;;;;;
Carrer del Mestre Caballero;Hombre;Mestre Caballero;;;;;;;;
Carrer del Poeta Altet;Hombre;Poeta Altet;;;;;;;;
Carrer del Reverend José María Pinazo;Hombre;Reverend José María Pinazo;;;;;;;;
Carrer del Poeta Eduard Buïl;Hombre;Poeta Eduard Buïl;;;;;;;;
Carrer del Pintor Enric Ginesta;Hombre;Pintor Enric Ginesta;;;;;;;;
Carrer de l'Enginyer Vicent Pichó;Hombre;l'Enginyer Vicent Pichó;;;;;;;;
Carrer del Poeta Ricard Sanmartí;Hombre;Poeta Ricard Sanmartí;;;;;;;;
Carrer de l'Humanista Frederic Furió;Hombre;l'Humanista Frederic Furió;;;;;;;;
Carrer del Rector Zaragoza;Hombre;Rector Zaragoza;;;;;;;;
Carrer del Músic Belando;Hombre;Músic Belando;;;;;;;;
Carrer del Poeta Asins;Hombre;Poeta Asins;;;;;;;;
Carrer de Manuel Castellanos;Hombre;Manuel Castellanos;;;;;;;;
Carrer d'Enric Navarro;Hombre;Enric Navarro;;;;;;;;
Carrer de Peris Mencheta;Hombre;Peris Mencheta;;;;;;;;
Carrer dels Germans Villalonga;Hombre;Germans Villalonga;;;;;;;;
Plaça d'Emili Beüt i Belenguer;Hombre;Emili Beüt i Belenguer;;;;;;;;
Plaça de Regino Mas;Hombre;Regino Mas;;;;;;;;
Carrer de Peris Celda;Hombre;Peris Celda;;;;;;;;
Carrer de Salvador Rubio;Hombre;Salvador Rubio;;;;;;;;
Plaça de Luis Martí Alegre;Hombre;Luis Martí Alegre;;;;;;;;
Carrer de Carmelo Roda;Hombre;Carmelo Roda;;;;;;;;
Carrer de Sánchez Arjona;Hombre;Sánchez Arjona;;;;;;;;
Carrer de Vicent Canet;Hombre;Vicent Canet;;;;;;;;
Avinguda de Sant Josep Artesà;Hombre;Sant Josep Artesà;;;;;;;;
Carrer de Carles Cortina;Hombre;Carles Cortina;;;;;;;;
Carrer de Manuel Melià i Fuster (Don Pío);Hombre;Manuel Melià i Fuster (Don Pío);;;;;;;;
Passeig de Guillem Agulló;Hombre;Guillem Agulló;;;;;;;;
Carrer de l'Eliana;Hombre;l'Eliana;;;;;;;;
Carrer del Doctor Andreu Piquer;Hombre;Doctor Andreu Piquer;;;;;;;;
Carrer de Senent Ibàñez;Hombre;Senent Ibàñez;;;;;;;;
Carrer de Mosén José Estelles;Hombre;Mosén José Estelles;;;;;;;;
Carrer de Aspiroz;Hombre;Aspiroz;;;;;;;;
Carrer d'Alfonso Roig;Hombre;Alfonso Roig;;;;;;;;
Carrer del Cura Bau;Hombre;Cura Bau;;;;;;;;
Carrer de Benet Bosch;Hombre;Benet Bosch;;;;;;;;
Carrer de Guerau de Cervelló;Hombre;Guerau de Cervelló;;;;;;;;
Carrer del Doctor Constantí López;Hombre;Doctor Constantí López;;;;;;;;
Carrer dels Sants Abdó i Senent;Hombre;Sants Abdó i Senent;;;;;;;;
Carrer del Compositor Vert;Hombre;Compositor Vert;;;;;;;;
Carrer de Juan Bautista Pastor;Hombre;Juan Bautista Pastor;;;;;;;;
Carrer de Josep Balaguer;Hombre;Josep Balaguer;;;;;;;;
Carrer del Marqués de Laconi;Hombre;Marqués de Laconi;;;;;;;;
Carrer de Sebastián Giner Soriano (Llaurador);Hombre;Sebastián Giner Soriano (Llaurador);;;;;;;;
Carrer Josep Renau;Hombre;Josep Renau;;;;;;;;
Carrer del Crist de la Llum;Hombre;Crist de la Llum;;;;;;;;
Avinguda de Menéndez y Pelayo;Hombre;Menéndez y Pelayo;;;;;;;;
Carrer de l'Enginyer Aubán;Hombre;l'Enginyer Aubán;;;;;;;;
Carrer de Crisóstom Martínez;Hombre;Crisóstom Martínez;;;;;;;;
Carrer del Doctor Soriano Benlloch;Hombre;Doctor Soriano Benlloch;;;;;;;;
Carrer de Sant Josep;Hombre;Sant Josep;;;;;;;;
Carrer del Canonge Fenollera;Hombre;Canonge Fenollera;;;;;;;;
Carrer de Joaquín Marín;Hombre;Joaquín Marín;;;;;;;;
Carrer del Gravador Montfort;Hombre;Gravador Montfort;;;;;;;;
Carrer de l'Enginyer Dicenta;Hombre;l'Enginyer Dicenta;;;;;;;;
Carrer de Juan Calatrava;Hombre;Juan Calatrava;;;;;;;;
Carrer del Pintor Orrente;Hombre;Pintor Orrente;;;;;;;;
Carrer del Miniaturista Messeguer;Hombre;Miniaturista Messeguer;;;;;;;;
Carrer de Mossén Cobos;Hombre;Mossén Cobos;;;;;;;;
Carrer de Bernardo Prieto;Hombre;Bernardo Prieto;;;;;;;;
Carrer de Miquel Agraït;Hombre;Miquel Agraït;;;;;;;;
Carrer de Mossén Miguel Tarín;Hombre;Mossén Miguel Tarín;;;;;;;;
Carrer del Doctor Navarro Gil;Hombre;Doctor Navarro Gil;;;;;;;;
Carrer del Doctor Jaume Segarra;Hombre;Doctor Jaume Segarra;;;;;;;;
Carrer del Bisbe Albalat;Hombre;Bisbe Albalat;;;;;;;;
Carrer de Fray Francisco Cabezas;Hombre;Fray Francisco Cabezas;;;;;;;;
Carrer del Clariano;Hombre;Clariano;;;;;;;;
Carrer de Coret i Peris;Hombre;Coret i Peris;;;;;;;;
Carrer de Francisco Roig;Hombre;Francisco Roig;;;;;;;;
Carrer Jose Guanter;Hombre;Jose Guanter;;;;;;;;
Plaça del Doctor Torrens;Hombre;Doctor Torrens;;;;;;;;
Calle José Bosch Herrero;Hombre;José Bosch Herrero;;;;;;;;
Carrer del Músic Peydró;Hombre;Músic Peydró;;;;;;;;
Carrer del Músic Martínez Coll;Hombre;Músic Martínez Coll;;;;;;;;
Plaça del Cardenal Vicent Enrique i Tarancón;Hombre;Cardenal Vicent Enrique i Tarancón;;;;;;;;
Avinguda de Federico García Lorca;Hombre;Federico García Lorca;;;;;;;;
Carrer de Mariano Brull;Hombre;Mariano Brull;;;;;;;;
Carrer d'Ismael Blat Pintor;Hombre;Ismael Blat Pintor;;;;;;;;
Carrer d'Ovidi Montllor i Mengual (Actor i Cantant);Hombre;Ovidi Montllor i Mengual (Actor i Cantant);;;;;;;;
Carrer d'Eduard Dato;Hombre;Eduard Dato;;;;;;;;
Carrer de Giménez i Costa;Hombre;Giménez i Costa;;;;;;;;
Carrer de Pedro Luna;Hombre;Pedro Luna;;;;;;;;
Carrer de Remigio Soler Tomás (Pintor);Hombre;Remigio Soler Tomás (Pintor);;;;;;;;
Carrer d'Álvarez de Sotomayor;Hombre;Álvarez de Sotomayor;;;;;;;;
Carrer d'Enrique Olmos Cercós;Hombre;Enrique Olmos Cercós;;;;;;;;
Avinguda de Karl Marx;Hombre;Karl Marx;;;;;;;;
Carrer d'Alexandre Laborde;Hombre;Alexandre Laborde;;;;;;;;
Carrer San Jose;Hombre;San Jose;;;;;;;;
Carrer de l'Arquebisbe Mayoral;Hombre;l'Arquebisbe Mayoral;;;;;;;;
Carrer de Josep Alminyana i Valles (Sacerdot);Hombre;Josep Alminyana i Valles (Sacerdot);;;;;;;;
Carrer de Vicent Puchol;Hombre;Vicent Puchol;;;;;;;;
Carrer del Pastor Aycart;Hombre;Pastor Aycart;;;;;;;;
Carrer de Sant Salvador;Hombre;Sant Salvador;;;;;;;;
Carrer del Miniaturista Crespí;Hombre;Miniaturista Crespí;;;;;;;;
Carrer de José Siurana;Hombre;José Siurana;;;;;;;;
Carrer d'Alberto Gisbert;Hombre;Alberto Gisbert;;;;;;;;
Carrer d'Agustín Velarte Morte;Hombre;Agustín Velarte Morte;;;;;;;;
Carrer del Pintor Rafael Mocholí;Hombre;Pintor Rafael Mocholí;;;;;;;;
Carrer del Crist del Refugi;Hombre;Crist del Refugi;;;;;;;;
Carrer de Tomàs Gisbert;Hombre;Tomàs Gisbert;;;;;;;;
Carrer de l'Erudit Almarche;Hombre;l'Erudit Almarche;;;;;;;;
Carrer del Mestre Alberto Luz;Hombre;Mestre Alberto Luz;;;;;;;;
Carrer del Pintor Garnelo;Hombre;Pintor Garnelo;;;;;;;;
Carrer del Gravador Selma;Hombre;Gravador Selma;;;;;;;;
Carrer de Rafael Tenes Escrich;Hombre;Rafael Tenes Escrich;;;;;;;;
Carrer de Rafael Mollá Rodrigo (Doctor);Hombre;Rafael Mollá Rodrigo (Doctor);;;;;;;;
Carrer d´Espronceda;Hombre;d´Espronceda;;;;;;;;
Carrer d'Evaristo Bas;Hombre;Evaristo Bas;;;;;;;;
Carrer de Lorenzo Saiz;Hombre;Lorenzo Saiz;;;;;;;;
Carrer de Santigo Lope;Hombre;Santigo Lope;;;;;;;;
Carrer del Doctor Buen;Hombre;Doctor Buen;;;;;;;;
Carrer de l'Arquitecte Gilabert;Hombre;l'Arquitecte Gilabert;;;;;;;;
Carrer del Pintor Cabrera;Hombre;Pintor Cabrera;;;;;;;;
Carrer del Pare Simó;Hombre;Pare Simó;;;;;;;;
Carrer de Don Quijote de La Mancha;Hombre;Don Quijote de La Mancha;;;;;;;;
Carrer de Mossén Muñoz;Hombre;Mossén Muñoz;;;;;;;;
Calle de Guillem de Castro;Hombre;Guillem de Castro;;;;;;;;1
Carrer del Moro Zeid;Hombre;Moro Zeid;;;;;;;;
Calle Murillo;Hombre;Murillo;;;;;;;;
Carrer de Donoso Cortés;Hombre;Donoso Cortés;;;;;;;;1
Carrer de Joaquim Costa;Hombre;Joaquim Costa;;;;;;;;
Carrer de Vicent Lleó;Hombre;Vicent Lleó;;;;;;;;
Carrer d'Espartero;Hombre;Espartero;;;;;;;;
Carrer del Marqués de Zenete;Hombre;Marqués de Zenete;;;;;;;;1
Carrer de Joan Baptista Coratjà;Hombre;Joan Baptista Coratjà;;;;;;;;
Carrer de Pius XI;Hombre;Pius XI;;;;;;;;
Carrer del Músic Gomis;Hombre;Músic Gomis;;;;;;;;
Carrer de Salvador Guinot;Hombre;Salvador Guinot;;;;;;;;
Avinguda d'Ausi��s March;Hombre;Ausi��s March;;;;;;;;
Carrer del Vicari José Ramón;Hombre;Vicari José Ramón;;;;;;;;
Carrer de Pascual Cortina;Hombre;Pascual Cortina;;;;;;;;
Carrer del Doctor Villena;Hombre;Doctor Villena;;;;;;;;
Carrer d'En Vicent Alberó Masià;Hombre;En Vicent Alberó Masià;;;;;;;;
Carrer del Reverend Josep Valero;Hombre;Reverend Josep Valero;;;;;;;;
Carrer de Josep Maria Fuster;Hombre;Josep Maria Fuster;;;;;;;;
Carrer del Mestre Cristóbal León;Hombre;Mestre Cristóbal León;;;;;;;;
Carrer de Carmelo Vicent;Hombre;Carmelo Vicent;;;;;;;;
Carrer de l'Apòstol Sant Pere;Hombre;l'Apòstol Sant Pere;;;;;;;;
Carretera de Daniel;Hombre;Daniel;;;;;;;;
Calle de San Pío V;Hombre;San Pío V;;;;;;;;
Carrer de Sant Jaume Apòstol;Hombre;Sant Jaume Apòstol;;;;;;;;
Carrer del Beat Nicolau Factor;Hombre;Beat Nicolau Factor;;;;;;;;
Carrer de L'Humanista Mariner;Hombre;L'Humanista Mariner;;;;;;;;
Carrer del Gravador Fabregat;Hombre;Gravador Fabregat;;;;;;;;
Carrer de Federico Alcácer Aguilar;Hombre;Federico Alcácer Aguilar;;;;;;;;
Carrer d'Eduard González;Hombre;Eduard González;;;;;;;;
Carrer de Roig de Corella;Hombre;Roig de Corella;;;;;;;;
Carrer del Dr Sumsi;Hombre;Dr Sumsi;;;;;;;;1
Carrer Joan de Perpinyà;Hombre;Joan de Perpinyà;;;;;;;;
Carrer de Sant Pius X;Hombre;Sant Pius X;;;;;;;;
Carrer de Pius IX;Hombre;Pius IX;;;;;;;;
Camí Assagador del Morro;Hombre;Assagador del Morro;;;;;;;;
Carrer del Mestre Josep Serrano;Hombre;Mestre Josep Serrano;;;;;;;;
Carrer de Felipe Rinaldi;Hombre;Felipe Rinaldi;;;;;;;;
Carrer del Compte de Torrefiel;Hombre;Compte de Torrefiel;;;;;;;;
Avenida del Actor Antonio Ferrandis;Hombre;Actor Antonio Ferrandis;;;;;;;;
Plaça de Luis Cano;Hombre;Luis Cano;;;;;;;;
Carrer del Salvador;Hombre;Salvador;;;;;;;;
Carrer de Juan Ribera Berenguer (Pintor);Hombre;Juan Ribera Berenguer (Pintor);;;;;;;;
Carrer de Luis Antonio García Navarro (Músic);Hombre;Luis Antonio García Navarro (Músic);;;;;;;;
Avenida Doctor Tomás Sala;Hombre;Doctor Tomás Sala;;;;;;;;
Carrer de Carlos Climent González (Jurista);Hombre;Carlos Climent González (Jurista);;;;;;;;
Carrer de Salvador Cerveró;Hombre;Salvador Cerveró;;;;;;;;
Carrer de José Albi (Poeta);Hombre;José Albi (Poeta);;;;;;;;
Carrer de Francisco Llácer Pla (Músic);Hombre;Francisco Llácer Pla (Músic);;;;;;;;
Plaça d'Antoni Cortis;Hombre;Antoni Cortis;;;;;;;;
Calle Escultor José Capuz;Hombre;Escultor José Capuz;;;;;;;;
Carrer d'Emili Camps i Gallego;Hombre;Emili Camps i Gallego;;;;;;;;
Carrer de Josep Soriano i Izquierdo;Hombre;Josep Soriano i Izquierdo;;;;;;;;
Carrer de Pau;Hombre;Pau;;;;;;;;
Carrer de Santiago Calatrava (Arquitecte);Hombre;Santiago Calatrava (Arquitecte);;;;;;;;
Carrer del Poeta Jorge Guillén;Hombre;Poeta Jorge Guillén;;;;;;;;
Carrer del Poeta Blas de Otero;Hombre;Poeta Blas de Otero;;;;;;;;
Carrer de l'Enginyer Alberto Oñate;Hombre;l'Enginyer Alberto Oñate;;;;;;;;
Plaça de l'Urbanista Antonio Sancho;Hombre;l'Urbanista Antonio Sancho;;;;;;;;
Carrer d'Ángel Guardia Cortés;Hombre;Ángel Guardia Cortés;;;;;;;;
Carrer d'Alabau i Arce;Hombre;Alabau i Arce;;;;;;;;
Carrer de l'Arquitecte Segura de Lago;Hombre;l'Arquitecte Segura de Lago;;;;;;;;
Carrer del Beat Gálvez;Hombre;Beat Gálvez;;;;;;;;
Carrer de Lluís Fenollet;Hombre;Lluís Fenollet;;;;;;;;
Carrer d'Antonio Fuentes Pascual;Hombre;Antonio Fuentes Pascual;;;;;;;;
Carrer de José Burguete Guillem;Hombre;José Burguete Guillem;;;;;;;;
Carrer del llibrer Esclapés;Hombre;llibrer Esclapés;;;;;;;;
Carrer de Fernando Cabedo Torrents (Dibuixant);Hombre;Fernando Cabedo Torrents (Dibuixant);;;;;;;;
Carrer de Joan Miró;Hombre;Joan Miró;;;;;;;;
Carrer de José Pastor Moreno;Hombre;José Pastor Moreno;;;;;;;;
Carrer d'Ignacio Hernández Hervás (Metge);Hombre;Ignacio Hernández Hervás (Metge);;;;;;;;
Carrer d'Antoni Reig i Ventura (Rovellet);Hombre;Antoni Reig i Ventura (Rovellet);;;;;;;;
Carrer de Góngora;Hombre;Góngora;;;;;;;;
Carrer de Jesús Ribera Faig (Músic);Hombre;Jesús Ribera Faig (Músic);;;;;;;;
Carrer de Vicent Tomàs i Martí;Hombre;Vicent Tomàs i Martí;;;;;;;;
Carrer del Doctor Pérez Feliu;Hombre;Doctor Pérez Feliu;;;;;;;;
Carrer del Periodista Roberto Castrovido;Hombre;Periodista Roberto Castrovido;;;;;;;;
Plaça de Vicent Andrés Estellés;Hombre;Vicent Andrés Estellés;;;;;;;;
Carrer de Sant Maure;Hombre;Sant Maure;;;;;;;;
Carrer de l'Escriptor Bono i Barber;Hombre;l'Escriptor Bono i Barber;;;;;;;;
Calle Obispo Puchol Montís;Hombre;Obispo Puchol Montís;;;;;;;;
Carrer d'Amadeu de Desfilis;Hombre;Amadeu de Desfilis;;;;;;;;
Carrer d'Emili Nadal (Mestre);Hombre;Emili Nadal (Mestre);;;;;;;;
Carrer del Poeta Alberto Lista;Hombre;Poeta Alberto Lista;;;;;;;;
Carrer d'Ep Salvador Salom (Paralela);Hombre;Ep Salvador Salom (Paralela);;;;;;;;
Carrer de Lluís de Milà;Hombre;Lluís de Milà;;;;;;;;
Carrer de Vicente Sanchis-Bayarri Lahoz;Hombre;Vicente Sanchis-Bayarri Lahoz;;;;;;;;
Plaça de Jules Verne;Hombre;Jules Verne;;;;;;;;
Carrer de Vicent Marco Miranda (Polític);Hombre;Vicent Marco Miranda (Polític);;;;;;;;
Carrer de Carles;Hombre;Carles;;;;;;;;
Carrer d'Amado Granell Mesado;Hombre;Amado Granell Mesado;;;;;;;;
Carrer de Lluïs Janini;Hombre;Lluïs Janini;;;;;;;;
Carrer de García;Hombre;García;;;;;;;;
Plaça de Josep Melià i Castelló (Poeta);Hombre;Josep Melià i Castelló (Poeta);;;;;;;;
Carrer de Rafael Comenge;Hombre;Rafael Comenge;;;;;;;;
Carrer del Metge Balmis;Hombre;Metge Balmis;;;;;;;;
Entrada Cases d'Àngel;Hombre;Cases d'Àngel;;;;;;;;
Carrer de Sant Jacint Castanyeda;Hombre;Sant Jacint Castanyeda;;;;;;;;
Carrer de l'Emperador;Hombre;l'Emperador;;;;;;;;
Carrer de Pedro Cámara (Pintor);Hombre;Pedro Cámara (Pintor);;;;;;;;
Carrer de José Burguete Guillem (Músic);Hombre;José Burguete Guillem (Músic);;;;;;;;
Carrer del Pare Ciprià;Hombre;Pare Ciprià;;;;;;;;
Carrer del Pare Lluís Fullana;Hombre;Pare Lluís Fullana;;;;;;;;
Calle Ceramista Bayarri;Hombre;Ceramista Bayarri;;;;;;;;
Carrer de Cerdà;Hombre;Cerdà;;;;;;;;
Carrer de l'Escultor Ponzanelli;Hombre;l'Escultor Ponzanelli;;;;;;;;
Carrer de Francisco Comes Martínez (dramaturg);Hombre;Francisco Comes Martínez (dramaturg);;;;;;;;
Carrer de Jose Maria Desantes Guanter;Hombre;Jose Maria Desantes Guanter;;;;;;;;
Carrer de Rafael Company;Hombre;Rafael Company;;;;;;;;
Plaça de Nassio Bayarri (Escultor);Hombre;Nassio Bayarri (Escultor);;;;;;;;
Plaça del Músic Fayos;Hombre;Músic Fayos;;;;;;;;
Plaça del Pintor Llanos;Hombre;Pintor Llanos;;;;;;;;
Carrer de Fernando Dicenta de Vera (Acadèmic);Hombre;Fernando Dicenta de Vera (Acadèmic);;;;;;;;
Carrer d'Àngel Tomàs García (Salesià);Hombre;Àngel Tomàs García (Salesià);;;;;;;;
Carrer del Coronel Montesinos;Hombre;Coronel Montesinos;;;;;;;;
Carrer del Pare Rico;Hombre;Pare Rico;;;;;;;;
Carrer d'Antonio Ballester Vilaseca Tonico (escultor);Hombre;Antonio Ballester Vilaseca Tonico (escultor);;;;;;;;
Plaça del Vicari Ferrer;Hombre;Vicari Ferrer;;;;;;;;
Carrer del Diputat Ricard Samper;Hombre;Diputat Ricard Samper;;;;;;;;
Calle Diputado Ricardo Samper;Hombre;Diputado Ricardo Samper;;;;;;;;
Carrer d'Aben Amir;Hombre;Aben Amir;;;;;;;;
Carrer de Manuel Iranzo;Hombre;Manuel Iranzo;;;;;;;;
Gran Vía Fernando 'el Católico';Hombre;Gran Vía Fernando 'el Católico';;;;;;;;1
Carrer del Comte d'Olocau;Hombre;Comte d'Olocau;;;;;;;;1
Avinguda d'Amado Granell Mesado;Hombre;Amado Granell Mesado;;;;;;;;
Carrer del Cobertís de Sant Tomàs;Hombre;Cobertís de Sant Tomàs;;;;;;;;
Carrer de Fernando Senent Pérez (Catedràtic);Hombre;Fernando Senent Pérez (Catedràtic);;;;;;;;
Carrer del Cor de Jesús;Hombre;Cor de Jesús;;;;;;;;
carrer Duc;Hombre;Duc;;;;;;;;
Plaça de Juan Artal Ortells (Alcalde de la Coronació);Hombre;Juan Artal Ortells (Alcalde de la Coronació);;;;;;;;
Plaça de Jesús Maroto i González (Faller);Hombre;Jesús Maroto i González (Faller);;;;;;;;
Plaça de la Comunió de Sant Esteve;Hombre;Comunió de Sant Esteve;;;;;;;;
Plaça del Doctor Ximeno;Hombre;Doctor Ximeno;;;;;;;;
Carrer de Frederic Jordan i Calvo;Hombre;Frederic Jordan i Calvo;;;;;;;;
Carrer de Pere Compte Mestre de la Pedra;Hombre;Pere Compte Mestre de la Pedra;;;;;;;;
Calle de Juan Bautista Comes;Hombre;Juan Bautista Comes;;;;;;;;
Carrer d'Enrique Olmos;Hombre;Enrique Olmos;;;;;;;;
Carrer del Doctor Garcia Brustenga;Hombre;Doctor Garcia Brustenga;;;;;;;;
Carrer de Sant Dionís;Hombre;Sant Dionís;;;;;;;;
Carrer de Manuel Azaña;Hombre;Manuel Azaña;;;;;;;;
Passeig d'Antonio Machado;Hombre;Antonio Machado;;;;;;;;
Carrer de Luis Campos;Hombre;Luis Campos;;;;;;;;
Carrer de Pablo Meléndez;Hombre;Pablo Meléndez;;;;;;;;
Carrer de Fra Mateu;Hombre;Fra Mateu;;;;;;;;
Carrer de Sant Martí de Porres;Hombre;Sant Martí de Porres;;;;;;;;
Carrer de l'Argenter Quinzà;Hombre;l'Argenter Quinzà;;;;;;;;
Carrer del Doctor Ricardo Aparici;Hombre;Doctor Ricardo Aparici;;;;;;;;
Carrer del Periodista Matoses;Hombre;Periodista Matoses;;;;;;;;
Carrer d'Elies Tormo;Hombre;Elies Tormo;;;;;;;;
Carrer Arquitecte Ribes;Hombre;Arquitecte Ribes;;;;;;;;
Carrer del Periodista Enrique Ginés;Hombre;Periodista Enrique Ginés;;;;;;;;
Carrer de Simón Ortiz;Hombre;Simón Ortiz;;;;;;;;
Plaça del Pintor Andreu;Hombre;Pintor Andreu;;;;;;;;
Carrer d'Aarón Vidal López (Soldat);Hombre;Aarón Vidal López (Soldat);;;;;;;;
Carrer de Vicent Miguel Carceller (Periodista);Hombre;Vicent Miguel Carceller (Periodista);;;;;;;;
Plaça de la Comunió de Sant Joan;Hombre;Comunió de Sant Joan;;;;;;;;
Carrer de Joan Baptista Muñoz;Hombre;Joan Baptista Muñoz;;;;;;;;
Carrer de Blas Gámez Ortiz (subinspector);Hombre;Blas Gámez Ortiz (subinspector);;;;;;;;
Carrer de Joanot Martorell;Hombre;Joanot Martorell;;;;;;;;
Carrer de Serrano Morales;Hombre;Serrano Morales;;;;;;;;
Carrer del General San Martín;Hombre;General San Martín;;;;;;;;
Davallada de Sant Miquel;Hombre;Davallada de Sant Miquel;;;;;;;;1
Carrer de Vicent Branchat;Hombre;Vicent Branchat;;;;;;;;
Calle Pérez Escrich;Hombre;Pérez Escrich;;;;;;;;
Carrer de Sabas Arias;Hombre;Sabas Arias;;;;;;;;
Carrer de Konrad Rudolf (arquitecte);Hombre;Konrad Rudolf (arquitecte);;;;;;;;
Carrer de Joan Reixach (pintor);Hombre;Joan Reixach (pintor);;;;;;;;
Carrer de Mariano Carsí Pascual (metge);Hombre;Mariano Carsí Pascual (metge);;;;;;;;
Carrer del Mestre Francisco Sanchis Huerta;Hombre;Mestre Francisco Sanchis Huerta;;;;;;;;
Plaça del Professor Tierno Galván;Hombre;Professor Tierno Galván;;;;;;;;
Plaça de Vicente Castell Maiques (Historiador);Hombre;Vicente Castell Maiques (Historiador);;;;;;;;
Carrer de Juan Estellés;Hombre;Juan Estellés;;;;;;;;
Avinguda del Marqués de Soletlo;Hombre;Marqués de Soletlo;;;;;;;;
Carrer de Colón;Hombre;Colón;;;;;;;;
Carrer de Roger de Lauria;Hombre;Roger de Lauria;;;;;;;;
Carrer del Doctor Chiarri;Hombre;Doctor Chiarri;;;;;;;;
Carrer de Leopoldo Piles Ros (Professor);Hombre;Leopoldo Piles Ros (Professor);;;;;;;;
Plaça de Salvador Sòria;Hombre;Salvador Sòria;;;;;;;;
Calle Eduardo Boscá;Hombre;Eduardo Boscá;;;;;;;;
Carrer del Pare Gaspar Francés;Hombre;Pare Gaspar Francés;;;;;;;;
Carrer de Nelo el Fariner;Hombre;Nelo el Fariner;;;;;;;;
Carrer de l'Escultor Frederic Siurana;Hombre;l'Escultor Frederic Siurana;;;;;;;;
Carrer d'Emili Ramon Llin;Hombre;Emili Ramon Llin;;;;;;;;
Calle Guillem de Castro;Hombre;Guillem de Castro;;;;;;;;
Carrer de José Martí (Escriptor);Hombre;José Martí (Escriptor);;;;;;;;
Carrer de Ramón Juan;Hombre;Ramón Juan;;;;;;;;
Carrer de l'Escultor Salzillo;Hombre;l'Escultor Salzillo;;;;;;;;
Carrer de Santiago Galas;Hombre;Santiago Galas;;;;;;;;
Carrer del Conseller Francesc Bosch;Hombre;Conseller Francesc Bosch;;;;;;;;
Carrer de Ricardo Codoñer;Hombre;Ricardo Codoñer;;;;;;;;
Carrer de Carlos Tomàs Costa (mestre seder);Hombre;Carlos Tomàs Costa (mestre seder);;;;;;;;
Carrer d'Antoni Lázaro;Hombre;Antoni Lázaro;;;;;;;;
Plaça de Vicente Gil Ros (Medallista Paralímpic);Hombre;Vicente Gil Ros (Medallista Paralímpic);;;;;;;;
Carrer de Juan de Mena / Carrer d'Espinosa;Hombre;Juan de Mena / Carrer d'Espinosa;;;;;;;;
Carrer de Fernando Cabedo Torrents;Hombre;Fernando Cabedo Torrents;;;;;;;;
Carrer de Max Aub;Hombre;Max Aub;;;;;;;;
Carrer d'Edison;Hombre;Edison;;;;;;;;
Carrer del Doctor Domagk;Hombre;Doctor Domagk;;;;;;;;
Carrer del Doctor Fleming;Hombre;Doctor Fleming;;;;;;;;
Plaça de l'Actor Enrique Rambal;Hombre;l'Actor Enrique Rambal;;;;;;;;
Plaça del Pintor Gonzalo Peris;Hombre;Pintor Gonzalo Peris;;;;;;;;
Plaça de Joan Antoni Benlliure;Hombre;Joan Antoni Benlliure;;;;;;;;
Plaça del Llibertador Simón Bolívar;Hombre;Llibertador Simón Bolívar;;;;;;;;
Plaça de Nicolás Redondo i Marcelino Camacho;Hombre;Nicolás Redondo i Marcelino Camacho;;;;;;;;
Plaça del Gravador Planes;Hombre;Gravador Planes;;;;;;;;
Plaça de Manuel Broseta i Pont;Hombre;Manuel Broseta i Pont;;;;;;;;
Plaça d'Olof Palme;Hombre;Olof Palme;;;;;;;;
Plaça de Ramon Muntaner;Hombre;Ramon Muntaner;;;;;;;;
Carrer de José Aguilar;Hombre;José Aguilar;;;;;;;;
Plaça del Pintor Anglada;Hombre;Pintor Anglada;;;;;;;;
Plaça d'Emilio Attard;Hombre;Emilio Attard;;;;;;;;
Avinguda de l'Enginyer Manuel Soto;Hombre;l'Enginyer Manuel Soto;;;;;;;;
Carrer del Doctor Marcos Sopena;Hombre;Doctor Marcos Sopena;;;;;;;;
Carrer de Leandro de Saralegui;Hombre;Leandro de Saralegui;;;;;;;;
Carrer del Poeta Artola;Hombre;Poeta Artola;;;;;;;;
Carrer de Ramon Llull;Hombre;Ramon Llull;;;;;;;;
Carrer del Marí Blas de Lezo;Hombre;Marí Blas de Lezo;;;;;;;;
Carrer de Lluís Peixó;Hombre;Lluís Peixó;;;;;;;;
