Calle;Género;Nombre;Religioso;Ficción;Descripción;Artículo;Imagen;Fecha Nacimiento;Fecha Muerte;Céntrica
Carrer de Jaime Beltrán;Hombre;Jaime Beltrán;;;;;;;;
Carrer de Llorenç Salom;Hombre;Llorenç Salom;;;;;;;;
Carrer de Jeroni Munyós;Hombre;Jeroni Munyós;;;;;;;;
Carrer del Poeta Maragall;Hombre;Poeta Maragall;;;;;;;;
Carrer de Mateu i Sanç;Hombre;Mateu i Sanç;;;;;;;;
Carrer de Bonifaci Ferrer;Hombre;Bonifaci Ferrer;;;;;;;;
Carrer de Misser Rabassa;Hombre;Misser Rabassa;;;;;;;;
Carrer de Joan Aguiló;Hombre;Joan Aguiló;;;;;;;;
Carrer del Marqués de Bellet;Hombre;Marqués de Bellet;;;;;;;;
Carrer de Joaquín Navarro;Hombre;Joaquín Navarro;;;;;;;;
Carrer de Gabriel y Galán;Hombre;Gabriel y Galán;;;;;;;;
Carrer de Costa i Borràs;Hombre;Costa i Borràs;;;;;;;;
Carrer del Mestre Sosa;Hombre;Mestre Sosa;;;;;;;;
Passatge de Ventura Feliu;Hombre;Ventura Feliu;;;;;;;;
Carrer de Francesc Climent;Hombre;Francesc Climent;;;;;;;;
Carretera d'Escrivà;Hombre;Escrivà;;;;;;;;
Carrer del Metge Esteve;Hombre;Metge Esteve;;;;;;;;
Carrer de la Cooperativa de Sant Ferran;Hombre;Cooperativa de Sant Ferran;;;;;;;;
Carrer de Juan Fabregat;Hombre;Juan Fabregat;;;;;;;;
Carrer de Lladró i Mallí;Hombre;Lladró i Mallí;;;;;;;;
Carrer del Marqués de Campo;Hombre;Marqués de Campo;;;;;;;;
Carrer de Cebrian Mezquita;Hombre;Cebrian Mezquita;;;;;;;;
Carrer d'Agustí Sales;Hombre;Agustí Sales;;;;;;;;
Carrer de Cienfuegos;Hombre;Cienfuegos;;;;;;;;
Carrer de Vicente Lleó;Hombre;Vicente Lleó;;;;;;;;
Carrer del Organista Plasencia;Hombre;Organista Plasencia;;;;;;;;
Carrer de Rafael Contreras Juesas (cartellista);Hombre;Rafael Contreras Juesas (cartellista);;;;;;;;
Carrer de Lluís Oliag;Hombre;Lluís Oliag;;;;;;;;
Carrer de Salvador Lluch;Hombre;Salvador Lluch;;;;;;;;
Carrer del Dos d'Abril;Hombre;Dos d'Abril;;;;;;;;
Carrer de Rafael Cort;Hombre;Rafael Cort;;;;;;;;
Carrer del General Almirante;Hombre;General Almirante;;;;;;;;
Plaça del Pedagog Pestalozzi;Hombre;Pedagog Pestalozzi;;;;;;;;
Carrer de Juan de Celaya;Hombre;Juan de Celaya;;;;;;;;
Carrer de Sant Ernest;Hombre;Sant Ernest;;;;;;;;
Carrer de l'Arquitecte Monleón;Hombre;l'Arquitecte Monleón;;;;;;;;
Carrer del General Prim;Hombre;General Prim;;;;;;;;1
Carrer del Mestre Aguilar;Hombre;Mestre Aguilar;;;;;;;;
Carrer de l'Arquebisbe Melo;Hombre;l'Arquebisbe Melo;;;;;;;;
Plaça del Doctor Landete;Hombre;Doctor Landete;;;;;;;;
Carrer de l'Escultor Josep Capuz;Hombre;l'Escultor Josep Capuz;;;;;;;;
Carrer de Carles Cervera;Hombre;Carles Cervera;;;;;;;;
Carrer de Juan de Dios Montañés;Hombre;Juan de Dios Montañés;;;;;;;;1
Carrer de Sant Valero;Hombre;Sant Valero;;;;;;;;
Carrer del Pare Perera;Hombre;Pare Perera;;;;;;;;
Carrer de Pere III el Gran;Hombre;Pere III el Gran;;;;;;;;1
Carrer del Mossén Femenia;Hombre;Mossén Femenia;;;;;;;;
Carrer del Doctor Serrano;Hombre;Doctor Serrano;;;;;;;;
Carrer del Músic Padilla;Hombre;Músic Padilla;;;;;;;;1
Carrer del Poeta Al-Russafi;Hombre;Poeta Al-Russafi;;;;;;;;
Carrer de Francesc Sempere;Hombre;Francesc Sempere;;;;;;;;
Carrer de Romeu de Corbera;Hombre;Romeu de Corbera;;;;;;;;
Carrer dels Centelles;Hombre;Centelles;;;;;;;;
Carrer del Literat Azorín;Hombre;Literat Azorín;;;;;;;;
Carrer del Pintor Gisbert;Hombre;Pintor Gisbert;;;;;;;;
Carrer del Doctor Vila Barberá;Hombre;Doctor Vila Barberá;;;;;;;;1
Carrer de Salvador Sastre;Hombre;Salvador Sastre;;;;;;;;1
Carrer del Doctor Gil i Morte;Hombre;Doctor Gil i Morte;;;;;;;;
Plaça d'Enric Granados;Hombre;Enric Granados;;;;;;;;
Carrer de Vicente Clavel;Hombre;Vicente Clavel;;;;;;;;
Carrer del Mariscal Foch;Hombre;Mariscal Foch;;;;;;;;
Carrer de Felipe Valls;Hombre;Felipe Valls;;;;;;;;
Carrer del Doctor Sanchís Sivera;Hombre;Doctor Sanchís Sivera;;;;;;;;1
Passatge de Valentín González Ramírez;Hombre;Valentín González Ramírez;;;;;;;;
Carrer del Mossén Jacint Verdaguer;Hombre;Mossén Jacint Verdaguer;;;;;;;;
Carrer del Pintor Navarro Llorens;Hombre;Pintor Navarro Llorens;;;;;;;;
Carrer de l'Heroi Romeu;Hombre;l'Heroi Romeu;;;;;;;;
Carrer de l'Historiador Diago;Hombre;l'Historiador Diago;;;;;;;;1
Plaça del Bisbe Amigó;Hombre;Bisbe Amigó;;;;;;;;1
Carrer de Sant Josep de Calassanç;Hombre;Sant Josep de Calassanç;;;;;;;;
Carrer del Pintor Benedito;Hombre;Pintor Benedito;;;;;;;;1
Carrer de Sant Francesc de Borja;Hombre;Sant Francesc de Borja;;;;;;;;
Carrer de Llorca;Hombre;Llorca;;;;;;;;
Carrer de Salas Quiroga;Hombre;Salas Quiroga;;;;;;;;
Carrer d'Honorat Juan;Hombre;Honorat Juan;;;;;;;;
Carrer de Martínez Aloy;Hombre;Martínez Aloy;;;;;;;;
Avenida de Pérez Galdós;Hombre;Pérez Galdós;;;;;;;;
Avinguda Tirso de Molina;Hombre;Tirso de Molina;;;;;;;;
Carrer de Joaquim Ballester;Hombre;Joaquim Ballester;;;;;;;;
Carrer de l'Argenter Suàrez;Hombre;l'Argenter Suàrez;;;;;;;;
Carrer de Joaquín Ballester;Hombre;Joaquín Ballester;;;;;;;;
Carrer de l'Hort d'En Vicent;Hombre;l'Hort d'En Vicent;;;;;;;;
Carrer de Franco Tormo;Hombre;Franco Tormo;;;;;;;;
Carrer de l'Escultor Vicente Rodilla;Hombre;l'Escultor Vicente Rodilla;;;;;;;;
Carrer del Músic Barbieri;Hombre;Músic Barbieri;;;;;;;;
Carrer del Litògraf Pascual i Abad;Hombre;Litògraf Pascual i Abad;;;;;;;;
Carrer de Calvo Acacio;Hombre;Calvo Acacio;;;;;;;;
Carrer de Sant Llàtzer;Hombre;Sant Llàtzer;;;;;;;;
Carrer del Músic Penella;Hombre;Músic Penella;;;;;;;;
Carrer de l’Erudit Orellana;Hombre;l’Erudit Orellana;;;;;;;;
Carrer de Calixt III;Hombre;Calixt III;;;;;;;;
Carrer del Literat Gabriel Miró;Hombre;Literat Gabriel Miró;;;;;;;;
Carrer de Joan Llorenç;Hombre;Joan Llorenç;;;;;;;;
carrer de Martí l’Humà;Hombre;Martí l’Humà;;;;;;;;
Carrer del Pintor Vila Prades;Hombre;Pintor Vila Prades;;;;;;;;
Carrer de Sant Ignasi de Loiola;Hombre;Sant Ignasi de Loiola;;;;;;;;
Carrer del Mestre Guerrero;Hombre;Mestre Guerrero;;;;;;;;
Carrer de Sant Jacint;Hombre;Sant Jacint;;;;;;;;
Carrer de Jesús i Maria;Hombre;Jesús i Maria;;;;;;;;
Carrer de González Martí;Hombre;González Martí;;;;;;;;
Calle de González Martí;Hombre;González Martí;;;;;;;;
Plaça de l'Horticultor Corset;Hombre;l'Horticultor Corset;;;;;;;;
Avinguda de Sant Josep de la Muntanya;Hombre;Sant Josep de la Muntanya;;;;;;;;
Carrer del Doctor Zamenhof;Hombre;Doctor Zamenhof;;;;;;;;
Carrer d'Ernest Ferrer;Hombre;Ernest Ferrer;;;;;;;;
Carrer del Pare Tomás de Montañana;Hombre;Pare Tomás de Montañana;;;;;;;;
Carrer del Doctor Vicent Zaragozà;Hombre;Doctor Vicent Zaragozà;;;;;;;;
Carrer de Daniel Balaciart;Hombre;Daniel Balaciart;;;;;;;;
Carrer de Sant Joan de la Creu;Hombre;Sant Joan de la Creu;;;;;;;;
Carrer de Federico Tomás;Hombre;Federico Tomás;;;;;;;;
Carrer del Ministre Lluís Mayans;Hombre;Ministre Lluís Mayans;;;;;;;;
Carrer del Pare Palau i Quer;Hombre;Pare Palau i Quer;;;;;;;;
Carrer de Mateo Escrivà;Hombre;Mateo Escrivà;;;;;;;;
Plaça de Sant Pere Nolasc;Hombre;Sant Pere Nolasc;;;;;;;;
Carrer de Duato;Hombre;Duato;;;;;;;;
Carrer de Sant Guillem;Hombre;Sant Guillem;;;;;;;;
Carrer de Maximilià Thous;Hombre;Maximilià Thous;;;;;;;;
Carrer de Calderón de la Barca;Hombre;Calderón de la Barca;;;;;;;;
Carrer del Pintor Genaro Lahuerta;Hombre;Pintor Genaro Lahuerta;;;;;;;;
Carrer de Rubén Darío;Hombre;Rubén Darío;;;;;;;;
Carrer de l'Historiador Claudio Sánchez Albornoz;Hombre;l'Historiador Claudio Sánchez Albornoz;;;;;;;;
Plaça de Nelson Mandela;Hombre;Nelson Mandela;;;;;;;;
Carrer de Fra Pere Vives;Hombre;Fra Pere Vives;;;;;;;;
Carrer de l'Actor Mora;Hombre;l'Actor Mora;;;;;;;;
Carrer del Filòleg Sanelo;Hombre;Filòleg Sanelo;;;;;;;;
Carrer del Pare Urbà;Hombre;Pare Urbà;;;;;;;;
Carrer de Sant Bru;Hombre;Sant Bru;;;;;;;;
Carrer d'Agustí Centelles Ossó (Fotògraf);Hombre;Agustí Centelles Ossó (Fotògraf);;;;;;;;
Carrer dels Germans Fabrilo;Hombre;Germans Fabrilo;;;;;;;;
Carrer de l'Arquitecte Almenar;Hombre;l'Arquitecte Almenar;;;;;;;;
Carrer de l'Arquitecte Carbonell;Hombre;l'Arquitecte Carbonell;;;;;;;;
Carrer de l'Arquitecte Lucini;Hombre;l'Arquitecte Lucini;;;;;;;;
Carrer de Modesto González Latorre (artista faller);Hombre;Modesto González Latorre (artista faller);;;;;;;;
Carrer de Juan Castelló;Hombre;Juan Castelló;;;;;;;;
Carrer de Just Ramírez (arquitecte);Hombre;Just Ramírez (arquitecte);;;;;;;;
Carrer de Gonzalo Ramiro Pedrer;Hombre;Gonzalo Ramiro Pedrer;;;;;;;;
Carrer de Vicent Peris;Hombre;Vicent Peris;;;;;;;;
Carrer del Doctor Olóriz;Hombre;Doctor Olóriz;;;;;;;;
Carrer de Sant Pancraç;Hombre;Sant Pancraç;;;;;;;;
Carrer de Luis Crumiere;Hombre;Luis Crumiere;;;;;;;;
Carrer del Poeta Fernández Heredia;Hombre;Poeta Fernández Heredia;;;;;;;;
Carrer de l'Horticultor Galán;Hombre;l'Horticultor Galán;;;;;;;;
Carrer del Poeta Iranzo Simón;Hombre;Poeta Iranzo Simón;;;;;;;;
Carrer del Poeta Ben Hafadja;Hombre;Poeta Ben Hafadja;;;;;;;;
Carrer del Doctor Montoro;Hombre;Doctor Montoro;;;;;;;;
Carrer de Salvador Giner;Hombre;Salvador Giner;;;;;;;;
Pont de Sant Josep;Hombre;Sant Josep;;;;;;;;
Carrer del Arquebisbe Fabián i Fuero;Hombre;Arquebisbe Fabián i Fuero;;;;;;;;
Carrer del Periodista Llorente;Hombre;Periodista Llorente;;;;;;;;
Carrer del Doctor Faustí Barberà;Hombre;Doctor Faustí Barberà;;;;;;;;
Carrer del Poeta Monmeneu;Hombre;Poeta Monmeneu;;;;;;;;
Carrer del Pare Ferrís;Hombre;Pare Ferrís;;;;;;;;
Carrer de Gregori Gea;Hombre;Gregori Gea;;;;;;;;
Carrer del Reverend Rafael Ramon Llin;Hombre;Reverend Rafael Ramon Llin;;;;;;;;
Carrer d'Elías Borrás;Hombre;Elías Borrás;;;;;;;;
Carrer del Degà Ramón Arnau;Hombre;Degà Ramón Arnau;;;;;;;;
Carrer d'Elías Borràs (Poeta);Hombre;Elías Borràs (Poeta);;;;;;;;
Carrer de Narcís Monturiol;Hombre;Narcís Monturiol;;;;;;;;
Carrer d'Enric Gaspar;Hombre;Enric Gaspar;;;;;;;;
Carrer del Periodista Alfredo Calderón;Hombre;Periodista Alfredo Calderón;;;;;;;;
Carrer de Ricardo Micó;Hombre;Ricardo Micó;;;;;;;;
Carrer del Músic Jarque Cualladó;Hombre;Músic Jarque Cualladó;;;;;;;;
Carrer del Pare Damià;Hombre;Pare Damià;;;;;;;;
Carrer del Pare Tena;Hombre;Pare Tena;;;;;;;;
Carrer de l'Horticultor Bosch;Hombre;l'Horticultor Bosch;;;;;;;;
Carrer de l'Escritor Abu Salt;Hombre;l'Escritor Abu Salt;;;;;;;;
Carrer de l'Enginyer La Cierva;Hombre;l'Enginyer La Cierva;;;;;;;;
Carrer d'en Guillem Ferrer;Hombre;en Guillem Ferrer;;;;;;;;
Carrer de Josep Melià Pigmalion;Hombre;Josep Melià Pigmalion;;;;;;;;
Plaça de Joaquim Dualde;Hombre;Joaquim Dualde;;;;;;;;
Carrer de Bernat Gómez Igual;Hombre;Bernat Gómez Igual;;;;;;;;
Carrer de l'Acadèmic Castañeda;Hombre;l'Acadèmic Castañeda;;;;;;;;
Carrer del Doctor Machí;Hombre;Doctor Machí;;;;;;;;
Carrer de Baptista Esteve Ximeno;Hombre;Baptista Esteve Ximeno;;;;;;;;
Carrer del Profesor Beltrán Báguena;Hombre;Profesor Beltrán Báguena;;;;;;;;
Carrer de Sant Andreu;Hombre;Sant Andreu;;;;;;;;
Carrer del General Elío;Hombre;General Elío;;;;;;;;
Carrer de Ramon Porta Carrasco;Hombre;Ramon Porta Carrasco;;;;;;;;
Plaça del Poeta Salvador Rueda;Hombre;Poeta Salvador Rueda;;;;;;;;
Carrer d'Hipòlit Rovira;Hombre;Hipòlit Rovira;;;;;;;;
Carrer de Gil Roger;Hombre;Gil Roger;;;;;;;;
Carrer d'Alfons Verdeguer;Hombre;Alfons Verdeguer;;;;;;;;
Plaça del Pare Doménech;Hombre;Pare Doménech;;;;;;;;
Carrer del Pare Diego Mirón;Hombre;Pare Diego Mirón;;;;;;;;
Plaça de Baden Powell;Hombre;Baden Powell;;;;;;;;
Carrer de Sant Xavier;Hombre;Sant Xavier;;;;;;;;
Carrer del Pare Fullana;Hombre;Pare Fullana;;;;;;;;
Carrer de Miguel Servet;Hombre;Miguel Servet;;;;;;;;
Carrer de Francesc Barrachina Esteban;Hombre;Francesc Barrachina Esteban;;;;;;;;
Plaça del Diputat Lluís Lucia;Hombre;Diputat Lluís Lucia;;;;;;;;
Plaça del Papa Joan Pau II;Hombre;Papa Joan Pau II;;;;;;;;
Carrer de Carlos Dinnbier;Hombre;Carlos Dinnbier;;;;;;;;
Carrer del Poeta Antonino Chocomeli;Hombre;Poeta Antonino Chocomeli;;;;;;;;
Avinguda del Metge Vicente Torrent;Hombre;Metge Vicente Torrent;;;;;;;;
Plaça del Mestre Arambul Sanz;Hombre;Mestre Arambul Sanz;;;;;;;;
Carrer del Bisbe Soler;Hombre;Bisbe Soler;;;;;;;;
Carrer de Mossén Rausell;Hombre;Mossén Rausell;;;;;;;;
Carrer del Mestre Bagant;Hombre;Mestre Bagant;;;;;;;;
Carrer del Gravador Enguídanos;Hombre;Gravador Enguídanos;;;;;;;;
Carrer del Doctor Blay;Hombre;Doctor Blay;;;;;;;;
Carrer d'Aparicio Albiñana;Hombre;Aparicio Albiñana;;;;;;;;
Carrer d'Amando Blanquer (Compositor);Hombre;Amando Blanquer (Compositor);;;;;;;;
Carrer del Doctor Calatayud Baya;Hombre;Doctor Calatayud Baya;;;;;;;;
Carrer de Joan Aguilar;Hombre;Joan Aguilar;;;;;;;;
Carrer del Baró de Barxeta;Hombre;Baró de Barxeta;;;;;;;;
Carrer de l'Escultor Garcia Mas;Hombre;l'Escultor Garcia Mas;;;;;;;;
Carrer del Pare Muedra;Hombre;Pare Muedra;;;;;;;;
Carrer del Tenor García Romero;Hombre;Tenor García Romero;;;;;;;;
Carrer del Metge Ramón Tarazona;Hombre;Metge Ramón Tarazona;;;;;;;;
Carrer de Francesc Llosà i Viguer;Hombre;Francesc Llosà i Viguer;;;;;;;;
Carrer de Vicente Tormo Alfonso (Cardióleg);Hombre;Vicente Tormo Alfonso (Cardióleg);;;;;;;;
Carrer d'Amador Martínez Rochina (Poeta);Hombre;Amador Martínez Rochina (Poeta);;;;;;;;
Passatge d'Eusebi Sempere;Hombre;Eusebi Sempere;;;;;;;;
Carrer de Polo i Peyrolón;Hombre;Polo i Peyrolón;;;;;;;;
Passatge del Cartellista Rafael Raga;Hombre;Cartellista Rafael Raga;;;;;;;;
Carrer de Vicent Sancho Tello;Hombre;Vicent Sancho Tello;;;;;;;;
Plaça d'Alfredo Candel;Hombre;Alfredo Candel;;;;;;;;
Carrer d'Antonio Suárez;Hombre;Antonio Suárez;;;;;;;;
Carrer del Doctor Ferrann;Hombre;Doctor Ferrann;;;;;;;;
Plaça del Periodista Ros Belda;Hombre;Periodista Ros Belda;;;;;;;;
Carrer d'Antoni Suárez;Hombre;Antoni Suárez;;;;;;;;
Carrer de Felip María Garín;Hombre;Felip María Garín;;;;;;;;
Carrer del Pintor Monleón;Hombre;Pintor Monleón;;;;;;;;
Carrer dels Sants Just i Pastor;Hombre;Sants Just i Pastor;;;;;;;;
Carrer del Doctor Vicente Pallarés;Hombre;Doctor Vicente Pallarés;;;;;;;;
Carrer de Campoamor;Hombre;Campoamor;;;;;;;;
Carrer de Manuel Martí;Hombre;Manuel Martí;;;;;;;;
Carrer de Sant Joan Bosco;Hombre;Sant Joan Bosco;;;;;;;;
Carrer del Pare Viñas;Hombre;Pare Viñas;;;;;;;;
Carrer de Sant Domènec Savio;Hombre;Sant Domènec Savio;;;;;;;;
Carrer del Pintor Joan Baptista Porcar;Hombre;Pintor Joan Baptista Porcar;;;;;;;;
Carrer de Pere Cabanes;Hombre;Pere Cabanes;;;;;;;;
Carrer de Berni i Català;Hombre;Berni i Català;;;;;;;;
Carrer de l'Escultor Piquer;Hombre;l'Escultor Piquer;;;;;;;;
Carrer de Pere Patrici Mey;Hombre;Pere Patrici Mey;;;;;;;;
Carrer Doménec Gómez;Hombre;Doménec Gómez;;;;;;;;
Plaça del Bisbe Laguarda;Hombre;Bisbe Laguarda;;;;;;;;
Carrer del Pintor Jacomart;Hombre;Pintor Jacomart;;;;;;;;
Carrer de Rodríguez Cepeda;Hombre;Rodríguez Cepeda;;;;;;;;
Carrer de l'Actor Llorens;Hombre;l'Actor Llorens;;;;;;;;
Plaça de Sant Felip Neri;Hombre;Sant Felip Neri;;;;;;;;
Carrer de Salvador Pau;Hombre;Salvador Pau;;;;;;;;
Carrer d'Abén Al-Abbar;Hombre;Abén Al-Abbar;;;;;;;;
Carrer d'Andrés Mancebo;Hombre;Andrés Mancebo;;;;;;;;
Carrer de Roderic d'Osona;Hombre;Roderic d'Osona;;;;;;;;
Carrer de Josep Faus;Hombre;Josep Faus;;;;;;;;
Plaça de Dom Bosco (Salesià);Hombre;Dom Bosco (Salesià);;;;;;;;
Avinguda d'Ernest Lluch Martí;Hombre;Ernest Lluch Martí;;;;;;;;
Carrer del Comte de Torrefiel;Hombre;Comte de Torrefiel;;;;;;;;
Carrer Doctor Rodríguez de la Fuente;Hombre;Doctor Rodríguez de la Fuente;;;;;;;;
Carrer de l'Erudit Pagés;Hombre;l'Erudit Pagés;;;;;;;;
Carrer de Juan Piñol;Hombre;Juan Piñol;;;;;;;;
Carrer del Mestre Marçal;Hombre;Mestre Marçal;;;;;;;;
Carrer de Ferrer i Bigné;Hombre;Ferrer i Bigné;;;;;;;;
Carrer del Retor Aguilar;Hombre;Retor Aguilar;;;;;;;;
Carrer d'Ismael Merlo;Hombre;Ismael Merlo;;;;;;;;
Carrer de Josep Soto Micó;Hombre;Josep Soto Micó;;;;;;;;
Carrer d'Enrique Viedma Vidal (Arquitecte);Hombre;Enrique Viedma Vidal (Arquitecte);;;;;;;;
Carrer de Martí Domínguez Barberà (Periodista);Hombre;Martí Domínguez Barberà (Periodista);;;;;;;;
Carrer de José Melià Sinisterra;Hombre;José Melià Sinisterra;;;;;;;;
Carrer d'Octavio Vicent (Escultor);Hombre;Octavio Vicent (Escultor);;;;;;;;
Plaça de Vicente Alcober Coloma (Professor);Hombre;Vicente Alcober Coloma (Professor);;;;;;;;
Carrer de Godofred Ros;Hombre;Godofred Ros;;;;;;;;
Carrer de Fray Pedro Ponce de León;Hombre;Fray Pedro Ponce de León;;;;;;;;
Carrer de Pere Aleixandre;Hombre;Pere Aleixandre;;;;;;;;
Carrer de l'Hort de Sant Valeri;Hombre;l'Hort de Sant Valeri;;;;;;;;
Carrer de Luis Arcas (Pintor);Hombre;Luis Arcas (Pintor);;;;;;;;
Carrer d'Òscar Esplà;Hombre;Òscar Esplà;;;;;;;;
Carrer de l'Arabista Ambrosio Huici;Hombre;l'Arabista Ambrosio Huici;;;;;;;;
Carrer de Nino Bravo (Cantant);Hombre;Nino Bravo (Cantant);;;;;;;;
Carrer de José Durán Martínez;Hombre;José Durán Martínez;;;;;;;;
Carrer de Severiano Goig;Hombre;Severiano Goig;;;;;;;;
Carrer d'Antonio Sacramento (Escultor);Hombre;Antonio Sacramento (Escultor);;;;;;;;
Carrer de l'Escriptor Rafael Ferreres;Hombre;l'Escriptor Rafael Ferreres;;;;;;;;
Carrer de Ricardo Muñoz Suay;Hombre;Ricardo Muñoz Suay;;;;;;;;
Carrer del Poeta Josep Cervera i Grifol;Hombre;Poeta Josep Cervera i Grifol;;;;;;;;
Carrer del Marqués de Lozoya;Hombre;Marqués de Lozoya;;;;;;;;
Plaça de Miguel Asíns Arbó (compositor);Hombre;Miguel Asíns Arbó (compositor);;;;;;;;
Carrer del Mestre Bellver;Hombre;Mestre Bellver;;;;;;;;
Carrer de Francesc de Llano;Hombre;Francesc de Llano;;;;;;;;
Carrer de Mariano Ribera;Hombre;Mariano Ribera;;;;;;;;
Carrer del Pintor Pasqual Capuz;Hombre;Pintor Pasqual Capuz;;;;;;;;
Carrer de l'Impressor Montfort;Hombre;l'Impressor Montfort;;;;;;;;
Carrer de Ramon de Castro;Hombre;Ramon de Castro;;;;;;;;
Carrer de Mossén Fenollar;Hombre;Mossén Fenollar;;;;;;;;
Carrer del Baró de Patraix;Hombre;Baró de Patraix;;;;;;;;
Carrer Dibuixant Manuel Gago;Hombre;Dibuixant Manuel Gago;;;;;;;;
Carrer del Convent de Jesús;Hombre;Convent de Jesús;;;;;;;;
Carrer del Professor Blanco;Hombre;Professor Blanco;;;;;;;;
Avinguda de José Roca Coll (Pianista);Hombre;José Roca Coll (Pianista);;;;;;;;
Carrer de Juan de Garay;Hombre;Juan de Garay;;;;;;;;
Carrer de Fra J. Rodríguez;Hombre;Fra J. Rodríguez;;;;;;;;
Carrer de Gaspar Torrella;Hombre;Gaspar Torrella;;;;;;;;
Carrer del Doctor Marañón;Hombre;Doctor Marañón;;;;;;;;
Carrer del Pintor Cortina;Hombre;Pintor Cortina;;;;;;;;
Carrer de Ramon de Perellós;Hombre;Ramon de Perellós;;;;;;;;
Carrer de Josep Saragossa;Hombre;Josep Saragossa;;;;;;;;
Carrer de Folch de Cardona;Hombre;Folch de Cardona;;;;;;;;
Carrer de Vicente Parra (Actor);Hombre;Vicente Parra (Actor);;;;;;;;
Carrer de Julián Peña;Hombre;Julián Peña;;;;;;;;
Carrer de José Pérez-Fuster;Hombre;José Pérez-Fuster;;;;;;;;
Carrer del Marqués d'Elx;Hombre;Marqués d'Elx;;;;;;;;
Carrer de Manuel Simó;Hombre;Manuel Simó;;;;;;;;
Carrer del Canogne Tàrrega;Hombre;Canogne Tàrrega;;;;;;;;
Carrer del Pintor Agrassot;Hombre;Pintor Agrassot;;;;;;;;
Carrer del Músic Ayllón;Hombre;Músic Ayllón;;;;;;;;
Carrer de Guillem Despuig;Hombre;Guillem Despuig;;;;;;;;
Carrer de Joan Fuster (escriptor);Hombre;Joan Fuster (escriptor);;;;;;;;
Carrer de Norman Bethune (metge);Hombre;Norman Bethune (metge);;;;;;;;
Carrer de Josep Maestre;Hombre;Josep Maestre;;;;;;;;
Plaça de Ferran Ferrando;Hombre;Ferran Ferrando;;;;;;;;
Carrer de Miquel Paredes;Hombre;Miquel Paredes;;;;;;;;
Carrer de Lleó;Hombre;Lleó;;;;;;;;
Carrer del Doctor Enric López;Hombre;Doctor Enric López;;;;;;;;
Carrer de Josep Barberà Falcó;Hombre;Josep Barberà Falcó;;;;;;;;
Carrer de José Bosch Herrero;Hombre;José Bosch Herrero;;;;;;;;
Carrer de José María Mortes Lerma;Hombre;José María Mortes Lerma;;;;;;;;
Carrer de Josep Sanchis (Dibuixant);Hombre;Josep Sanchis (Dibuixant);;;;;;;;
Carrer de Fra Juníper Serra;Hombre;Fra Juníper Serra;;;;;;;;
Carrer d'Emili Lluch;Hombre;Emili Lluch;;;;;;;;
Carrer del Ceramista Ros;Hombre;Ceramista Ros;;;;;;;;
Carrer de Churat i Saurí;Hombre;Churat i Saurí;;;;;;;;
Plaça d'Artur Piera;Hombre;Artur Piera;;;;;;;;
Carrer del Mestre Asensi;Hombre;Mestre Asensi;;;;;;;;
Carrer de l'Alcalde Albors;Hombre;l'Alcalde Albors;;;;;;;;
Carrer del Doctor Sempere;Hombre;Doctor Sempere;;;;;;;;
Carrer de Cerdà i Rico;Hombre;Cerdà i Rico;;;;;;;;
Carrer del Poeta Alberola;Hombre;Poeta Alberola;;;;;;;;
Carrer de Nicolás de Estevánez;Hombre;Nicolás de Estevánez;;;;;;;;
Carrer de Joan Baptista Vives;Hombre;Joan Baptista Vives;;;;;;;;
Carrer del Pintor Stolz;Hombre;Pintor Stolz;;;;;;;;
Carrer de Navarro Cabanes;Hombre;Navarro Cabanes;;;;;;;;
Carrer de Lluís Lamarca;Hombre;Lluís Lamarca;;;;;;;;
Carrer de Mossén Jordi;Hombre;Mossén Jordi;;;;;;;;
Carrer de Goya;Hombre;Goya;;;;;;;;
Carrer de Manolo Taberner;Hombre;Manolo Taberner;;;;;;;;
Carrer de Francisco Moreno Usedo;Hombre;Francisco Moreno Usedo;;;;;;;;
Carrer de Velázquez;Hombre;Velázquez;;;;;;;;
Carrer dels Germans Rivas;Hombre;Germans Rivas;;;;;;;;
Plaça de l'Escultor Frechina;Hombre;l'Escultor Frechina;;;;;;;;
Carrer de Pere Andreu;Hombre;Pere Andreu;;;;;;;;
Carrer de Paco Sanz;Hombre;Paco Sanz;;;;;;;;
Carrer de Beethoven;Hombre;Beethoven;;;;;;;;
Plaça del Pintor Rigoberto Soler;Hombre;Pintor Rigoberto Soler;;;;;;;;
Carrer de Mora i Xaraba;Hombre;Mora i Xaraba;;;;;;;;
Carrer del Poeta Francesc Caballero Muñoz;Hombre;Poeta Francesc Caballero Muñoz;;;;;;;;
Carrer de Manuel Arnau;Hombre;Manuel Arnau;;;;;;;;
Carrer de Mossén Febrer;Hombre;Mossén Febrer;;;;;;;;
Carrer de Fernández de Mesa;Hombre;Fernández de Mesa;;;;;;;;
Carrer de Bernat Morales Sanmartín;Hombre;Bernat Morales Sanmartín;;;;;;;;
Plaça de l'Escultor Víctor Hino;Hombre;l'Escultor Víctor Hino;;;;;;;;
Plaça del Ceramista Gimeno;Hombre;Ceramista Gimeno;;;;;;;;
Plaça de Nicolás Ferrer i Julve (Rector);Hombre;Nicolás Ferrer i Julve (Rector);;;;;;;;
Carrer de Manuel Izquierdo;Hombre;Manuel Izquierdo;;;;;;;;
Carrer de Lluís Alcanyís (Metge);Hombre;Lluís Alcanyís (Metge);;;;;;;;
Carrer Diputat Molina Conejero;Hombre;Diputat Molina Conejero;;;;;;;;
Carrer de Guillem Jàfer;Hombre;Guillem Jàfer;;;;;;;;
Carrer de Carlos Caballé Lancry;Hombre;Carlos Caballé Lancry;;;;;;;;
Carrer del Doctor Julián Celma;Hombre;Doctor Julián Celma;;;;;;;;
Carrer del Gravador Jordán;Hombre;Gravador Jordán;;;;;;;;
Carrer de Julio Romero Mocholí;Hombre;Julio Romero Mocholí;;;;;;;;
Carrer de Mossén Palanca;Hombre;Mossén Palanca;;;;;;;;
Carrer de Julián Gayarre;Hombre;Julián Gayarre;;;;;;;;
Carrer del Pintor Jover;Hombre;Pintor Jover;;;;;;;;
Carrer del Músic Chapí;Hombre;Músic Chapí;;;;;;;;
Carrer del Pare Presentat;Hombre;Pare Presentat;;;;;;;;
Plaça del Músic Cuesta;Hombre;Músic Cuesta;;;;;;;;
Plaça de Sant Doménec de Guzmán;Hombre;Sant Doménec de Guzmán;;;;;;;;
Carrer de Sant Marcel·lí;Hombre;Sant Marcel·lí;;;;;;;;
Carrer de l'Arquebisbe Olaechea;Hombre;l'Arquebisbe Olaechea;;;;;;;;
Carrer de l'Enginyer Manuel Cánovas;Hombre;l'Enginyer Manuel Cánovas;;;;;;;;
Carrer del Músic Cabanilles;Hombre;Músic Cabanilles;;;;;;;;
Carrer del Professor Antoni Ubieto;Hombre;Professor Antoni Ubieto;;;;;;;;
Carrer del Reverend Josep Noguera;Hombre;Reverend Josep Noguera;;;;;;;;
Carrer del Doctor Royo Vilanova;Hombre;Doctor Royo Vilanova;;;;;;;;
Carrer de Salvador Perles;Hombre;Salvador Perles;;;;;;;;
Carrer de Jaume March;Hombre;Jaume March;;;;;;;;
Avinguda del Doctor Ruiz i Comes;Hombre;Doctor Ruiz i Comes;;;;;;;;
Avinguda de Manuel Colomer Marco;Hombre;Manuel Colomer Marco;;;;;;;;
Avinguda del Poeta Federico García Lorca;Hombre;Poeta Federico García Lorca;;;;;;;;
Carrer de Rafael Lapesa Melgar;Hombre;Rafael Lapesa Melgar;;;;;;;;
Carrer del Pintor Rafael Solbes;Hombre;Pintor Rafael Solbes;;;;;;;;
Carrer de Pedro Sucías Historiador;Hombre;Pedro Sucías Historiador;;;;;;;;
Plaça del Rei Alfons El Benigne;Hombre;Rei Alfons El Benigne;;;;;;;;
Carrer del Rei Saud;Hombre;Rei Saud;;;;;;;;
Plaça del Doctor Berenguer Ferrer;Hombre;Doctor Berenguer Ferrer;;;;;;;;
Carrer d'Alessandro Volta;Hombre;Alessandro Volta;;;;;;;;
Carrer de Santiago de Lés;Hombre;Santiago de Lés;;;;;;;;
Calle Antonio Machado;Hombre;Antonio Machado;;;;;;;;
Carrer de Josep Maria Bayarri;Hombre;Josep Maria Bayarri;;;;;;;;
Carrer del Pare Esteban Pernet;Hombre;Pare Esteban Pernet;;;;;;;;
Plaça de Miquel Adlert Noguerol;Hombre;Miquel Adlert Noguerol;;;;;;;;
Plaça de Pere Maria Orts i Bosch (Historiador);Hombre;Pere Maria Orts i Bosch (Historiador);;;;;;;;
Carrer de Vicente Blasco García;Hombre;Vicente Blasco García;;;;;;;;
Carrer de l'Arquitecte Ribes;Hombre;l'Arquitecte Ribes;;;;;;;;
Senda de Sant Miquel de Soternes;Hombre;Sant Miquel de Soternes;;;;;;;;
Carrer de Salvador Salom;Hombre;Salvador Salom;;;;;;;;
Carrer del Poeta Alberto Lisla;Hombre;Poeta Alberto Lisla;;;;;;;;
Plaça del Saineter Arniches;Hombre;Saineter Arniches;;;;;;;;
Carrer d'Eduard Soler i Pérez;Hombre;Eduard Soler i Pérez;;;;;;;;
Carrer de Vicente Rios Enrique;Hombre;Vicente Rios Enrique;;;;;;;;
Carrer del Pare Barranco;Hombre;Pare Barranco;;;;;;;;
Carrer d'Evaristo Crespo Azorín;Hombre;Evaristo Crespo Azorín;;;;;;;;
Carrer de Miquel Navarro (Escultor);Hombre;Miquel Navarro (Escultor);;;;;;;;
Carrer d'Enric Valor i Vives;Hombre;Enric Valor i Vives;;;;;;;;
Carrer de Luis Buñuel;Hombre;Luis Buñuel;;;;;;;;
Carrer de Rafael Alberti;Hombre;Rafael Alberti;;;;;;;;
Carrer d'Artur Ballester;Hombre;Artur Ballester;;;;;;;;
Carrer de Carlos Ruano Llopis (Pintor);Hombre;Carlos Ruano Llopis (Pintor);;;;;;;;
Carrer de Sant Clement;Hombre;Sant Clement;;;;;;;;
Carrer del Pintor Matarana;Hombre;Pintor Matarana;;;;;;;;
Carrer del Pare Fernando Casanova Benlloch;Hombre;Pare Fernando Casanova Benlloch;;;;;;;;
Carrer de Josep Bea i Izquierdo;Hombre;Josep Bea i Izquierdo;;;;;;;;
Carrer del Tenor Lauri Volpi;Hombre;Tenor Lauri Volpi;;;;;;;;
Carrer de Francesc Tàrrega;Hombre;Francesc Tàrrega;;;;;;;;
Carrer del Ceramista Mateu;Hombre;Ceramista Mateu;;;;;;;;
Carrer de Sant Roc;Hombre;Sant Roc;;;;;;;;
Carrer de Jaume II;Hombre;Jaume II;;;;;;;;
